DISTRITO FEDERAL;LICENCIATURA EN COMUNICACI흁 AUDIO VISUAL;91;43;48;91;40;36;76;112;122;234;16;8;24
DISTRITO FEDERAL;LICENCIATURA EN COMUNICACI흁 DIGITAL;0;0;0;0;0;0;0;1;0;1;0;0;0
DISTRITO FEDERAL;LICENCIATURA EN COMUNICACI흁 GR첹ICA;0;0;0;0;0;0;0;0;0;0;6;6;12
DISTRITO FEDERAL;LICENCIATURA EN COMUNICACI흁 HUMANA;0;0;0;0;0;19;19;0;67;67;1;18;19
DISTRITO FEDERAL;LICENCIATURA EN COMUNICACI흁 MULTIMEDIA;49;29;20;49;29;20;49;104;72;176;4;5;9
DISTRITO FEDERAL;LICENCIATURA EN COMUNICACI흁 ORGANIZACIONAL;15;4;4;8;4;1;5;5;13;18;1;2;3
DISTRITO FEDERAL;LICENCIATURA EN COMUNICACI흁 SOCIAL;272;865;1300;2165;99;126;225;515;605;1120;101;103;204
DISTRITO FEDERAL;LICENCIATURA EN COMUNICACI흁 VISUAL;50;22;32;54;14;25;39;116;192;308;37;46;83
DISTRITO FEDERAL;LICENCIATURA EN COMUNICACI흁 Y CULTURA;295;880;1336;2216;121;158;279;896;1298;2194;12;30;42
DISTRITO FEDERAL;LICENCIATURA EN COMUNICACI흁 Y GESTI흁 DE LA CULTURA Y LAS ARTES;15;3;9;12;2;9;11;8;33;41;0;2;2
DISTRITO FEDERAL;LICENCIATURA EN COMUNICACI흁 Y MEDIOS DIGITALES;70;24;46;70;13;30;43;44;93;137;0;0;0
DISTRITO FEDERAL;LICENCIATURA EN COMUNICACI흁 Y MULTIMEDIOS;30;7;18;25;7;9;16;14;40;54;2;9;11
DISTRITO FEDERAL;LICENCIATURA EN COMUNICACI흁 Y RELACIONES P２LICAS;73;35;38;73;19;20;39;76;89;165;18;39;57
DISTRITO FEDERAL;LICENCIATURA EN CONCERTISTA DE ARPA;4;0;1;1;0;1;1;0;1;1;0;0;0
DISTRITO FEDERAL;LICENCIATURA EN CONCERTISTA DE CANTO;4;3;4;7;0;1;1;0;1;1;0;1;1
DISTRITO FEDERAL;LICENCIATURA EN CONCERTISTA DE CLARINETE;4;3;4;7;1;0;1;2;3;5;0;1;1
DISTRITO FEDERAL;LICENCIATURA EN CONCERTISTA DE CONTRABAJO;4;16;0;16;2;0;2;3;1;4;1;0;1
DISTRITO FEDERAL;LICENCIATURA EN CONCERTISTA DE CORNO FRANC텝;4;5;0;5;1;0;1;5;0;5;0;0;0
DISTRITO FEDERAL;LICENCIATURA EN CONCERTISTA DE DIRECCI흁 DE ORQUESTA;4;9;0;9;1;0;1;4;1;5;0;0;0
DISTRITO FEDERAL;LICENCIATURA EN CONCERTISTA DE FAGOT;4;3;0;3;0;0;0;1;1;2;1;1;2
DISTRITO FEDERAL;LICENCIATURA EN CONCERTISTA DE FLAUTA;5;3;8;11;2;2;4;4;3;7;0;0;0
DISTRITO FEDERAL;LICENCIATURA EN CONCERTISTA DE GUITARRA;5;7;3;10;0;0;0;5;1;6;0;0;0
DISTRITO FEDERAL;LICENCIATURA EN CONCERTISTA DE OBOE;4;3;1;4;0;1;1;1;1;2;0;0;0
DISTRITO FEDERAL;LICENCIATURA EN CONCERTISTA DE PERCUSIONES;5;7;4;11;0;0;0;3;0;3;1;0;1
DISTRITO FEDERAL;LICENCIATURA EN CONCERTISTA DE PIANO;5;4;3;7;2;1;3;5;2;7;2;1;3
DISTRITO FEDERAL;LICENCIATURA EN CONCERTISTA DE SAXOF흁;4;4;3;7;0;0;0;1;1;2;2;0;2
DISTRITO FEDERAL;LICENCIATURA EN CONCERTISTA DE TROMB흁;4;8;1;9;0;0;0;5;0;5;1;0;1
DISTRITO FEDERAL;LICENCIATURA EN CONCERTISTA DE TROMPETA;5;11;0;11;4;0;4;8;0;8;0;0;0
DISTRITO FEDERAL;LICENCIATURA EN CONCERTISTA DE TUBA;4;6;0;6;1;0;1;4;0;4;0;0;0
DISTRITO FEDERAL;LICENCIATURA EN CONCERTISTA DE VIOLA;4;5;4;9;1;1;2;3;3;6;0;0;0
DISTRITO FEDERAL;LICENCIATURA EN CONCERTISTA DE VIOL펥;5;15;21;36;3;2;5;9;6;15;2;4;6
DISTRITO FEDERAL;LICENCIATURA EN CONCERTISTA DE VIOLONCELLO;6;11;9;20;1;5;6;4;10;14;1;1;2
DISTRITO FEDERAL;LICENCIATURA EN CONTABILIDAD;40;0;0;0;0;0;0;0;0;0;0;4;4
DISTRITO FEDERAL;LICENCIATURA EN CONTABILIDAD Y FINANZAS;100;11;17;28;11;17;28;19;19;38;5;6;11
DISTRITO FEDERAL;LICENCIATURA EN CONTADOR P２LICO;98;33;45;78;7;11;18;26;36;62;7;11;18
DISTRITO FEDERAL;LICENCIATURA EN CONTADUR페;2055;592;509;1101;1247;1309;2556;4719;4775;9494;999;1121;2120
DISTRITO FEDERAL;LICENCIATURA EN CONTADUR페 P２LICA;1042;306;291;597;280;274;554;1299;1343;2642;188;186;374
DISTRITO FEDERAL;LICENCIATURA EN CONTADUR페 P２LICA Y ESTRATEGIA FINANCIERA;52;28;24;52;15;12;27;117;81;198;15;12;27
DISTRITO FEDERAL;LICENCIATURA EN CONTADUR페 P２LICA Y FINANZAS;134;85;83;168;99;106;205;384;384;768;77;59;136
DISTRITO FEDERAL;LICENCIATURA EN CONTADUR페 Y FINANZAS;470;73;53;126;55;41;96;152;128;280;9;13;22
DISTRITO FEDERAL;LICENCIATURA EN CONTADUR페 Y GESTI흁 FINANCIERA;122;62;55;117;62;55;117;107;90;197;0;0;0
DISTRITO FEDERAL;LICENCIATURA EN CONTRABAJO;25;6;1;7;6;0;6;22;4;26;2;0;2
DISTRITO FEDERAL;LICENCIATURA EN COREOGRAF페;30;7;12;19;3;6;9;5;19;24;0;2;2
DISTRITO FEDERAL;LICENCIATURA EN CORNO FRANC텝;17;2;2;4;2;1;3;18;3;21;0;1;1
DISTRITO FEDERAL;LICENCIATURA EN CREACI흁 LITERARIA REA NOVELA;260;319;392;711;95;115;210;332;366;698;0;2;2
DISTRITO FEDERAL;LICENCIATURA EN CREACI흁 Y ADMINISTRACI흁 DE PYMES;0;0;0;0;8;3;11;8;3;11;0;0;0
DISTRITO FEDERAL;LICENCIATURA EN CREACI흁 Y DESARROLLO DE EMPRESAS;63;45;28;73;32;17;49;160;75;235;3;5;8
DISTRITO FEDERAL;LICENCIATURA EN CRIMINAL펩TICA;60;28;32;60;366;393;759;984;937;1921;0;0;0
DISTRITO FEDERAL;LICENCIATURA EN CRIMINOLOG페 Y CRIMINAL펩TICA;225;109;134;243;104;114;218;285;420;705;23;42;65
DISTRITO FEDERAL;LICENCIATURA EN DANZA CL쳅ICA;85;3;39;42;0;9;9;0;54;54;0;8;8
DISTRITO FEDERAL;LICENCIATURA EN DANZA CL쳅ICA CON L펥EA DE TRABAJO DE BAILAR펥;300;5;155;160;3;18;21;17;56;73;1;4;5
DISTRITO FEDERAL;LICENCIATURA EN DANZA CL쳅ICA CON L펥EA DE TRABAJO DE BAILAR펥 (PLAN ESPECIAL PARA VARONES);50;28;0;28;9;0;9;23;0;23;3;0;3
DISTRITO FEDERAL;LICENCIATURA EN DANZA CL쳅ICA CON L펥EA DE TRABAJO DE DOCENCIA;50;0;13;13;0;7;7;0;12;12;0;4;4
DISTRITO FEDERAL;LICENCIATURA EN DANZA CL쳅ICA CON L펥EA DE TRABAJO DE DOCENCIA (PLAN ESPECIAL PARA VARONES);50;0;0;0;0;0;0;4;0;4;0;0;0
DISTRITO FEDERAL;LICENCIATURA EN DANZA CONTEMPOR쳁EA;280;37;224;261;11;28;39;42;109;151;5;15;20
DISTRITO FEDERAL;LICENCIATURA EN DANZA FOLKLRICA;64;35;78;113;11;25;36;38;91;129;11;20;31
DISTRITO FEDERAL;LICENCIATURA EN DANZA POPULAR MEXICANA;28;8;16;24;5;7;12;15;17;32;1;9;10
DISTRITO FEDERAL;LICENCIATURA EN DERECHO;6388;4834;5612;10446;4043;3955;7998;17988;16951;34939;2668;2718;5386
DISTRITO FEDERAL;LICENCIATURA EN DERECHO (EJECUTIVA);30;64;54;118;57;45;102;192;164;356;22;18;40
DISTRITO FEDERAL;LICENCIATURA EN DERECHO BUROCR쳆ICO;1799;850;934;1784;850;934;1784;2025;2151;4176;419;380;799
DISTRITO FEDERAL;LICENCIATURA EN DERECHO Y CIENCIAS POL펪ICAS;23;14;12;26;8;4;12;27;12;39;0;0;0
DISTRITO FEDERAL;LICENCIATURA EN DERECHO Y ECONOM페;12;7;3;10;7;3;10;36;16;52;0;0;0
DISTRITO FEDERAL;LICENCIATURA EN DERECHO Y FINANZAS;12;11;6;17;8;15;23;16;27;43;0;0;0
DISTRITO FEDERAL;LICENCIATURA EN DERECHOS HUMANOS Y GESTI흁 DE PAZ;24;6;18;24;6;13;19;14;45;59;0;0;0
DISTRITO FEDERAL;LICENCIATURA EN DESARROLLO COMUNITARIO;2000;427;791;1218;427;791;1218;1005;1753;2758;0;0;0
DISTRITO FEDERAL;LICENCIATURA EN DESARROLLO EMPRESARIAL Y DE NEGOCIOS;25;1;2;3;1;2;3;5;7;12;0;0;0
DISTRITO FEDERAL;LICENCIATURA EN DESARROLLO HUMANO;0;5;8;13;5;8;13;9;16;25;4;16;20
DISTRITO FEDERAL;LICENCIATURA EN DESARROLLO Y GESTI흁 INTERCULTURALES;0;0;0;0;22;63;85;54;149;203;3;13;16
DISTRITO FEDERAL;LICENCIATURA EN DIET텞ICA Y NUTRICI흁;60;17;107;124;5;55;60;20;198;218;0;0;0
DISTRITO FEDERAL;LICENCIATURA EN DIRECCI흁;4;2;0;2;1;0;1;1;0;1;1;0;1
DISTRITO FEDERAL;LICENCIATURA EN DIRECCI흁 CORAL;15;2;1;3;1;0;1;4;1;5;0;0;0
DISTRITO FEDERAL;LICENCIATURA EN DIRECCI흁 DE VENTAS (EJECUTIVA);15;5;6;11;4;5;9;21;14;35;0;0;0
DISTRITO FEDERAL;LICENCIATURA EN DIRECCI흁 FINANCIERA;99;77;22;99;54;13;67;131;47;178;0;0;0
DISTRITO FEDERAL;LICENCIATURA EN DIRECCI흁 Y ADMINISTRACI흁 DE EMPRESAS;68;40;28;68;11;5;16;68;23;91;1;0;1
DISTRITO FEDERAL;LICENCIATURA EN DISE헲;519;283;319;602;63;79;142;252;292;544;19;32;51
DISTRITO FEDERAL;LICENCIATURA EN DISE헲 DE ANIMACI흁;30;19;11;30;14;6;20;47;19;66;0;0;0
DISTRITO FEDERAL;LICENCIATURA EN DISE헲 DE INTERIORES;72;30;27;57;18;24;42;29;76;105;0;6;6
DISTRITO FEDERAL;LICENCIATURA EN DISE헲 DE LA COMUNICACI흁 GR첹ICA;385;3930;4845;8775;161;162;323;905;708;1613;115;97;212
DISTRITO FEDERAL;LICENCIATURA EN DISE헲 DE LA COMUNICACI흁 VISUAL;42;18;24;42;10;12;22;25;67;92;8;21;29
DISTRITO FEDERAL;LICENCIATURA EN DISE헲 DE LA MODA E INDUSTRIA DEL VESTIDO;75;6;60;66;4;40;44;10;71;81;0;0;0
DISTRITO FEDERAL;LICENCIATURA EN DISE헲 DE MOBILIARIO Y PRODUCTO;0;0;0;0;0;0;0;39;45;84;5;7;12
DISTRITO FEDERAL;LICENCIATURA EN DISE헲 DE MODAS;137;24;148;172;18;102;120;55;299;354;2;13;15
DISTRITO FEDERAL;LICENCIATURA EN DISE헲 DE MODAS Y MERCADOTECNIA;30;3;15;18;1;11;12;1;35;36;1;9;10
DISTRITO FEDERAL;LICENCIATURA EN DISE헲 DE MODAS Y TEXTILES;15;5;20;25;3;12;15;4;57;61;10;33;43
DISTRITO FEDERAL;LICENCIATURA EN DISE헲 DIGITAL;6;15;9;24;4;2;6;26;13;39;2;4;6
DISTRITO FEDERAL;LICENCIATURA EN DISE헲 GR첹ICO;1869;645;635;1280;695;681;1376;2541;2901;5442;322;458;780
DISTRITO FEDERAL;LICENCIATURA EN DISE헲 GR첹ICO DIGITAL;30;15;10;25;10;10;20;10;10;20;0;0;0
DISTRITO FEDERAL;LICENCIATURA EN DISE헲 GR첹ICO Y ANIMACI흁;30;5;13;18;3;10;13;10;27;37;4;5;9
DISTRITO FEDERAL;LICENCIATURA EN DISE헲 INDUSTRIAL;525;1360;1162;2522;189;197;386;1264;1164;2428;192;197;389
DISTRITO FEDERAL;LICENCIATURA EN DISE헲 INTERACTIVO;15;8;7;15;6;4;10;95;52;147;26;14;40
DISTRITO FEDERAL;LICENCIATURA EN DISE헲 INTERIOR ARQUITECT흁ICO;60;10;50;60;3;41;44;11;138;149;1;24;25
DISTRITO FEDERAL;LICENCIATURA EN DISE헲 PUBLICITARIO;120;57;77;134;21;28;49;88;94;182;22;26;48
DISTRITO FEDERAL;LICENCIATURA EN DISE헲 TEXTIL;49;1;48;49;2;28;30;15;289;304;2;46;48
DISTRITO FEDERAL;LICENCIATURA EN DISE헲 TEXTIL Y MODAS;0;0;0;0;0;0;0;20;98;118;1;25;26
DISTRITO FEDERAL;LICENCIATURA EN DISE헲 Y COMUNICACI흁 VISUAL;0;0;0;0;178;424;602;778;1746;2524;168;359;527
DISTRITO FEDERAL;LICENCIATURA EN DISE헲 Y CREATIVIDAD VISUAL;50;23;27;50;23;27;50;38;54;92;4;9;13
DISTRITO FEDERAL;LICENCIATURA EN DISE헲 Y PUBLICIDAD EN MODA;80;5;45;50;5;39;44;22;208;230;2;19;21
DISTRITO FEDERAL;LICENCIATURA EN DOCENCIA TECNOL휺ICA;0;0;0;0;0;0;0;48;69;117;11;23;34
DISTRITO FEDERAL;LICENCIATURA EN ECONOM페;1903;2097;1879;3976;1635;1044;2679;7235;5134;12369;875;754;1629
DISTRITO FEDERAL;LICENCIATURA EN ECONOM페 FINANCIERA;40;17;7;24;12;3;15;60;32;92;17;9;26
DISTRITO FEDERAL;LICENCIATURA EN ECONOM페 INDUSTRIAL;0;0;0;0;9;10;19;9;10;19;0;0;0
DISTRITO FEDERAL;LICENCIATURA EN ECONOM페 POL펪ICA;8;5;3;8;4;0;4;12;5;17;0;0;0
DISTRITO FEDERAL;LICENCIATURA EN ECONOM페 Y FINANZAS;36;40;10;50;24;5;29;56;19;75;0;0;0
DISTRITO FEDERAL;LICENCIATURA EN ECONOM페 Y FINANZAS INTERNACIONALES;0;4;1;5;0;0;0;3;2;5;3;2;5
DISTRITO FEDERAL;LICENCIATURA EN EDUCACI흁;29;11;16;27;7;8;15;15;46;61;0;3;3
DISTRITO FEDERAL;LICENCIATURA EN EDUCACI흁 DANC펩TICA CON ORIENTACI흁 EN DANZA CONTEMPOR쳁EA;70;5;43;48;2;16;18;11;40;51;1;7;8
DISTRITO FEDERAL;LICENCIATURA EN EDUCACI흁 DANC펩TICA CON ORIENTACI흁 EN DANZA ESPA헲LA;45;6;29;35;5;14;19;10;33;43;0;5;5
DISTRITO FEDERAL;LICENCIATURA EN EDUCACI흁 DANC펩TICA CON ORIENTACI흁 EN DANZA FOLKLRICA;45;4;20;24;3;12;15;11;36;47;4;5;9
DISTRITO FEDERAL;LICENCIATURA EN EDUCACI흁 DE ADULTOS;0;0;0;0;0;0;0;1;13;14;7;8;15
DISTRITO FEDERAL;LICENCIATURA EN EDUCACI흁 ESPECIAL;265;12;249;261;8;159;167;42;615;657;9;143;152
DISTRITO FEDERAL;LICENCIATURA EN EDUCACI흁 FAMILIAR;89;18;71;89;18;71;89;53;197;250;1;11;12
DISTRITO FEDERAL;LICENCIATURA EN EDUCACI흁 F펩ICA;410;1150;513;1663;224;173;397;766;664;1430;154;144;298
DISTRITO FEDERAL;LICENCIATURA EN EDUCACI흁 IND펞ENA;177;83;94;177;35;52;87;102;141;243;24;28;52
DISTRITO FEDERAL;LICENCIATURA EN EDUCACI흁 MEDIA SUPERIOR INTERCULTURAL;140;60;80;140;51;53;104;169;282;451;17;43;60
DISTRITO FEDERAL;LICENCIATURA EN EDUCACI흁 MUSICAL;50;2;4;6;4;5;9;39;31;70;6;6;12
DISTRITO FEDERAL;LICENCIATURA EN EDUCACI흁 PREESCOLAR;647;3;971;974;3;354;357;3;1677;1680;0;410;410
DISTRITO FEDERAL;LICENCIATURA EN EDUCACI흁 PREESCOLAR CON TECNOLOG페S DE LA INFORMACI흁 Y COMUNICACI흁;139;2;133;135;2;133;135;9;440;449;0;0;0
DISTRITO FEDERAL;LICENCIATURA EN EDUCACI흁 PREESCOLAR CON TIC;0;0;0;0;0;0;0;3;57;60;0;0;0
DISTRITO FEDERAL;LICENCIATURA EN EDUCACI흁 PREESCOLAR Y PRIMARIA;124;20;104;124;20;104;124;78;836;914;71;716;787
DISTRITO FEDERAL;LICENCIATURA EN EDUCACI흁 PRIMARIA;765;136;761;897;58;407;465;362;1568;1930;73;349;422
DISTRITO FEDERAL;LICENCIATURA EN EDUCACI흁 SECUNDARIA;660;150;450;600;115;287;402;571;1321;1892;135;340;475
DISTRITO FEDERAL;LICENCIATURA EN EDUCACI흁 SECUNDARIA CON ESPECIALIDAD EN TELESECUNDARIA;14;3;5;8;1;3;4;15;24;39;2;10;12
DISTRITO FEDERAL;LICENCIATURA EN EMPRENDIMIENTO CULTURAL Y SOCIAL;8;3;5;8;0;2;2;2;7;9;0;0;0
DISTRITO FEDERAL;LICENCIATURA EN EMPRESAS TUR펩TICAS;20;8;5;13;2;2;4;3;5;8;0;0;0
DISTRITO FEDERAL;LICENCIATURA EN ENFERMER페;494;1013;2501;3514;244;578;822;708;2275;2983;103;357;460
DISTRITO FEDERAL;LICENCIATURA EN ENFERMER페 MILITAR;100;0;203;203;0;38;38;0;194;194;0;63;63
DISTRITO FEDERAL;LICENCIATURA EN ENFERMER페 Y OBSTETRICIA;988;346;1611;1957;246;1029;1275;846;4275;5121;203;1810;2013
DISTRITO FEDERAL;LICENCIATURA EN ENSE헤NZA DEL FRANC텝;25;9;16;25;9;16;25;29;54;83;1;6;7
DISTRITO FEDERAL;LICENCIATURA EN ENSE헤NZA DEL IDIOMA INGL텝;50;10;25;35;3;19;22;7;34;41;0;0;0
DISTRITO FEDERAL;LICENCIATURA EN ENSE헤NZA DEL INGL텝;30;0;0;0;0;0;0;56;87;143;0;0;0
DISTRITO FEDERAL;LICENCIATURA EN ERAPISTA EN COMUNICACI흁 HUMANA;30;6;42;48;2;26;28;4;73;77;2;33;35
DISTRITO FEDERAL;LICENCIATURA EN ESCENOGRAF페;60;12;39;51;4;9;13;20;33;53;1;8;9
DISTRITO FEDERAL;LICENCIATURA EN ESTOMATOLOG페;305;464;1090;1554;63;154;217;325;798;1123;77;185;262
DISTRITO FEDERAL;LICENCIATURA EN ESTUDIOS HUMAN펩TICOS;39;26;47;73;9;21;30;49;77;126;0;0;0
DISTRITO FEDERAL;LICENCIATURA EN ESTUDIOS LATINOAMERICANOS;0;0;0;0;36;49;85;191;257;448;40;52;92
DISTRITO FEDERAL;LICENCIATURA EN ESTUDIOS SOCIOTERRITORIALES;29;20;19;39;13;13;26;48;53;101;0;0;0
DISTRITO FEDERAL;LICENCIATURA EN ESTUDIOS Y GESTI흁 DE LA CULTURA;22;8;14;22;5;13;18;9;54;63;3;18;21
DISTRITO FEDERAL;LICENCIATURA EN ETNOMUSICOLOG페;0;0;0;0;2;2;4;13;9;22;2;2;4
DISTRITO FEDERAL;LICENCIATURA EN FAGOT;23;1;1;2;1;1;2;6;7;13;0;0;0
DISTRITO FEDERAL;LICENCIATURA EN FILOSOF페;267;294;204;498;451;199;650;1527;783;2310;201;89;290
DISTRITO FEDERAL;LICENCIATURA EN FILOSOF페 E HISTORIA DE LAS IDEAS;225;279;322;601;78;102;180;280;272;552;1;2;3
DISTRITO FEDERAL;LICENCIATURA EN FILOSOF페 Y COMUNICACI흁;0;0;0;0;0;0;0;0;0;0;1;0;1
DISTRITO FEDERAL;LICENCIATURA EN FINANZAS;38;7;29;36;22;13;35;279;158;437;58;43;101
DISTRITO FEDERAL;LICENCIATURA EN FINANZAS CORPORATIVAS Y BANCA;10;5;5;10;3;0;3;7;3;10;0;1;1
DISTRITO FEDERAL;LICENCIATURA EN FINANZAS Y BANCA;100;53;32;85;53;32;85;336;191;527;19;21;40
DISTRITO FEDERAL;LICENCIATURA EN FINANZAS Y CONTADUR페 P２LICA;5;3;2;5;1;0;1;10;9;19;0;0;0
DISTRITO FEDERAL;LICENCIATURA EN F펩ICA;156;151;55;206;356;109;465;1388;456;1844;169;59;228
DISTRITO FEDERAL;LICENCIATURA EN F펩ICA Y MATEM쳆ICAS;280;409;196;605;212;68;280;546;207;753;50;24;74
DISTRITO FEDERAL;LICENCIATURA EN FISIOTERAPIA;60;19;35;54;41;65;106;77;141;218;0;0;0
DISTRITO FEDERAL;LICENCIATURA EN FLAUTA;9;2;2;4;2;1;3;5;5;10;0;3;3
DISTRITO FEDERAL;LICENCIATURA EN FLAUTA TRANSVERSAL;30;5;3;8;2;2;4;17;21;38;0;2;2
DISTRITO FEDERAL;LICENCIATURA EN GASTRONOM페;1542;652;693;1345;516;531;1047;1748;1964;3712;265;350;615
DISTRITO FEDERAL;LICENCIATURA EN GASTRONOM페 Y ARTES CULINARIAS;50;34;55;89;16;27;43;92;134;226;20;31;51
DISTRITO FEDERAL;LICENCIATURA EN GEOGRAF페;0;0;0;0;145;130;275;626;485;1111;86;75;161
DISTRITO FEDERAL;LICENCIATURA EN GEOGRAF페 HUMANA;53;99;116;215;20;22;42;90;122;212;0;3;3
DISTRITO FEDERAL;LICENCIATURA EN GERONTOLOG페;22;5;17;22;5;17;22;5;30;35;0;0;0
DISTRITO FEDERAL;LICENCIATURA EN GESTI흁 DE NEGOCIOS TUR펩TICOS;90;2;14;16;2;10;12;15;62;77;6;16;22
DISTRITO FEDERAL;LICENCIATURA EN GESTI흁 Y ADMINISTRACI흁 DE PESQUER페 Y MEDIANA EMPRESA;5000;1620;2063;3683;1620;2063;3683;3574;4596;8170;0;0;0
DISTRITO FEDERAL;LICENCIATURA EN GOBIERNO Y ADMINISTRACI흁 P２LICA;0;0;0;0;0;0;0;26;14;40;9;7;16
DISTRITO FEDERAL;LICENCIATURA EN GUITARRA;125;78;20;98;30;2;32;128;17;145;2;1;3
DISTRITO FEDERAL;LICENCIATURA EN HIDROBIOLOG페;124;103;176;279;38;69;107;165;247;412;7;16;23
DISTRITO FEDERAL;LICENCIATURA EN HISTORIA;191;410;351;761;297;225;522;1209;1076;2285;143;133;276
DISTRITO FEDERAL;LICENCIATURA EN HISTORIA DEL ARTE;63;17;44;61;7;32;39;25;181;206;1;43;44
DISTRITO FEDERAL;LICENCIATURA EN HISTORIA Y COMUNICACI흁;0;0;0;0;0;0;0;1;1;2;0;1;1
DISTRITO FEDERAL;LICENCIATURA EN HISTORIA Y SOCIEDAD CONTEMPOR쳁EA;190;170;172;342;87;81;168;252;274;526;2;2;4
DISTRITO FEDERAL;LICENCIATURA EN HOTELER페;50;32;85;117;7;29;36;56;169;225;16;60;76
DISTRITO FEDERAL;LICENCIATURA EN HUMANIDADES;0;0;0;0;0;0;0;1;1;2;2;5;7
DISTRITO FEDERAL;LICENCIATURA EN HUMANIDADES Y CIENCIAS SOCIALES;10;1;6;7;0;0;0;5;26;31;0;1;1
DISTRITO FEDERAL;LICENCIATURA EN IDIOMAS;228;15;49;64;11;41;52;51;162;213;14;42;56
DISTRITO FEDERAL;LICENCIATURA EN IMAGEN CORPORATIVA Y RESPONSABILIDAD SOCIAL;0;0;0;0;0;1;1;0;1;1;0;0;0
DISTRITO FEDERAL;LICENCIATURA EN IMAGOLOG페;40;11;70;81;4;39;43;25;165;190;5;26;31
DISTRITO FEDERAL;LICENCIATURA EN INFORM쳆ICA;1280;682;313;995;748;235;983;2473;805;3278;302;132;434
DISTRITO FEDERAL;LICENCIATURA EN INFORM쳆ICA ADMINISTRATIVA;1074;129;90;219;149;69;218;589;254;843;120;51;171
DISTRITO FEDERAL;LICENCIATURA EN INFORM쳆ICA Y TECNOLOG페S DE INFORMACI흁;0;0;0;0;6;5;11;19;6;25;12;3;15
DISTRITO FEDERAL;LICENCIATURA EN INGENIER페 AMBIENTAL;30;18;16;34;14;12;26;25;34;59;0;0;0
DISTRITO FEDERAL;LICENCIATURA EN INGENIER페 BIOL휺ICA;20;15;16;31;7;6;13;31;43;74;0;0;0
DISTRITO FEDERAL;LICENCIATURA EN INGENIER페 CIBERN텞ICA Y SISTEMAS COMPUTACIONALES;60;31;4;35;31;4;35;133;34;167;16;8;24
DISTRITO FEDERAL;LICENCIATURA EN INGENIER페 CIVIL;30;25;5;30;332;59;391;1476;268;1744;193;38;231
DISTRITO FEDERAL;LICENCIATURA EN INGENIER페 DE DESARROLLO DE SOFTWARE;0;0;0;0;0;0;0;12;6;18;11;3;14
DISTRITO FEDERAL;LICENCIATURA EN INGENIER페 DE LA CONSTRUCCI흁;70;50;14;64;50;14;64;64;17;81;25;2;27
DISTRITO FEDERAL;LICENCIATURA EN INGENIER페 DE MINAS Y METALURGIA;0;0;0;0;48;10;58;201;34;235;16;4;20
DISTRITO FEDERAL;LICENCIATURA EN INGENIER페 DE SOFTWARE;230;419;209;628;144;74;218;241;125;366;0;0;0
DISTRITO FEDERAL;LICENCIATURA EN INGENIER페 EL텎TRICA Y ELECTR흁ICA;0;0;0;0;215;30;245;1338;160;1498;280;43;323
DISTRITO FEDERAL;LICENCIATURA EN INGENIER페 ELECTR흁ICA Y COMUNICACIONES;40;12;1;13;12;1;13;35;2;37;2;2;4
DISTRITO FEDERAL;LICENCIATURA EN INGENIER페 EN ALIMENTOS;20;1;19;20;1;12;13;11;37;48;3;8;11
DISTRITO FEDERAL;LICENCIATURA EN INGENIER페 EN COMPUTACI흁;0;0;0;0;359;93;452;1902;500;2402;244;104;348
DISTRITO FEDERAL;LICENCIATURA EN INGENIER페 EN ELECTROMEC쳁ICA;2;2;0;2;2;0;2;4;0;4;0;0;0
DISTRITO FEDERAL;LICENCIATURA EN INGENIER페 EN ELECTR흁ICA Y COMUNICACIONES;18;10;8;18;0;0;0;12;5;17;6;1;7
DISTRITO FEDERAL;LICENCIATURA EN INGENIER페 EN INTELIGENCIA DE MERCADOS;0;0;0;0;0;0;0;0;2;2;0;2;2
DISTRITO FEDERAL;LICENCIATURA EN INGENIER페 EN MECATR흁ICA;78;41;11;52;36;10;46;199;30;229;10;1;11
DISTRITO FEDERAL;LICENCIATURA EN INGENIER페 EN NEGOCIOS INTERNACIONALES;0;0;0;0;0;0;0;2;2;4;5;2;7
DISTRITO FEDERAL;LICENCIATURA EN INGENIER페 EN PROCESOS ORGANIZACIONALES;0;0;0;0;0;0;0;1;0;1;1;0;1
DISTRITO FEDERAL;LICENCIATURA EN INGENIER페 EN SEGURIDAD COMPUTACIONAL;0;0;0;0;0;0;0;11;0;11;11;0;11
DISTRITO FEDERAL;LICENCIATURA EN INGENIER페 EN SISTEMAS;3;2;1;3;2;1;3;97;30;127;0;0;0
DISTRITO FEDERAL;LICENCIATURA EN INGENIER페 EN SISTEMAS COMPUTACIONALES;619;260;65;325;237;50;287;1039;210;1249;125;24;149
DISTRITO FEDERAL;LICENCIATURA EN INGENIER페 EN SISTEMAS COMPUTACIONALES Y TECNOLOG페S DE LA INFORMACI흁;103;69;34;103;69;34;103;115;58;173;0;0;0
DISTRITO FEDERAL;LICENCIATURA EN INGENIER페 EN SISTEMAS DE COMPUTACI흁 ADMINISTRATIVA;30;7;5;12;4;2;6;23;8;31;10;4;14
DISTRITO FEDERAL;LICENCIATURA EN INGENIER페 EN SISTEMAS DE INFORMACI흁;50;25;20;45;23;11;34;86;28;114;6;6;12
DISTRITO FEDERAL;LICENCIATURA EN INGENIER페 EN SISTEMAS DIGITALES Y ROB흆ICA;0;0;0;0;23;6;29;23;6;29;0;0;0
DISTRITO FEDERAL;LICENCIATURA EN INGENIER페 EN SISTEMAS ENERG텞ICOS;120;35;21;56;49;22;71;49;22;71;1;0;1
DISTRITO FEDERAL;LICENCIATURA EN INGENIER페 EN SISTEMAS Y TELEM쳆ICA;90;5;0;5;0;0;0;4;1;5;10;0;10
DISTRITO FEDERAL;LICENCIATURA EN INGENIER페 EN TECNOLOG페 INTERACTIVA EN ANIMACI흁 DIGITAL;65;39;16;55;33;11;44;88;16;104;0;0;0
DISTRITO FEDERAL;LICENCIATURA EN INGENIER페 EN TELECOMUNICACIONES;30;18;3;21;105;35;140;536;159;695;40;14;54
DISTRITO FEDERAL;LICENCIATURA EN INGENIER페 EN TELECOMUNICACIONES Y ELECTR흁ICA;12;11;1;12;11;1;12;63;9;72;15;1;16
DISTRITO FEDERAL;LICENCIATURA EN INGENIER페 F펩ICA;3;3;0;3;3;0;3;22;10;32;5;1;6
DISTRITO FEDERAL;LICENCIATURA EN INGENIER페 GEOF펩ICA;0;0;0;0;65;49;114;366;178;544;18;16;34
DISTRITO FEDERAL;LICENCIATURA EN INGENIER페 GEOL휺ICA;0;0;0;0;45;41;86;236;161;397;21;17;38
DISTRITO FEDERAL;LICENCIATURA EN INGENIER페 GEOM쳆ICA;0;0;0;0;59;25;84;212;76;288;10;8;18
DISTRITO FEDERAL;LICENCIATURA EN INGENIER페 INDUSTRIAL;290;56;20;76;152;94;246;944;451;1395;151;61;212
DISTRITO FEDERAL;LICENCIATURA EN INGENIER페 INDUSTRIAL Y ADMINISTRACI흁;200;5;3;8;3;2;5;3;2;5;0;0;0
DISTRITO FEDERAL;LICENCIATURA EN INGENIER페 INDUSTRIAL Y SISTEMAS;105;62;20;82;47;13;60;195;50;245;10;6;16
DISTRITO FEDERAL;LICENCIATURA EN INGENIER페 INFORM쳆ICA;42;20;15;35;18;12;30;18;12;30;0;0;0
DISTRITO FEDERAL;LICENCIATURA EN INGENIER페 MEC쳁ICA;0;0;0;0;215;30;245;1254;102;1356;142;19;161
DISTRITO FEDERAL;LICENCIATURA EN INGENIER페 MEC쳁ICA EL텎TRICA;0;0;0;0;0;0;0;0;0;0;1;2;3
DISTRITO FEDERAL;LICENCIATURA EN INGENIER페 MECATR흁ICA;60;41;5;46;160;45;205;836;175;1011;100;17;117
DISTRITO FEDERAL;LICENCIATURA EN INGENIER페 PETROLERA;0;0;0;0;221;73;294;1052;289;1341;121;35;156
DISTRITO FEDERAL;LICENCIATURA EN INGENIER페 QU펤ICA;0;0;0;0;324;234;558;1428;937;2365;182;113;295
DISTRITO FEDERAL;LICENCIATURA EN INGENIER페 QU펤ICA METALＢGICA;0;0;0;0;111;52;163;384;181;565;28;9;37
DISTRITO FEDERAL;LICENCIATURA EN INGENIER페 TELEM쳆ICA;20;2;1;3;0;0;0;6;0;6;0;0;0
DISTRITO FEDERAL;LICENCIATURA EN INGENIER페 TOPOGR첹ICA Y GEOD텝ICA;0;0;0;0;0;0;0;0;0;0;5;1;6
DISTRITO FEDERAL;LICENCIATURA EN INTERPRETACI흁;33;6;26;32;6;26;32;24;81;105;2;15;17
DISTRITO FEDERAL;LICENCIATURA EN INTERPRETACI흁 Y TRADUCCI흁;40;11;14;25;11;14;25;33;73;106;2;22;24
DISTRITO FEDERAL;LICENCIATURA EN INVESTIGACI흁 BIOM텏ICA B쳅ICA;0;0;0;0;7;4;11;25;20;45;9;5;14
DISTRITO FEDERAL;LICENCIATURA EN JAZZ CON ESPECIALIDAD EN CANTO Y SCAT;6;0;6;6;0;1;1;1;9;10;0;0;0
DISTRITO FEDERAL;LICENCIATURA EN JAZZ CON ESPECIALIDAD EN CONTRABAJO;4;4;0;4;1;0;1;5;0;5;2;1;3
DISTRITO FEDERAL;LICENCIATURA EN JAZZ CON ESPECIALIDAD EN FLAUTA;0;0;0;0;0;0;0;3;0;3;0;0;0
DISTRITO FEDERAL;LICENCIATURA EN JAZZ CON ESPECIALIDAD EN GUITARRA;32;31;1;32;3;0;3;14;0;14;2;0;2
DISTRITO FEDERAL;LICENCIATURA EN JAZZ CON ESPECIALIDAD EN PERCUSIONES;11;11;0;11;0;0;0;7;0;7;3;0;3
DISTRITO FEDERAL;LICENCIATURA EN JAZZ CON ESPECIALIDAD EN PIANO;5;4;1;5;2;0;2;10;2;12;2;0;2
DISTRITO FEDERAL;LICENCIATURA EN JAZZ CON ESPECIALIDAD EN SAXOF흁;9;9;0;9;3;0;3;8;2;10;0;1;1
DISTRITO FEDERAL;LICENCIATURA EN JAZZ CON ESPECIALIDAD EN TROMPETA;2;1;0;1;0;0;0;1;0;1;0;0;0
DISTRITO FEDERAL;LICENCIATURA EN JAZZ CON ESPECIALIDAD EN VIOL펥;2;1;1;2;0;0;0;1;0;1;0;1;1
DISTRITO FEDERAL;LICENCIATURA EN LA ENSE헤NZA DE LA LENGUA INGLESA;20;0;2;2;0;0;0;1;1;2;1;9;10
DISTRITO FEDERAL;LICENCIATURA EN LA TERAPIA DE LA AUDICI흁, LA VOZ Y EL LENGUAJE ORAL Y ESCRITO;15;5;25;30;0;9;9;0;19;19;0;0;0
DISTRITO FEDERAL;LICENCIATURA EN LENGUA Y LITERATURA HISP쳁ICAS;0;0;0;0;133;228;361;562;845;1407;53;100;153
DISTRITO FEDERAL;LICENCIATURA EN LENGUA Y LITERATURA MODERNA (ALEMANAS);0;0;0;0;10;15;25;41;59;100;0;0;0
DISTRITO FEDERAL;LICENCIATURA EN LENGUA Y LITERATURA MODERNA (FRANCESAS);0;0;0;0;9;21;30;38;73;111;0;2;2
DISTRITO FEDERAL;LICENCIATURA EN LENGUA Y LITERATURA MODERNA (INGLESAS);0;0;0;0;34;54;88;136;230;366;0;4;4
DISTRITO FEDERAL;LICENCIATURA EN LENGUA Y LITERATURA MODERNA (ITALIANAS);0;0;0;0;7;21;28;33;71;104;0;2;2
DISTRITO FEDERAL;LICENCIATURA EN LENGUA Y LITERATURAS MODERNAS (LETRAS PORTUGUESAS);0;0;0;0;3;3;6;6;10;16;0;0;0
DISTRITO FEDERAL;LICENCIATURA EN LETRAS CL쳅ICAS;0;0;0;0;69;62;131;209;231;440;19;25;44
DISTRITO FEDERAL;LICENCIATURA EN LETRAS HISP쳁ICAS;80;91;189;280;28;43;71;186;239;425;14;16;30
DISTRITO FEDERAL;LICENCIATURA EN LETRAS IBEROAMERICANAS;40;13;27;40;13;23;36;28;45;73;5;14;19
DISTRITO FEDERAL;LICENCIATURA EN LINGⓐSTICA;67;49;150;199;23;35;58;78;150;228;6;4;10
DISTRITO FEDERAL;LICENCIATURA EN LITERATURA DRAM쳆ICA Y TEATRO;0;0;0;0;38;91;129;134;380;514;38;88;126
DISTRITO FEDERAL;LICENCIATURA EN LITERATURA LATINOAMERICANA;5;2;3;5;2;3;5;18;48;66;0;10;10
DISTRITO FEDERAL;LICENCIATURA EN LITERATURA Y CREACI흁 LITERARIA;30;15;23;38;15;8;23;30;34;64;1;1;2
DISTRITO FEDERAL;LICENCIATURA EN MANEJO SUSTENTABLE DE ZONAS COSTERAS;0;0;0;0;2;8;10;19;21;40;6;3;9
DISTRITO FEDERAL;LICENCIATURA EN MATEM쳆ICAS;1384;884;475;1359;969;486;1455;2893;1340;4233;153;56;209
DISTRITO FEDERAL;LICENCIATURA EN MATEM쳆ICAS APLICADAS;69;44;34;78;31;20;51;136;92;228;28;13;41
DISTRITO FEDERAL;LICENCIATURA EN MEDICINA VETERINARIA Y ZOOTECNIA;75;26;56;82;253;407;660;1245;2069;3314;166;254;420
DISTRITO FEDERAL;LICENCIATURA EN M텏ICO CIRUJANO;0;0;0;0;546;913;1459;2477;4430;6907;501;880;1381
DISTRITO FEDERAL;LICENCIATURA EN MERCADOTECNIA;1728;534;674;1208;462;547;1009;2257;2955;5212;365;567;932
DISTRITO FEDERAL;LICENCIATURA EN MERCADOTECNIA (CORPORATIVA);0;0;0;0;24;20;44;66;57;123;0;0;0
DISTRITO FEDERAL;LICENCIATURA EN MERCADOTECNIA (EJECUTIVA);30;21;5;26;17;4;21;58;31;89;0;0;0
DISTRITO FEDERAL;LICENCIATURA EN MERCADOTECNIA DEPORTIVA INTERNACIONAL;30;24;5;29;22;4;26;69;10;79;0;0;0
DISTRITO FEDERAL;LICENCIATURA EN MERCADOTECNIA EN MODA;20;0;0;0;0;0;0;0;3;3;0;7;7
DISTRITO FEDERAL;LICENCIATURA EN MERCADOTECNIA INTERNACIONAL;2808;1092;1282;2374;1056;1240;2296;2506;2855;5361;29;43;72
DISTRITO FEDERAL;LICENCIATURA EN MERCADOTECNIA PUBLICITARIA;25;8;6;14;8;6;14;20;19;39;8;9;17
DISTRITO FEDERAL;LICENCIATURA EN MERCADOTECNIA Y COMERCIO INTERNACIONAL;40;14;28;42;4;6;10;7;12;19;0;0;0
DISTRITO FEDERAL;LICENCIATURA EN MERCADOTECNIA Y COMUNICACI흁;45;11;34;45;8;33;41;16;64;80;0;0;0
DISTRITO FEDERAL;LICENCIATURA EN MERCADOTECNIA Y PUBLICIDAD;973;312;371;683;294;342;636;1036;1194;2230;95;157;252
