MICHOAC쳁;INGENIER페 EN AGRONOM페;151;137;45;182;114;37;151;302;78;380;25;6;31
MICHOAC쳁;INGENIER페 EN BIOTECNOLOG페;0;0;0;0;0;0;0;41;45;86;22;23;45
MICHOAC쳁;INGENIER페 EN COMPUTACI흁;1;378;100;478;233;65;298;476;138;614;4;0;4
MICHOAC쳁;INGENIER페 EN DESARROLLO COMUNITARIO;143;50;88;138;50;85;135;114;162;276;13;11;24
MICHOAC쳁;INGENIER페 EN DESARROLLO TERRITORIAL;53;0;0;0;0;0;0;14;22;36;0;0;0
MICHOAC쳁;INGENIER페 EN EL텎TRICA;34;61;0;61;34;0;34;205;8;213;29;3;32
MICHOAC쳁;INGENIER페 EN ELECTROMEC쳁ICA;140;109;9;118;97;7;104;332;14;346;35;3;38
MICHOAC쳁;INGENIER페 EN ELECTR흁ICA;166;198;14;212;156;12;168;620;51;671;98;9;107
MICHOAC쳁;INGENIER페 EN FORESTAL;22;19;7;26;17;5;22;25;7;32;0;0;0
MICHOAC쳁;INGENIER페 EN GEOCIENCIAS;40;23;20;43;22;14;36;79;35;114;8;6;14
MICHOAC쳁;INGENIER페 EN GESTI흁 EMPRESARIAL;553;250;391;641;204;277;481;473;789;1262;0;0;0
MICHOAC쳁;INGENIER페 EN INDUSTRIAS ALIMENTARIAS;267;137;152;289;133;128;261;309;392;701;25;49;74
MICHOAC쳁;INGENIER페 EN INFORM쳆ICA;248;164;106;270;149;91;240;257;165;422;6;6;12
MICHOAC쳁;INGENIER페 EN INFORM쳆ICA ADMINISTRATIVA;0;29;41;70;29;41;70;89;90;179;7;14;21
MICHOAC쳁;INGENIER페 EN INNOVACI흁 AGR펚OLA SUSTENTABLE;151;109;45;154;93;37;130;253;88;341;0;0;0
MICHOAC쳁;INGENIER페 EN MANTENIMIENTO INDUSTRIAL;0;0;0;0;0;0;0;113;4;117;36;1;37
MICHOAC쳁;INGENIER페 EN MATERIALES;27;32;8;40;19;8;27;139;48;187;8;13;21
MICHOAC쳁;INGENIER페 EN MECATR흁ICA;269;188;36;224;166;32;198;478;69;547;38;8;46
MICHOAC쳁;INGENIER페 EN SISTEMAS COMPUTACIONALES;893;820;278;1098;633;204;837;2357;840;3197;227;85;312
MICHOAC쳁;INGENIER페 EN SISTEMAS DE INFORMACI흁;15;10;5;15;6;1;7;21;5;26;0;0;0
MICHOAC쳁;INGENIER페 EN TECNOLOG페 DE LA MADERA;2;58;13;71;42;13;55;103;31;134;3;4;7
MICHOAC쳁;INGENIER페 EN TECNOLOG페S COMPUTACIONALES;100;5;0;5;5;0;5;35;4;39;2;0;2
MICHOAC쳁;INGENIER페 EN TECNOLOG페S DE INFORMACI흁 Y COMUNICACIONES;0;0;0;0;0;0;0;4;4;8;7;1;8
MICHOAC쳁;INGENIER페 EN TECNOLOG페S DE LA INFORMACI흁;0;0;0;0;0;0;0;167;93;260;53;20;73
MICHOAC쳁;INGENIER페 EN TECNOLOG페S DE LA INFORMACI흁 Y COMUNICACI흁;96;79;39;118;52;20;72;115;41;156;0;0;0
MICHOAC쳁;INGENIER페 EN TECNOLOG페S DE LA INFORMACI흁 Y COMUNICACIONES;228;142;104;246;143;77;220;226;113;339;0;0;0
MICHOAC쳁;INGENIER페 FORESTAL;0;0;0;0;0;0;0;29;16;45;9;1;10
MICHOAC쳁;INGENIER페 INDUSTRIAL;804;704;252;956;574;211;785;2236;867;3103;271;130;401
MICHOAC쳁;INGENIER페 INDUSTRIAL EN PROCESOS Y SERVICIOS;25;15;5;20;9;1;10;38;7;45;13;5;18
MICHOAC쳁;INGENIER페 INDUSTRIAL Y DE SISTEMAS;100;16;10;26;16;10;26;88;32;120;7;6;13
MICHOAC쳁;INGENIER페 MEC쳁ICA;64;527;21;548;326;9;335;1091;43;1134;47;5;52
MICHOAC쳁;INGENIER페 MECATR흁ICA;0;0;0;0;0;0;0;152;12;164;36;1;37
MICHOAC쳁;INGENIER페 QU펤ICA;55;28;34;62;26;31;57;114;132;246;13;25;38
MICHOAC쳁;INGENIER페 QU펤ICO;1;152;103;255;96;64;160;353;227;580;41;25;66
MICHOAC쳁;LICENCIATURA EN ABOGAC페 INTERNACIONAL;0;6;8;14;6;8;14;16;13;29;0;0;0
MICHOAC쳁;LICENCIATURA EN ACTUACI흁 EN TEATRO, CINE Y TELEVISI흁;0;2;3;5;1;2;3;1;2;3;0;0;0
MICHOAC쳁;LICENCIATURA EN ADMINISTRACI흁;740;750;945;1695;269;298;567;1650;2380;4030;271;593;864
MICHOAC쳁;LICENCIATURA EN ADMINISTRACI흁 DE EMPRESAS;640;215;187;402;167;155;322;560;537;1097;67;98;165
MICHOAC쳁;LICENCIATURA EN ADMINISTRACI흁 DE EMPRESAS AGROPECUARIAS;1;1;1;2;0;0;0;1;7;8;2;1;3
MICHOAC쳁;LICENCIATURA EN ADMINISTRACI흁 DE EMPRESAS TUR펩TICAS;209;61;104;165;46;95;141;124;288;412;22;71;93
MICHOAC쳁;LICENCIATURA EN ADMINISTRACI흁 DE RECURSOS HUMANOS;20;3;3;6;3;3;6;6;12;18;0;0;0
MICHOAC쳁;LICENCIATURA EN ADMINISTRACI흁 EDUCATIVA;0;0;0;0;0;0;0;4;18;22;0;7;7
MICHOAC쳁;LICENCIATURA EN ADMINISTRACI흁 FINANCIERA;100;13;11;24;13;11;24;13;13;26;0;0;0
MICHOAC쳁;LICENCIATURA EN ADMINISTRACI흁 P２LICA;10;4;4;8;0;0;0;0;0;0;0;0;0
MICHOAC쳁;LICENCIATURA EN ADMINISTRACI흁 Y COMERCIO INTERNACIONAL;0;4;7;11;4;7;11;17;18;35;2;1;3
MICHOAC쳁;LICENCIATURA EN ADMINISTRACI흁 Y ESTRATEGIA DE NEGOCIOS;100;11;13;24;11;13;24;63;64;127;6;8;14
MICHOAC쳁;LICENCIATURA EN ADMINISTRACI흁: FINANZAS;30;42;30;72;12;10;22;56;40;96;16;13;29
MICHOAC쳁;LICENCIATURA EN ANIMACI흁 Y ARTE DIGITAL;200;11;10;21;11;10;21;49;51;100;3;0;3
MICHOAC쳁;LICENCIATURA EN ANIMACI흁, ARTE DIGITAL Y MULTIMEDIA;14;7;7;14;3;3;6;7;5;12;0;0;0
MICHOAC쳁;LICENCIATURA EN ARQUITECTURA;155;101;74;175;66;31;97;223;130;353;38;22;60
MICHOAC쳁;LICENCIATURA EN ARQUITECTURA DIGITAL;50;9;2;11;9;2;11;9;2;11;0;0;0
MICHOAC쳁;LICENCIATURA EN ARTE Y PATRIMONIO CULTURAL;350;18;25;43;18;25;43;49;57;106;0;0;0
MICHOAC쳁;LICENCIATURA EN ARTES CULINARIAS, CHEF;169;84;85;169;84;85;169;84;85;169;22;29;51
MICHOAC쳁;LICENCIATURA EN ARTES VISUALES;1;47;43;90;29;32;61;74;75;149;0;0;0
MICHOAC쳁;LICENCIATURA EN ARTES VISUALES DIBUJO Y ESTAMPADO;0;0;0;0;0;0;0;8;9;17;7;6;13
MICHOAC쳁;LICENCIATURA EN ARTES VISUALES ESCULTURA;0;0;0;0;0;0;0;4;3;7;3;4;7
MICHOAC쳁;LICENCIATURA EN ARTES VISUALES PINTURA;0;0;0;0;0;0;0;8;11;19;5;1;6
MICHOAC쳁;LICENCIATURA EN BIOLOG페;1;205;206;411;156;161;317;480;538;1018;85;111;196
MICHOAC쳁;LICENCIATURA EN CANTO;1;6;5;11;2;2;4;2;4;6;1;1;2
MICHOAC쳁;LICENCIATURA EN CIENCIAS COMPUTACIONALES Y DE LA COMUNICACI흁;20;8;2;10;2;8;10;17;11;28;0;0;0
MICHOAC쳁;LICENCIATURA EN CIENCIAS DE LA COMUNICACI흁;217;74;96;170;51;75;126;203;290;493;29;54;83
MICHOAC쳁;LICENCIATURA EN CIENCIAS DE LA COMUNICACI흁 Y PERIODISMO;40;14;12;26;13;11;24;55;33;88;4;7;11
MICHOAC쳁;LICENCIATURA EN CIENCIAS DE LA EDUCACI흁;55;20;32;52;14;34;48;33;75;108;4;16;20
MICHOAC쳁;LICENCIATURA EN CIENCIAS F펩ICO MATEM쳆ICAS;1;112;51;163;80;33;113;234;108;342;21;8;29
MICHOAC쳁;LICENCIATURA EN CIENCIAS POL펪ICAS Y ADMINISTRACI흁 P２LICA;22;15;5;20;4;2;6;19;11;30;2;1;3
MICHOAC쳁;LICENCIATURA EN CIENCIAS Y T텎NICAS DE LA COMUNICACI흁;48;29;29;58;17;25;42;55;74;129;11;20;31
MICHOAC쳁;LICENCIATURA EN COMERCIO INTERNACIONAL;99;200;230;430;153;153;306;303;339;642;25;47;72
MICHOAC쳁;LICENCIATURA EN COMERCIO INTERNACIONAL Y ADUANAS;215;9;19;28;5;15;20;24;35;59;13;21;34
MICHOAC쳁;LICENCIATURA EN COMERCIO Y NEGOCIOS INTERNACIONALES;75;69;57;126;30;23;53;107;79;186;14;19;33
MICHOAC쳁;LICENCIATURA EN COMPOSICI흁;1;9;5;14;2;2;4;12;3;15;1;0;1
MICHOAC쳁;LICENCIATURA EN COMUNICACI흁 EDUCATIVA;1;5;15;20;4;11;15;41;84;125;6;22;28
MICHOAC쳁;LICENCIATURA EN CONTADUR페;149;350;582;932;28;58;86;862;1529;2391;244;510;754
MICHOAC쳁;LICENCIATURA EN CONTADUR페 P２LICA;245;53;95;148;41;83;124;200;393;593;43;66;109
MICHOAC쳁;LICENCIATURA EN CONTADUR페 P２LICA Y FINANZAS;25;12;8;20;12;8;20;43;41;84;4;2;6
MICHOAC쳁;LICENCIATURA EN CONTADUR페 Y FINANZAS;0;0;0;0;0;0;0;6;2;8;0;3;3
MICHOAC쳁;LICENCIATURA EN CRIMINOLOG페;34;18;16;34;18;16;34;37;32;69;2;9;11
MICHOAC쳁;LICENCIATURA EN CULTURA F펩ICA Y DEPORTE;0;25;15;40;17;9;26;46;18;64;17;3;20
MICHOAC쳁;LICENCIATURA EN CULTURA F펩ICA Y DEPORTES;51;50;10;60;44;7;51;81;16;97;35;7;42
MICHOAC쳁;LICENCIATURA EN DANZA;1;2;22;24;1;9;10;3;35;38;2;13;15
MICHOAC쳁;LICENCIATURA EN DERECHO;1282;1149;1354;2503;911;1069;1980;3793;4589;8382;673;779;1452
MICHOAC쳁;LICENCIATURA EN DESARROLLO COMUNITARIO;100;0;0;0;0;0;0;15;20;35;9;15;24
MICHOAC쳁;LICENCIATURA EN DESARROLLO HUMANO;1;1;8;9;1;8;9;6;14;20;0;0;0
MICHOAC쳁;LICENCIATURA EN DESARROLLO INFANTIL;105;3;172;175;3;172;175;6;324;330;0;18;18
MICHOAC쳁;LICENCIATURA EN DESARROLLO SUSTENTABLE;350;118;134;252;118;134;252;190;203;393;12;13;25
MICHOAC쳁;LICENCIATURA EN DIRECCI흁 CORAL;1;1;2;3;1;1;2;2;2;4;0;3;3
MICHOAC쳁;LICENCIATURA EN DISE헲 DE INTERIORES;0;0;0;0;0;0;0;0;3;3;0;0;0
MICHOAC쳁;LICENCIATURA EN DISE헲 DE INTERIORES Y AMBIENTACI흁;30;5;25;30;2;18;20;11;57;68;1;17;18
MICHOAC쳁;LICENCIATURA EN DISE헲 DE LA COMUNICACI흁 GR첹ICA;65;35;32;67;14;24;38;51;83;134;8;11;19
MICHOAC쳁;LICENCIATURA EN DISE헲 DE MODAS;15;2;6;8;2;6;8;7;35;42;0;0;0
MICHOAC쳁;LICENCIATURA EN DISE헲 DE MODAS Y MERCADOTECNIA PUBLICITARIA;15;22;30;52;2;4;6;6;26;32;0;0;0
MICHOAC쳁;LICENCIATURA EN DISE헲 DIGITAL DE MODA;9;3;6;9;3;6;9;3;6;9;0;0;0
MICHOAC쳁;LICENCIATURA EN DISE헲 E INDUSTRIA DE LA MODA;300;35;240;275;6;11;17;12;48;60;2;31;33
MICHOAC쳁;LICENCIATURA EN DISE헲 E INDUSTRIA DEL VESTIDO;15;3;12;15;3;12;15;3;12;15;0;0;0
MICHOAC쳁;LICENCIATURA EN DISE헲 GR첹ICO;361;92;127;219;68;96;164;253;295;548;38;44;82
MICHOAC쳁;LICENCIATURA EN ECOLOG페 Y MEDIO AMBIENTE;15;5;3;8;5;3;8;10;7;17;0;0;0
MICHOAC쳁;LICENCIATURA EN ECONOM페;1;158;155;313;124;118;242;440;402;842;49;58;107
MICHOAC쳁;LICENCIATURA EN EDUCACI흁;0;0;0;0;0;0;0;0;0;0;0;0;0
MICHOAC쳁;LICENCIATURA EN EDUCACI흁 ART펩TICA;1;8;17;25;5;13;18;75;121;196;8;13;21
MICHOAC쳁;LICENCIATURA EN EDUCACI흁 ESPECIAL;31;22;122;144;5;26;31;51;332;383;19;165;184
MICHOAC쳁;LICENCIATURA EN EDUCACI흁 F펩ICA;124;942;231;1173;106;18;124;399;101;500;91;28;119
MICHOAC쳁;LICENCIATURA EN EDUCACI흁 MEDIA SUPERIOR;331;151;164;315;117;109;226;468;517;985;74;97;171
MICHOAC쳁;LICENCIATURA EN EDUCACI흁 PREESCOLAR;1132;350;2551;2901;72;939;1011;393;4108;4501;50;608;658
MICHOAC쳁;LICENCIATURA EN EDUCACI흁 PREESCOLAR EN EL MEDIO IND펞ENA;7;3;4;7;3;4;7;16;56;72;3;10;13
MICHOAC쳁;LICENCIATURA EN EDUCACI흁 PREESCOLAR IND펞ENA;170;172;256;428;62;82;144;288;385;673;50;67;117
MICHOAC쳁;LICENCIATURA EN EDUCACI흁 PREESCOLAR PARA EL MEDIO IND펞ENA;77;13;64;77;13;57;70;26;187;213;0;14;14
MICHOAC쳁;LICENCIATURA EN EDUCACI흁 PREESCOLAR PARA PROFESORES EN EJERCICIO;250;50;200;250;25;157;182;62;769;831;20;213;233
MICHOAC쳁;LICENCIATURA EN EDUCACI흁 PREESCOLAR Y PRIMARIA EN EL MEDIO IND펞ENA;0;0;0;0;0;0;0;16;53;69;14;25;39
MICHOAC쳁;LICENCIATURA EN EDUCACI흁 PRIMARIA;880;1851;1303;3154;405;402;807;1597;1515;3112;300;269;569
MICHOAC쳁;LICENCIATURA EN EDUCACI흁 PRIMARIA BILING㏊ INTERCULTURAL;30;86;48;134;18;12;30;79;38;117;22;8;30
MICHOAC쳁;LICENCIATURA EN EDUCACI흁 PRIMARIA PARA EL MEDIO IND펞ENA;39;27;35;62;19;20;39;160;158;318;6;21;27
MICHOAC쳁;LICENCIATURA EN EDUCACI흁 SECUNDARIA;70;50;40;90;31;19;50;82;61;143;28;9;37
MICHOAC쳁;LICENCIATURA EN EDUCACI흁 SECUNDARIA CON ESPECIALIDAD EN BIOLOG페;85;98;137;235;30;38;68;72;93;165;23;34;57
MICHOAC쳁;LICENCIATURA EN EDUCACI흁 SECUNDARIA CON ESPECIALIDAD EN ESPA헲L;56;26;40;66;19;38;57;97;199;296;13;28;41
MICHOAC쳁;LICENCIATURA EN EDUCACI흁 SECUNDARIA CON ESPECIALIDAD EN FORMACI흁 C펬ICA Y 텞ICA;30;48;81;129;11;19;30;19;40;59;8;22;30
MICHOAC쳁;LICENCIATURA EN EDUCACI흁 SECUNDARIA CON ESPECIALIDAD EN HISTORIA;85;69;61;130;26;22;48;127;97;224;11;11;22
MICHOAC쳁;LICENCIATURA EN EDUCACI흁 SECUNDARIA CON ESPECIALIDAD EN INGL텝;60;69;82;151;24;20;44;50;49;99;6;19;25
MICHOAC쳁;LICENCIATURA EN EDUCACI흁 SECUNDARIA CON ESPECIALIDAD EN MATEM쳆ICAS;55;31;23;54;24;22;46;162;122;284;20;14;34
MICHOAC쳁;LICENCIATURA EN EDUCACI흁 SECUNDARIA CON ESPECIALIDAD EN QU펤ICA;0;0;0;0;0;0;0;30;48;78;0;0;0
MICHOAC쳁;LICENCIATURA EN EDUCACI흁 SECUNDARIA CON ESPECIALIDAD EN TELESECUNDARIA;32;21;11;32;21;11;32;107;50;157;18;12;30
MICHOAC쳁;LICENCIATURA EN EDUCACI흁 SECUNDARIA CON TERMINAL EN TELESECUNDARIA;30;21;9;30;20;9;29;115;48;163;0;0;0
MICHOAC쳁;LICENCIATURA EN EDUCACI흁 SUPERIOR;35;7;11;18;7;11;18;10;19;29;0;0;0
MICHOAC쳁;LICENCIATURA EN EDUCACI흁 Y DESARROLLO HUMANO;24;6;18;24;4;15;19;18;68;86;2;13;15
MICHOAC쳁;LICENCIATURA EN ENFERMER페;1;267;884;1151;213;711;924;504;1912;2416;75;334;409
MICHOAC쳁;LICENCIATURA EN ENFERMER페 Y OBSTETRICIA;162;10;210;220;6;97;103;18;247;265;5;40;45
MICHOAC쳁;LICENCIATURA EN ENSE헤NZA DEL INGL텝;50;20;30;50;16;17;33;16;17;33;0;0;0
MICHOAC쳁;LICENCIATURA EN ENTRENAMIENTO F펩ICO Y DEPORTE;32;5;1;6;0;0;0;10;1;11;12;2;14
MICHOAC쳁;LICENCIATURA EN ESTUDIOS CINEMATOGR첹ICOS;0;23;3;26;7;1;8;23;3;26;0;0;0
MICHOAC쳁;LICENCIATURA EN ESTUDIOS MULTICULTURALES;0;0;0;0;0;0;0;13;24;37;1;3;4
MICHOAC쳁;LICENCIATURA EN FILOSOF페;159;192;36;228;184;30;214;791;93;884;70;13;83
MICHOAC쳁;LICENCIATURA EN GASTRONOM페;229;108;106;214;95;92;187;185;197;382;51;51;102
MICHOAC쳁;LICENCIATURA EN GEN흀ICA ALIMENTARIA;0;0;0;0;0;0;0;71;103;174;10;12;22
MICHOAC쳁;LICENCIATURA EN GESTI흁 COMUNITARIA Y GOBIERNOS LOCALES;350;14;20;34;14;20;34;44;56;100;8;5;13
MICHOAC쳁;LICENCIATURA EN GESTI흁 EMPRESARIAL;106;21;25;46;36;71;107;81;119;200;3;1;4
MICHOAC쳁;LICENCIATURA EN GESTI흁 URBANA Y RURAL;0;0;0;0;0;0;0;0;1;1;0;0;0
MICHOAC쳁;LICENCIATURA EN GOBERNABILIDAD Y NUEVA CIUDADAN페;0;0;0;0;0;0;0;44;53;97;2;1;3
MICHOAC쳁;LICENCIATURA EN HISTORIA;1;131;122;253;89;94;183;304;304;608;46;53;99
MICHOAC쳁;LICENCIATURA EN HISTORIA DEL ARTE;25;3;12;15;2;11;13;6;26;32;0;2;2
MICHOAC쳁;LICENCIATURA EN HOMEOPAT페;15;3;4;7;1;2;3;2;15;17;1;3;4
MICHOAC쳁;LICENCIATURA EN HUMANIDADES Y CIENCIAS SOCIALES;100;0;1;1;0;1;1;8;18;26;2;6;8
MICHOAC쳁;LICENCIATURA EN IDIOMAS;15;9;6;15;3;7;10;6;21;27;2;7;9
MICHOAC쳁;LICENCIATURA EN INFORM쳆ICA;50;79;80;159;9;5;14;530;375;905;116;92;208
MICHOAC쳁;LICENCIATURA EN INFORM쳆ICA ADMINISTRATIVA;53;113;103;216;6;4;10;190;157;347;52;48;100
MICHOAC쳁;LICENCIATURA EN INGENIERA ARQUITECTO;31;19;12;31;15;8;23;69;18;87;9;5;14
MICHOAC쳁;LICENCIATURA EN INGENIER페 EN ENERG페;0;0;0;0;0;0;0;63;7;70;5;0;5
MICHOAC쳁;LICENCIATURA EN INGENIER페 EN NANOTECNOLOG페;0;0;0;0;0;0;0;41;20;61;0;0;0
MICHOAC쳁;LICENCIATURA EN INGENIER페 INDUSTRIAL;105;50;20;70;38;5;43;89;23;112;0;0;0
MICHOAC쳁;LICENCIATURA EN INGENIER페 MEC쳁ICA AUTOMOTRIZ;71;70;1;71;70;1;71;70;1;71;64;1;65
MICHOAC쳁;LICENCIATURA EN INGL텝;1;9;19;28;6;17;23;203;367;570;34;40;74
MICHOAC쳁;LICENCIATURA EN INNOVACI흁 AGR펚OLA SUSTENTABLE;12;13;6;19;9;3;12;13;6;19;0;0;0
MICHOAC쳁;LICENCIATURA EN INNOVACI흁 EDUCATIVA;0;0;0;0;0;0;0;40;127;167;5;24;29
MICHOAC쳁;LICENCIATURA EN INTERVENCI흁 EDUCATIVA;574;334;730;1064;204;397;601;558;1114;1672;57;193;250
MICHOAC쳁;LICENCIATURA EN LA ENSE헤NZA DE LA LENGUA INGLESA;0;0;0;0;0;0;0;0;0;0;0;0;0
MICHOAC쳁;LICENCIATURA EN LENGUA Y COMUNICACI흁 INTERCULTURAL;350;16;25;41;16;25;41;70;106;176;0;0;0
MICHOAC쳁;LICENCIATURA EN LENGUA Y LITERATURA HISP쳁ICAS;1;61;89;150;40;65;105;110;202;312;31;39;70
MICHOAC쳁;LICENCIATURA EN LENGUAS EXTRANJERAS;0;5;9;14;5;9;14;10;29;39;0;3;3
MICHOAC쳁;LICENCIATURA EN LENGUAS MODERNAS;25;10;15;25;6;13;19;9;23;32;0;5;5
MICHOAC쳁;LICENCIATURA EN MEDICINA GENERAL;90;60;75;135;45;45;90;93;74;167;0;0;0
MICHOAC쳁;LICENCIATURA EN MEDICINA VETERINARIA Y ZOOTECNIA;1;309;123;432;227;92;319;830;321;1151;6;3;9
MICHOAC쳁;LICENCIATURA EN MEDIOS INTERACTIVOS;80;69;34;103;43;17;60;70;24;94;0;0;0
MICHOAC쳁;LICENCIATURA EN MERCADOTECNIA;433;98;125;223;52;52;104;211;221;432;54;64;118
MICHOAC쳁;LICENCIATURA EN MERCADOTECNIA INTERNACIONAL;10;2;2;4;0;0;0;1;4;5;1;3;4
MICHOAC쳁;LICENCIATURA EN MERCADOTECNIA Y PUBLICIDAD;20;10;9;19;10;9;19;30;26;56;0;0;0
MICHOAC쳁;LICENCIATURA EN MERCADOTECNIA Y VENTAS;70;40;52;92;34;46;80;88;118;206;28;37;65
MICHOAC쳁;LICENCIATURA EN MULTIMEDIA DIGITAL;0;9;4;13;9;4;13;27;8;35;6;3;9
MICHOAC쳁;LICENCIATURA EN MＣICA;35;23;8;31;20;7;27;52;18;70;7;6;13
MICHOAC쳁;LICENCIATURA EN MＣICA ESCOLAR;20;5;5;10;5;5;10;5;5;10;0;0;0
MICHOAC쳁;LICENCIATURA EN NEGOCIOS INTERNACIONALES;260;29;30;59;27;21;48;89;97;186;17;23;40
MICHOAC쳁;LICENCIATURA EN NUTRICI흁;346;154;461;615;113;363;476;278;866;1144;50;185;235
MICHOAC쳁;LICENCIATURA EN ODONTOLOG페;70;24;27;51;13;16;29;43;84;127;0;0;0
MICHOAC쳁;LICENCIATURA EN PEDAGOG페;308;60;161;221;51;146;197;470;1180;1650;47;192;239
MICHOAC쳁;LICENCIATURA EN PEDAGOG페 INFANTIL;60;10;39;49;10;39;49;13;66;79;0;0;0
MICHOAC쳁;LICENCIATURA EN PERIODISMO;25;9;12;21;7;9;16;17;29;46;7;9;16
MICHOAC쳁;LICENCIATURA EN PLANEACI흁 PARA EL DESARROLLO AGROPECUARIO;0;0;0;0;0;0;0;12;17;29;8;11;19
MICHOAC쳁;LICENCIATURA EN PLANEACI흁 Y DESARROLLO TUR펩TICO;0;0;0;0;0;0;0;1;1;2;2;3;5
MICHOAC쳁;LICENCIATURA EN PSICOLOG페;588;317;1004;1321;228;790;1018;774;2746;3520;117;427;544
MICHOAC쳁;LICENCIATURA EN PSICOLOG페 EDUCATIVA;2;12;68;80;9;58;67;358;1140;1498;130;486;616
MICHOAC쳁;LICENCIATURA EN PUBLICIDAD;1;2;3;5;1;2;3;5;6;11;0;0;0
MICHOAC쳁;LICENCIATURA EN PUERICULTURA Y DESARROLLO INFANTIL;40;0;8;8;0;1;1;0;6;6;0;0;0
MICHOAC쳁;LICENCIATURA EN RELACIONES COMERCIALES INTERNACIONALES;70;18;17;35;10;11;21;50;60;110;15;6;21
MICHOAC쳁;LICENCIATURA EN SALUD P２LICA;1;102;175;277;80;122;202;215;370;585;0;0;0
MICHOAC쳁;LICENCIATURA EN SISTEMAS COMPUTACIONALES;143;76;50;126;68;36;104;208;95;303;34;20;54
MICHOAC쳁;LICENCIATURA EN TEATRO;1;9;26;35;8;18;26;23;42;65;7;9;16
MICHOAC쳁;LICENCIATURA EN TECNOLOG페 EDUCATIVA;25;8;10;18;2;9;11;7;25;32;1;5;6
MICHOAC쳁;LICENCIATURA EN TEOLOG페;6;6;0;6;6;0;6;19;0;19;7;0;7
MICHOAC쳁;LICENCIATURA EN TRABAJO SOCIAL;80;5;31;36;4;28;32;11;134;145;1;26;27
MICHOAC쳁;LICENCIATURA EN TURISMO;131;27;59;86;27;55;82;50;133;183;7;15;22
MICHOAC쳁;LICENCIATURA EN TURISMO CULTURAL;25;6;20;26;3;17;20;13;50;63;6;16;22
MICHOAC쳁;LICENCIATURA EN TURISMO INTERNACIONAL;30;0;4;4;0;4;4;0;4;4;0;0;0
MICHOAC쳁;LICENCIATURA INSTRUMENTISTA;1;14;5;19;8;4;12;23;11;34;5;0;5
MICHOAC쳁;M텏ICO CIRUJANO Y PARTERO;1;623;615;1238;264;255;519;1637;1579;3216;393;389;782
MICHOAC쳁;QU펤ICO FARMACOBI휿OGO;1;383;525;908;319;426;745;1109;1485;2594;120;206;326
MICHOAC쳁;TRONCO COM＞;1;249;264;513;761;1026;1787;1262;1708;2970;70;106;176
MICHOAC쳁;TRONCO COM＞ EN INGENIER페 CIVIL;100;7;0;7;7;0;7;7;0;7;0;0;0
MICHOAC쳁;TRONCO COM＞ EN INGENIER페 EN BIOTECNOLOG페;100;10;11;21;10;11;21;18;17;35;0;0;0
MICHOAC쳁;TRONCO COM＞ EN LICENCIATURA EN MERCADOTECNIA;100;2;3;5;2;3;5;3;3;6;0;0;0
MORELOS;TOTAL;86368;10721;12548;23269;6245;6622;12867;22219;23706;45925;3190;4005;7195
MORELOS;ABOGADO;72;16;16;32;16;16;32;55;53;108;0;0;0
MORELOS;ARQUITECTO;304;313;128;441;160;81;241;491;249;740;53;28;81
MORELOS;ARQUITECTURA;70;40;30;70;34;20;54;61;29;90;3;1;4
MORELOS;BI휿OGO;245;128;168;296;79;97;176;390;518;908;38;50;88
MORELOS;CIRUJANO DENTISTA;40;19;23;42;19;23;42;48;112;160;16;32;48
MORELOS;CONTADOR P２LICO;566;209;345;554;111;189;300;553;914;1467;98;163;261
MORELOS;CONTADUR페 P２LICA;205;46;102;148;33;80;113;99;226;325;17;47;64
MORELOS;GASTRONOM페;48;24;20;44;24;20;44;42;35;77;0;0;0
MORELOS;INGENIER페 ADMINISTRADOR INDUSTRIAL;13;7;0;7;1;3;4;12;11;23;7;2;9
MORELOS;INGENIER페 BIOQU펤ICA;104;41;63;104;37;48;85;167;235;402;14;29;43
MORELOS;INGENIER페 CIVIL;235;196;39;235;166;23;189;655;103;758;58;10;68
MORELOS;INGENIER페 CIVIL CON DISE헲 ARQUITECT흁ICO;15;2;3;5;0;0;0;2;2;4;0;0;0
MORELOS;INGENIER페 EL텎TRICA;600;77;4;81;17;1;18;175;6;181;19;3;22
MORELOS;INGENIER페 ELECTROMEC쳁ICA;219;212;7;219;175;4;179;746;19;765;95;4;99
MORELOS;INGENIER페 ELECTR흁ICA;90;27;2;29;21;2;23;118;12;130;18;1;19
MORELOS;INGENIER페 EN ADMINISTRACI흁;84;28;56;84;27;50;77;57;94;151;0;0;0
MORELOS;INGENIER페 EN BIOTECNOLOG페;152;110;115;225;66;71;137;162;196;358;20;19;39
MORELOS;INGENIER페 EN COMUNICACIONES Y ELECTR흁ICA;0;0;0;0;0;0;0;7;0;7;10;0;10
MORELOS;INGENIER페 EN DESARROLLO DE SOFTWARE;0;0;0;0;0;0;0;3;2;5;0;0;0
MORELOS;INGENIER페 EN DESARROLLO RURAL;50;26;17;43;18;13;31;51;46;97;8;9;17
MORELOS;INGENIER페 EN DISE헲 TEXTIL Y MODA;0;0;0;0;0;0;0;6;46;52;0;0;0
MORELOS;INGENIER페 EN ELECTR흁ICA Y TELECOMUNICACIONES;70;120;19;139;52;12;64;136;27;163;0;0;0
MORELOS;INGENIER페 EN FITOSANIDAD;100;20;1;21;13;0;13;33;5;38;17;4;21
MORELOS;INGENIER페 EN GESTI흁 EMPRESARIAL;177;51;106;157;57;72;129;201;310;511;0;0;0
MORELOS;INGENIER페 EN GESTI흁 Y DESARROLLO DE TECNOLOG페S;16;11;5;16;11;5;16;14;8;22;0;0;0
MORELOS;INGENIER페 EN HORTICULTURA;0;0;0;0;0;0;0;5;3;8;0;0;0
MORELOS;INGENIER페 EN INFORM쳆ICA;150;173;62;235;109;36;145;261;99;360;32;14;46
MORELOS;INGENIER페 EN INTELIGENCIA;0;0;0;0;0;0;0;0;1;1;0;1;1
MORELOS;INGENIER페 EN MANTENIMIENTO INDUSTRIAL;0;0;0;0;0;0;0;97;4;101;72;6;78
MORELOS;INGENIER페 EN MECATR흁ICA;53;45;10;55;45;6;51;291;30;321;22;5;27
MORELOS;INGENIER페 EN NEGOCIOS Y GESTI흁 EMPRESARIAL;0;0;0;0;0;0;0;91;151;242;40;78;118
MORELOS;INGENIER페 EN PROCESOS Y OPERACIONES INDUSTRIALES;0;0;0;0;0;0;0;20;15;35;0;0;0
MORELOS;INGENIER페 EN PRODUCCI흁 ANIMAL;50;39;17;56;34;11;45;82;28;110;16;5;21
MORELOS;INGENIER페 EN PRODUCCI흁 VEGETAL;100;20;6;26;11;5;16;40;20;60;18;4;22
MORELOS;INGENIER페 EN QU펤ICA;300;14;14;28;0;0;0;15;11;26;0;0;0
MORELOS;INGENIER페 EN SISTEMAS COMPUTACIONALES;472;333;123;456;311;66;377;1242;408;1650;142;60;202
MORELOS;INGENIER페 EN SISTEMAS DE INFORMACI흁;25;4;2;6;0;0;0;6;6;12;3;1;4
MORELOS;INGENIER페 EN TECNOLOG페 AMBIENTAL;90;56;74;130;41;43;84;91;136;227;0;0;0
MORELOS;INGENIER페 EN TECNOLOG페 DE LA INFORMACI흁 Y COMUNICACI흁;55;35;20;55;27;12;39;27;12;39;0;0;0
MORELOS;INGENIER페 EN TECNOLOG페S DE COMPUTACI흁;30;10;10;20;9;1;10;52;7;59;9;3;12
MORELOS;INGENIER페 EN TECNOLOG페S DE LA INFORMACI흁;0;0;0;0;0;0;0;112;64;176;80;53;133
MORELOS;INGENIER페 HORT펚OLA;50;29;22;51;21;16;37;88;55;143;11;8;19
MORELOS;INGENIER페 INDUSTRIAL;1249;447;191;638;278;113;391;1305;536;1841;100;61;161
MORELOS;INGENIER페 INDUSTRIAL Y DE CALIDAD;0;0;0;0;0;0;0;3;1;4;5;0;5
MORELOS;INGENIER페 INDUSTRIAL Y DE SISTEMAS;151;163;85;248;96;49;145;221;123;344;17;6;23
MORELOS;INGENIER페 INDUSTRIAL Y DE SISTEMAS DE CALIDAD;50;8;2;10;8;2;10;34;11;45;8;7;15
MORELOS;INGENIER페 MEC쳁ICA;600;176;7;183;45;2;47;348;18;366;22;1;23
MORELOS;INGENIER페 MECATR흁ICA;90;83;7;90;63;7;70;128;16;144;0;0;0
MORELOS;INGENIER페 QU펤ICA;60086;65;65;130;32;36;68;193;205;398;15;26;41
MORELOS;LICENCIATURA EN ADMINISTRACI흁;831;339;520;859;223;328;551;967;1424;2391;132;280;412
MORELOS;LICENCIATURA EN ADMINISTRACI흁 DE EMPRESAS;426;147;187;334;117;168;285;384;471;855;48;63;111
MORELOS;LICENCIATURA EN ADMINISTRACI흁 DE EMPRESAS TUR펩TICAS;109;16;34;50;16;34;50;46;95;141;12;36;48
MORELOS;LICENCIATURA EN ADMINISTRACI흁 DE NEGOCIOS INTERNACIONALES;21;8;13;21;8;13;21;38;32;70;8;9;17
MORELOS;LICENCIATURA EN ADMINISTRACI흁 FINANCIERA;20;10;10;20;5;10;15;35;26;61;0;0;0
MORELOS;LICENCIATURA EN ADMINISTRACI흁 HOTELERA;60;35;85;120;3;5;8;5;16;21;1;2;3
MORELOS;LICENCIATURA EN ADMINISTRACI흁 HOTELERA Y GASTRONOM페;33;18;15;33;18;15;33;74;96;170;17;19;36
MORELOS;LICENCIATURA EN ADMINISTRACI흁 P２LICA;56;37;42;79;23;30;53;44;60;104;7;11;18
MORELOS;LICENCIATURA EN ADMINISTRACI흁 Y GESTI흁;175;95;197;292;54;121;175;161;326;487;18;38;56
MORELOS;LICENCIATURA EN ADMINISTRACI흁 Y MERCADOTECNIA;108;38;66;104;23;44;67;60;100;160;12;22;34
MORELOS;LICENCIATURA EN ADMINISTRACI흁 Y NEGOCIOS INTERNACIONALES;30;3;3;6;3;3;6;9;13;22;5;2;7
MORELOS;LICENCIATURA EN ALTA ADMINISTRACI흁 HOTELERA;20;3;5;8;0;0;0;1;3;4;0;0;0
MORELOS;LICENCIATURA EN ANIMACI흁 Y ARTE DIGITAL;30;10;15;25;8;12;20;45;37;82;0;0;0
MORELOS;LICENCIATURA EN ANTROPOLOG페 SOCIAL;0;15;20;35;13;17;30;41;59;100;7;3;10
MORELOS;LICENCIATURA EN ARQUITECTURA;347;162;50;212;143;41;184;342;130;472;46;19;65
MORELOS;LICENCIATURA EN ARTES;130;105;112;217;56;51;107;203;203;406;22;20;42
MORELOS;LICENCIATURA EN ARTES PL쳅TICAS;20;4;8;12;4;8;12;5;20;25;0;0;0
MORELOS;LICENCIATURA EN ARTES VISUALES;50;10;22;32;10;22;32;39;58;97;6;9;15
MORELOS;LICENCIATURA EN ATENCI흁 PARA LOS TRASTORNOS DE AUDICI흁 Y LENGUAJE;20;0;3;3;0;3;3;2;20;22;0;0;0
MORELOS;LICENCIATURA EN BIOLOG페 Y MEDIO AMBIENTE;30;13;14;27;3;3;6;3;3;6;0;0;0
MORELOS;LICENCIATURA EN CIENCIAS (BIOQU펤ICA);220;35;48;83;13;15;28;53;64;117;5;8;13
MORELOS;LICENCIATURA EN CIENCIAS (COMPUTACI흁);220;32;12;44;10;1;11;40;8;48;3;1;4
MORELOS;LICENCIATURA EN CIENCIAS (F펩ICA);220;24;7;31;14;5;19;42;10;52;1;1;2
MORELOS;LICENCIATURA EN CIENCIAS (MATEM쳆ICAS);220;16;10;26;7;3;10;26;23;49;0;3;3
MORELOS;LICENCIATURA EN CIENCIAS (QU펤ICAS);220;7;14;21;2;5;7;11;14;25;2;4;6
MORELOS;LICENCIATURA EN CIENCIAS AMBIENTALES;80;36;64;100;16;34;50;16;34;50;0;0;0
MORELOS;LICENCIATURA EN CIENCIAS COMERCIALES;25;10;10;20;1;2;3;2;6;8;0;0;0
MORELOS;LICENCIATURA EN CIENCIAS DE LA ACTIVIDAD F펩ICA Y PR첶TICA DEPORTIVA;130;90;40;130;50;11;61;142;36;178;22;9;31
MORELOS;LICENCIATURA EN CIENCIAS DE LA COMUNICACI흁;203;97;74;171;40;58;98;143;242;385;24;40;64
MORELOS;LICENCIATURA EN CIENCIAS DE LA EDUCACI흁;108;19;108;127;15;64;79;42;190;232;9;54;63
MORELOS;LICENCIATURA EN CIENCIAS DEL DEPORTE;0;0;0;0;0;0;0;23;4;27;0;0;0
MORELOS;LICENCIATURA EN CIENCIAS POL펪ICAS Y GESTI흁 P２LICA;100;4;5;9;4;5;9;21;17;38;5;3;8
MORELOS;LICENCIATURA EN CIENCIAS Y T텎NICAS DE LA COMUNICACI흁;25;11;14;25;5;9;14;16;27;43;3;4;7
MORELOS;LICENCIATURA EN CIRUJANO DENTISTA;20;11;9;20;11;9;20;26;25;51;0;0;0
MORELOS;LICENCIATURA EN COMERCIO INTERNACIONAL;20;7;10;17;0;0;0;1;3;4;0;0;0
MORELOS;LICENCIATURA EN COMERCIO Y NEGOCIOS INTERNACIONALES;40;8;14;22;8;9;17;28;37;65;3;6;9
MORELOS;LICENCIATURA EN COMUNICACI흁;191;51;63;114;48;59;107;153;221;374;22;30;52
MORELOS;LICENCIATURA EN COMUNICACI흁 HUMANA;80;24;250;274;2;74;76;18;362;380;2;60;62
MORELOS;LICENCIATURA EN COMUNICACI흁 Y MEDIOS DIGITALES;20;10;10;20;4;10;14;18;52;70;0;0;0
MORELOS;LICENCIATURA EN COMUNICACI흁 Y TECNOLOG페 EDUCATIVA;60;42;55;97;12;17;29;26;64;90;3;3;6
MORELOS;LICENCIATURA EN CONSERVACI흁 Y RESTAURACI흁;20;3;11;14;3;11;14;5;27;32;0;0;0
MORELOS;LICENCIATURA EN CONTABILIDAD;0;0;0;0;0;0;0;9;22;31;6;15;21
MORELOS;LICENCIATURA EN CONTABILIDAD Y FINANZAS;19;8;11;19;8;11;19;14;21;35;0;0;0
MORELOS;LICENCIATURA EN CONTADOR P２LICO;20;8;12;20;8;12;20;36;43;79;0;1;1
MORELOS;LICENCIATURA EN CONTADUR페;280;27;40;67;15;23;38;51;94;145;14;16;30
MORELOS;LICENCIATURA EN CONTADUR페 P２LICA;6;2;4;6;2;4;6;8;34;42;2;6;8
MORELOS;LICENCIATURA EN CONTADUR페 Y FINANZAS;157;69;80;149;29;48;77;116;151;267;27;37;64
MORELOS;LICENCIATURA EN CONTADUR페 Y GESTI흁 FINANCIERA;29;15;14;29;15;14;29;57;45;102;8;15;23
MORELOS;LICENCIATURA EN COSMETOLOG페 Y EST텞ICA CORPORAL;10;0;7;7;0;7;7;0;18;18;0;0;0
