ENTIDAD FEDERATIVA;NOMBRE PROGRAMA EDUCATIVO;Matr鞍ula Mujeres;Matr鞍ula Hombres;Matr鞍ula Total;Nuevo Ingreso Mujeres;Nuevo Ingreso Hombres;Nuevo Ingreso Total;Egresados Mujeres;Egresados Hombres;Egresados Total;Titulados Mujeres;Titulados Hombres;Titulados Total
AGUASCALIENTES;TOTAL;27904;25388;53292;7695;6892;14587;4788;4002;8790;3093;2229;5322
AGUASCALIENTES;LICENCIATURA EN EDUCACI흁 ESPECIAL EN EL REA DE ATENCI흁 AUDITIVA Y DE LENGUAJE;55;5;60;0;0;0;21;4;25;21;4;25
AGUASCALIENTES;LICENCIATURA EN EDUCACI흁 F펩ICA;82;152;234;32;43;75;4;14;18;4;13;17
AGUASCALIENTES;LICENCIATURA EN EDUCACI흁 PREESCOLAR;537;2;539;139;0;139;109;0;109;106;0;106
AGUASCALIENTES;LICENCIATURA EN EDUCACI흁 PRIMARIA;931;140;1071;273;43;316;138;17;155;136;16;152
AGUASCALIENTES;LICENCIATURA EN EDUCACI흁 SECUNDARIA CON ESPECIALIDAD EN ESPA헲L;65;25;90;0;0;0;17;6;23;17;6;23
AGUASCALIENTES;LICENCIATURA EN EDUCACI흁 SECUNDARIA CON ESPECIALIDAD EN FORMACI흁 C펬ICA Y 텞ICA;15;9;24;0;0;0;0;0;0;0;0;0
AGUASCALIENTES;LICENCIATURA EN EDUCACI흁 SECUNDARIA CON ESPECIALIDAD EN HISTORIA;13;5;18;0;0;0;0;0;0;0;0;0
AGUASCALIENTES;LICENCIATURA EN EDUCACI흁 SECUNDARIA CON ESPECIALIDAD EN LENGUA EXTRANJERA (INGL텝);47;9;56;0;0;0;0;0;0;0;0;0
AGUASCALIENTES;LICENCIATURA EN EDUCACI흁 SECUNDARIA CON ESPECIALIDAD EN MATEM쳆ICAS;21;16;37;0;0;0;9;5;14;9;5;14
AGUASCALIENTES;LICENCIATURA EN EDUCACI흁 SECUNDARIA CON ESPECIALIDAD EN TELESECUNDARIA;9;13;22;0;0;0;0;0;0;0;0;0
AGUASCALIENTES;LICENCIATURA EN ENSE헤NZA Y APRENDIZAJE DE LA BIOLOG페 EN EDUCACI흁 SECUNDARIA;40;14;54;28;7;35;0;0;0;0;0;0
AGUASCALIENTES;LICENCIATURA EN ENSE헤NZA Y APRENDIZAJE DE LA FORMACI흁 텞ICA Y CIUDADANA EN EDUCACI흁 SECUNDARIA;19;6;25;0;0;0;0;0;0;0;0;0
AGUASCALIENTES;LICENCIATURA EN ENSE헤NZA Y APRENDIZAJE DE LA HISTORIA EN EDUCACI흁 SECUNDARIA;24;12;36;24;12;36;0;0;0;0;0;0
AGUASCALIENTES;LICENCIATURA EN ENSE헤NZA Y APRENDIZAJE DE LAS MATEM쳆ICAS EN EDUCACI흁 SECUNDARIA;23;30;53;12;21;33;0;0;0;0;0;0
AGUASCALIENTES;LICENCIATURA EN ENSE헤NZA Y APRENDIZAJE DEL ESPA헲L EN EDUCACI흁 SECUNDARIA;45;21;66;26;12;38;0;0;0;0;0;0
AGUASCALIENTES;LICENCIATURA EN ENSE헤NZA Y APRENDIZAJE DEL INGL텝 EN EDUCACI흁 SECUNDARIA;35;25;60;13;13;26;0;0;0;0;0;0
AGUASCALIENTES;LICENCIATURA EN ENSE헤NZA Y APRENDIZAJE EN TELESECUNDARIA;36;29;65;19;18;37;0;0;0;0;0;0
AGUASCALIENTES;LICENCIATURA EN INCLUSI흁 EDUCATIVA;51;7;58;26;5;31;0;0;0;0;0;0
AGUASCALIENTES;ARQUITECTURA;252;232;484;40;32;72;39;36;75;39;34;73
AGUASCALIENTES;CONTADOR P２LICO;538;316;854;67;31;98;170;78;248;97;48;145
AGUASCALIENTES;INGENIER페 AGROINDUSTRIAL;11;12;23;0;0;0;16;11;27;18;10;28
AGUASCALIENTES;INGENIER페 AGR흁OMO;48;96;144;10;29;39;6;14;20;7;19;26
AGUASCALIENTES;INGENIER페 AUTOMOTRIZ;16;316;332;3;93;96;1;43;44;1;30;31
AGUASCALIENTES;INGENIER페 BIOM텏ICA;159;171;330;49;35;84;20;24;44;20;18;38
AGUASCALIENTES;INGENIER페 BIOQU펤ICA;131;78;209;32;16;48;13;13;26;12;13;25
AGUASCALIENTES;INGENIER페 CIVIL;89;404;493;15;58;73;14;84;98;11;80;91
AGUASCALIENTES;INGENIER페 EL텎TRICA;16;300;316;5;81;86;1;45;46;0;12;12
AGUASCALIENTES;INGENIER페 ELECTR흁ICA;18;121;139;5;31;36;0;16;16;0;13;13
AGUASCALIENTES;INGENIER페 EN AGRICULTURA SUSTENTABLE Y PROTEGIDA;15;34;49;0;0;0;3;16;19;0;0;0
AGUASCALIENTES;INGENIER페 EN AGRONOM페;79;236;315;23;47;70;16;37;53;6;16;22
AGUASCALIENTES;INGENIER페 EN ALIMENTOS;57;41;98;21;5;26;0;0;0;0;0;0
AGUASCALIENTES;INGENIER페 EN BIOTECNOLOG페;57;40;97;15;8;23;8;2;10;3;1;4
AGUASCALIENTES;INGENIER페 EN COMPUTACI흁 INTELIGENTE;30;181;211;7;42;49;7;20;27;7;18;25
AGUASCALIENTES;INGENIER페 EN DESARROLLO E INNOVACI흁 EMPRESARIAL;230;111;341;0;0;0;227;78;305;0;0;0
AGUASCALIENTES;INGENIER페 EN DESARROLLO EMPRESARIAL Y DIRECCI흁 DE PROYECTOS;22;18;40;0;0;0;30;9;39;0;0;0
AGUASCALIENTES;INGENIER페 EN DISE헲 MEC쳁ICO;13;72;85;4;9;13;1;16;17;0;6;6
AGUASCALIENTES;INGENIER페 EN EL텎TRICA;0;0;0;0;0;0;0;0;0;0;3;3
AGUASCALIENTES;INGENIER페 EN ELECTR흁ICA;101;663;764;28;179;207;10;85;95;5;27;32
AGUASCALIENTES;INGENIER페 EN ELECTR흁ICA Y SISTEMAS DIGITALES;4;8;12;0;0;0;0;5;5;1;1;2
AGUASCALIENTES;INGENIER페 EN ENERG페;76;100;176;30;47;77;10;25;35;6;5;11
AGUASCALIENTES;INGENIER페 EN ENERG페S RENOVABLES;45;88;133;11;19;30;10;16;26;10;13;23
AGUASCALIENTES;INGENIER페 EN GESTI흁 DE PROYECTOS;18;6;24;0;0;0;0;0;0;0;0;0
AGUASCALIENTES;INGENIER페 EN GESTI흁 EMPRESARIAL;1366;773;2139;289;161;450;149;125;274;124;44;168
AGUASCALIENTES;INGENIER페 EN INNOVACI흁 AGR펚OLA SUSTENTABLE;12;23;35;0;0;0;0;7;7;0;8;8
AGUASCALIENTES;INGENIER페 EN INNOVACI흁 Y DISE헲;71;24;95;19;6;25;9;6;15;14;5;19
AGUASCALIENTES;INGENIER페 EN LOG펩TICA;53;38;91;14;16;30;8;3;11;17;6;23
AGUASCALIENTES;INGENIER페 EN LOG펩TICA INTERNACIONAL;43;13;56;0;0;0;0;0;0;0;0;0
AGUASCALIENTES;INGENIER페 EN MANTENIMIENTO INDUSTRIAL;39;299;338;0;0;0;13;105;118;0;2;2
AGUASCALIENTES;INGENIER페 EN MANUFACTURA Y AUTOMATIZACI흁 INDUSTRIAL;16;95;111;4;15;19;1;9;10;1;10;11
AGUASCALIENTES;INGENIER페 EN MATERIALES;44;86;130;8;33;41;13;24;37;5;2;7
AGUASCALIENTES;INGENIER페 EN MECATR흁ICA;203;981;1184;62;227;289;48;266;314;10;82;92
AGUASCALIENTES;INGENIER페 EN METAL MEC쳁ICA;1;75;76;0;0;0;0;0;0;0;0;0
AGUASCALIENTES;INGENIER페 EN SISTEMAS COMPUTACIONALES;114;469;583;30;113;143;19;67;86;17;71;88
AGUASCALIENTES;INGENIER페 EN SISTEMAS DE COMPUTACI흁;0;8;8;0;0;0;0;0;0;0;1;1
AGUASCALIENTES;INGENIER페 EN SISTEMAS ESTRAT텒ICOS DE INFORMACI흁 ESPECIALIZACI흁 EN REDES;67;159;226;24;63;87;13;33;46;5;27;32
AGUASCALIENTES;INGENIER페 EN SISTEMAS PRODUCTIVOS;130;182;312;1;1;2;83;70;153;0;0;0
AGUASCALIENTES;INGENIER페 EN TECNOLOG페 DE LA INFORMACI흁;7;9;16;0;0;0;5;8;13;0;0;0
AGUASCALIENTES;INGENIER페 EN TECNOLOG페 DE LA INFORMACI흁 Y COMUNICACI흁;190;521;711;25;101;126;32;54;86;13;41;54
AGUASCALIENTES;INGENIER페 EN TECNOLOG페S DE INFORMACI흁 Y COMUNICACIONES;0;2;2;0;0;0;0;0;0;0;0;0
AGUASCALIENTES;INGENIER페 EN TECNOLOG페S DE LA INFORMACI흁;36;139;175;0;0;0;21;53;74;0;0;0
AGUASCALIENTES;INGENIER페 EN TECNOLOG페S DE LA INFORMACI흁 Y COMUNICACI흁;18;24;42;7;9;16;6;6;12;9;8;17
AGUASCALIENTES;INGENIER페 EN TECNOLOG페S DE LA INFORMACI흁 Y COMUNICACIONES;78;154;232;15;19;34;17;37;54;2;6;8
AGUASCALIENTES;INGENIER페 FINANCIERA Y FISCAL;0;0;0;0;0;0;1;1;2;0;0;0
AGUASCALIENTES;INGENIER페 FISCAL Y FINANCIERA;0;0;0;0;0;0;1;1;2;0;0;0
AGUASCALIENTES;INGENIER페 INDUSTRIAL;1048;1956;3004;255;496;751;151;212;363;61;83;144
AGUASCALIENTES;INGENIER페 INDUSTRIAL EN PRODUCCI흁;11;31;42;0;1;1;0;2;2;0;2;2
AGUASCALIENTES;INGENIER페 INDUSTRIAL ESTAD펩TICO;91;107;198;19;20;39;6;17;23;5;19;24
AGUASCALIENTES;INGENIER페 INDUSTRIAL Y DE SISTEMAS;37;56;93;6;9;15;11;12;23;9;10;19
AGUASCALIENTES;INGENIER페 INDUSTRIAL Y DESARROLLO ORGANIZACIONAL;103;290;393;53;149;202;9;18;27;0;0;0
AGUASCALIENTES;INGENIER페 MEC쳁ICA;0;0;0;0;0;0;0;1;1;0;5;5
AGUASCALIENTES;INGENIER페 MEC쳁ICA AUTOMOTRIZ;36;382;418;16;161;177;4;90;94;4;46;50
AGUASCALIENTES;INGENIER페 QU펤ICA;0;0;0;0;0;0;0;0;0;0;2;2
AGUASCALIENTES;INGENIER페 ROB흆ICA;52;203;255;14;49;63;4;23;27;4;20;24
AGUASCALIENTES;LICENCIATURA ASESOR PSICOPEDAG휺ICO;165;13;178;41;4;45;35;5;40;31;5;36
AGUASCALIENTES;LICENCIATURA EN ADMINISTRACI흁;628;352;980;136;69;205;101;41;142;52;33;85
AGUASCALIENTES;LICENCIATURA EN ADMINISTRACI흁 DE EMPRESAS;1447;1120;2567;513;334;847;146;134;280;100;96;196
AGUASCALIENTES;LICENCIATURA EN ADMINISTRACI흁 DE LA MERCADOTECNIA;33;34;67;8;9;17;4;4;8;5;3;8
AGUASCALIENTES;LICENCIATURA EN ADMINISTRACI흁 DE LA PRODUCCI흁 Y SERVICIOS;85;70;155;14;25;39;25;17;42;22;14;36
AGUASCALIENTES;LICENCIATURA EN ADMINISTRACI흁 DE NEGOCIOS DE COMUNICACI흁 Y ENTRETENIMIENTO;19;9;28;13;3;16;0;0;0;0;0;0
AGUASCALIENTES;LICENCIATURA EN ADMINISTRACI흁 DE NEGOCIOS DE TURISMO Y HOSPITALIDAD;2;1;3;2;0;2;0;0;0;0;0;0
AGUASCALIENTES;LICENCIATURA EN ADMINISTRACI흁 DE NEGOCIOS INTERNACIONALES;14;30;44;5;11;16;0;0;0;0;0;0
AGUASCALIENTES;LICENCIATURA EN ADMINISTRACI흁 FINANCIERA;198;172;370;24;35;59;42;45;87;43;34;77
AGUASCALIENTES;LICENCIATURA EN ADMINISTRACI흁 P２LICA;22;16;38;19;15;34;3;3;6;3;3;6
AGUASCALIENTES;LICENCIATURA EN ADMINISTRACI흁 Y DIRECCI흁;50;68;118;7;11;18;4;5;9;8;7;15
AGUASCALIENTES;LICENCIATURA EN ADMINISTRACI흁 Y DIRECCI흁 DE EMPRESAS FAMILIARES;2;2;4;0;0;0;2;2;4;0;0;0
AGUASCALIENTES;LICENCIATURA EN ADMINISTRACI흁 Y DIRECCI흁 EMPRESARIAL;77;62;139;17;19;36;1;3;4;1;3;4
AGUASCALIENTES;LICENCIATURA EN ADMINISTRACI흁 Y FINANZAS;56;76;132;11;11;22;11;10;21;4;7;11
AGUASCALIENTES;LICENCIATURA EN ADMINISTRACI흁 Y GESTI흁 EMPRESARIAL;71;86;157;18;30;48;12;16;28;7;1;8
AGUASCALIENTES;LICENCIATURA EN ADMINISTRACI흁 Y GESTI흁 FISCAL DE PYMES;133;69;202;25;17;42;22;8;30;16;4;20
AGUASCALIENTES;LICENCIATURA EN ADMINISTRACI흁 Y NEGOCIOS INTERNACIONALES;72;52;124;15;11;26;19;4;23;15;4;19
AGUASCALIENTES;LICENCIATURA EN AGRONEGOCIOS;50;89;139;10;16;26;9;15;24;8;11;19
AGUASCALIENTES;LICENCIATURA EN AN첿ISIS QU펤ICO BIOL휺ICOS;0;0;0;0;0;0;13;2;15;17;4;21
AGUASCALIENTES;LICENCIATURA EN ARQUITECTURA;174;322;496;64;125;189;10;26;36;1;8;9
AGUASCALIENTES;LICENCIATURA EN ARQUITECTURA DE INTERIORES;15;1;16;9;1;10;0;0;0;0;0;0
AGUASCALIENTES;LICENCIATURA EN ARTES CINEMATOGR첹ICAS Y AUDIOVISUALES;30;72;102;7;15;22;5;14;19;5;15;20
AGUASCALIENTES;LICENCIATURA EN ARTES ESC텙ICAS;54;23;77;16;10;26;14;2;16;15;2;17
AGUASCALIENTES;LICENCIATURA EN ARTES ESC텙ICAS Y AUDIOVISUALES;0;0;0;0;0;0;0;0;0;3;1;4
AGUASCALIENTES;LICENCIATURA EN ARTES VISUALES;84;50;134;24;7;31;12;7;19;0;4;4
AGUASCALIENTES;LICENCIATURA EN ATENCI흁 PREHOSPITALARIA;12;52;64;3;13;16;1;10;11;1;6;7
AGUASCALIENTES;LICENCIATURA EN BIOLOG페;121;77;198;27;22;49;19;11;30;18;7;25
AGUASCALIENTES;LICENCIATURA EN BIOTECNOLOG페;112;71;183;23;26;49;20;14;34;18;12;30
AGUASCALIENTES;LICENCIATURA EN CIENCIAS AMBIENTALES;19;8;27;0;0;0;11;3;14;9;4;13
AGUASCALIENTES;LICENCIATURA EN CIENCIAS DE LA COMUNICACI흁;40;58;98;19;31;50;2;0;2;2;0;2
AGUASCALIENTES;LICENCIATURA EN CIENCIAS DE LA EDUCACI흁;78;30;108;42;13;55;17;6;23;2;1;3
AGUASCALIENTES;LICENCIATURA EN CIENCIAS DEL ARTE Y GESTI흁 CULTURAL;13;5;18;0;0;0;12;6;18;13;4;17
AGUASCALIENTES;LICENCIATURA EN CIENCIAS DEL DEPORTE;83;255;338;29;104;133;8;24;32;3;11;14
AGUASCALIENTES;LICENCIATURA EN CIENCIAS POL펪ICAS Y ADMINISTRACI흁 P２LICA;82;79;161;22;16;38;8;19;27;8;19;27
AGUASCALIENTES;LICENCIATURA EN CIENCIAS Y T텎NICAS DE LA COMUNICACI흁;32;20;52;20;12;32;13;9;22;4;1;5
AGUASCALIENTES;LICENCIATURA EN CINEMATOGRAF페 Y ANIMACI흁 DIGITAL;17;33;50;11;16;27;0;0;0;0;0;0
AGUASCALIENTES;LICENCIATURA EN COMERCIO ELECTR흁ICO;66;72;138;13;17;30;9;7;16;12;9;21
AGUASCALIENTES;LICENCIATURA EN COMERCIO EXTERIOR Y ADUANAS;7;8;15;0;1;1;0;2;2;0;0;0
AGUASCALIENTES;LICENCIATURA EN COMERCIO INTERNACIONAL;268;185;453;66;60;126;51;31;82;42;22;64
AGUASCALIENTES;LICENCIATURA EN COMERCIO Y NEGOCIOS INTERNACIONALES;115;145;260;59;62;121;0;2;2;0;1;1
AGUASCALIENTES;LICENCIATURA EN COMUNICACI흁;14;15;29;0;0;0;8;7;15;4;1;5
AGUASCALIENTES;LICENCIATURA EN COMUNICACI흁 CORPORATIVA ESTRAT텒ICA ;19;12;31;19;12;31;0;0;0;0;0;0
AGUASCALIENTES;LICENCIATURA EN COMUNICACI흁 E IMAGEN P２LICA;9;10;19;0;0;0;2;1;3;0;1;1
AGUASCALIENTES;LICENCIATURA EN COMUNICACI흁 E INFORMACI흁;104;92;196;26;23;49;14;17;31;16;18;34
AGUASCALIENTES;LICENCIATURA EN COMUNICACI흁 ORGANIZACIONAL;98;27;125;0;0;0;20;6;26;11;1;12
AGUASCALIENTES;LICENCIATURA EN COMUNICACI흁 Y MEDIOS DIGITALES;6;9;15;2;7;9;0;0;0;0;0;0
AGUASCALIENTES;LICENCIATURA EN CONTABILIDAD Y DERECHO FISCAL;0;0;0;0;0;0;4;2;6;0;0;0
AGUASCALIENTES;LICENCIATURA EN CONTABILIDAD Y FINANZAS;75;67;142;32;37;69;5;1;6;0;0;0
AGUASCALIENTES;LICENCIATURA EN CONTADOR P２LICO;70;27;97;0;0;0;30;13;43;0;0;0
AGUASCALIENTES;LICENCIATURA EN CONTADUR페;37;32;69;7;5;12;5;4;9;4;4;8
AGUASCALIENTES;LICENCIATURA EN CONTADUR페 P２LICA;187;119;306;83;55;138;17;8;25;12;3;15
AGUASCALIENTES;LICENCIATURA EN CONTADUR페 P２LICA E IMPUESTOS;65;21;86;9;5;14;3;2;5;1;1;2
AGUASCALIENTES;LICENCIATURA EN CONTADUR페 Y FINANZAS;98;55;153;57;21;78;15;12;27;0;1;1
AGUASCALIENTES;LICENCIATURA EN CONTADUR페 Y SISTEMAS FINANCIEROS;69;57;126;25;17;42;8;10;18;6;4;10
AGUASCALIENTES;LICENCIATURA EN CRIMINAL펩TICA;117;86;203;78;54;132;0;0;0;0;0;0
AGUASCALIENTES;LICENCIATURA EN CRIMINAL펩TICA E INVESTIGACI흁 CRIMINAL;23;22;45;23;22;45;0;0;0;0;0;0
AGUASCALIENTES;LICENCIATURA EN CRIMINOLOG페;280;207;487;102;73;175;60;41;101;55;35;90
AGUASCALIENTES;LICENCIATURA EN CULTURA F펩ICA Y DEL DEPORTE;54;118;172;13;32;45;6;22;28;9;25;34
AGUASCALIENTES;LICENCIATURA EN DANZA CL쳅ICA EN LA MODALIDAD DE INTERPRETE;66;6;72;12;0;12;4;0;4;4;0;4
AGUASCALIENTES;LICENCIATURA EN DANZA CONTEMPOR쳁EA EN LA MODALIDAD DE INTERPRETE;32;10;42;11;2;13;4;1;5;0;0;0
AGUASCALIENTES;LICENCIATURA EN DERECHO;2023;1722;3745;724;629;1353;339;307;646;212;165;377
AGUASCALIENTES;LICENCIATURA EN DESARROLLO E INNOVACI흁 EMPRESARIAL;20;2;22;0;0;0;16;7;23;0;0;0
AGUASCALIENTES;LICENCIATURA EN DESARROLLO ORGANIZACIONAL;6;3;9;6;3;9;0;0;0;0;0;0
AGUASCALIENTES;LICENCIATURA EN DIRECCI흁 DE NEGOCIOS GASTRON흀ICOS;47;25;72;13;9;22;10;2;12;7;3;10
AGUASCALIENTES;LICENCIATURA EN DIRECCI흁 EN VENTAS;0;0;0;0;0;0;1;2;3;0;0;0
AGUASCALIENTES;LICENCIATURA EN DISE헲 ARQUITECT흁ICO Y DE INTERIORES;48;68;116;27;21;48;0;0;0;5;5;10
AGUASCALIENTES;LICENCIATURA EN DISE헲 DE ANIMACI흁 DIGITAL;35;54;89;18;15;33;10;18;28;0;0;0
AGUASCALIENTES;LICENCIATURA EN DISE헲 DE INTERIORES;138;28;166;36;9;45;17;1;18;17;1;18
AGUASCALIENTES;LICENCIATURA EN DISE헲 DE MODAS E INDUMENTARIA Y TEXTILES;270;33;303;27;8;35;45;7;52;53;7;60
AGUASCALIENTES;LICENCIATURA EN DISE헲 E INDUSTRIA DEL VESTIDO Y DE LA MODA;27;5;32;27;5;32;0;0;0;0;0;0
AGUASCALIENTES;LICENCIATURA EN DISE헲 GR첹ICO;167;116;283;20;17;37;38;19;57;42;16;58
AGUASCALIENTES;LICENCIATURA EN DISE헲 GR첹ICO DIGITAL;31;42;73;13;19;32;0;1;1;0;1;1
AGUASCALIENTES;LICENCIATURA EN DISE헲 GR첹ICO EN MEDIOS DIGITALES;23;13;36;11;5;16;0;0;0;0;0;0
AGUASCALIENTES;LICENCIATURA EN DISE헲 GR첹ICO Y MULTIMEDIA;1;0;1;0;0;0;0;0;0;0;0;0
AGUASCALIENTES;LICENCIATURA EN DISE헲 INDUSTRIAL;171;141;312;35;14;49;35;25;60;42;22;64
AGUASCALIENTES;LICENCIATURA EN DISE헲 TEXTIL Y CREACI흁 DE MODAS;0;0;0;0;0;0;5;1;6;1;1;2
AGUASCALIENTES;LICENCIATURA EN DISE헲 Y GESTI흁 DE REDES LOG펩TICAS  ;39;25;64;0;0;0;0;0;0;0;0;0
AGUASCALIENTES;LICENCIATURA EN DOCENCIA DE FRANC텝 Y ESPA헲L COMO LENGUA EXTRANJERA;84;32;116;20;13;33;15;1;16;4;2;6
AGUASCALIENTES;LICENCIATURA EN DOCENCIA DE LA DANZA FOLCLRICA MEXICANA  ;5;6;11;0;0;0;0;0;0;1;1;2
AGUASCALIENTES;LICENCIATURA EN DOCENCIA DEL IDIOMA INGL텝;139;67;206;31;17;48;23;9;32;18;8;26
AGUASCALIENTES;LICENCIATURA EN ECONOM페;44;85;129;15;22;37;16;25;41;17;18;35
AGUASCALIENTES;LICENCIATURA EN EDUCACI흁;105;27;132;22;3;25;34;4;38;32;8;40
AGUASCALIENTES;LICENCIATURA EN EDUCACI흁 E INNOVACI흁 PEDAG휺ICA;34;9;43;15;2;17;0;0;0;0;0;0
AGUASCALIENTES;LICENCIATURA EN EDUCACI흁 F펩ICA Y DEPORTES;14;46;60;13;17;30;1;5;6;0;4;4
AGUASCALIENTES;LICENCIATURA EN EDUCACI흁 F펩ICA, DEPORTE Y RECREACI흁;2;10;12;2;10;12;0;0;0;0;0;0
AGUASCALIENTES;LICENCIATURA EN ENFERMER페;1357;361;1718;500;131;631;250;87;337;202;61;263
AGUASCALIENTES;LICENCIATURA EN ENSE헤NZA DEL IDIOMA INGL텝;14;14;28;0;0;0;4;3;7;5;5;10
AGUASCALIENTES;LICENCIATURA EN ENSE헤NZA DEL INGL텝;60;23;83;8;4;12;1;2;3;9;2;11
AGUASCALIENTES;LICENCIATURA EN ESTUDIOS DEL ARTE Y GESTI흁  CULTURAL;76;31;107;17;9;26;0;0;0;0;0;0
AGUASCALIENTES;LICENCIATURA EN FILOSOF페;37;64;101;7;17;24;1;2;3;2;3;5
AGUASCALIENTES;LICENCIATURA EN FINANZAS Y BANCA;11;33;44;3;10;13;0;0;0;0;0;0
AGUASCALIENTES;LICENCIATURA EN FISIOTERAPIA;231;105;336;101;40;141;32;6;38;32;6;38
AGUASCALIENTES;LICENCIATURA EN GASTRONOM페;121;96;217;57;36;93;9;3;12;0;0;0
AGUASCALIENTES;LICENCIATURA EN GASTRONOM페 Y ADMINISTRACI흁;13;13;26;9;11;20;0;0;0;0;0;0
AGUASCALIENTES;LICENCIATURA EN GESTI흁 DE NEGOCIOS Y PROYECTOS   ;31;18;49;0;0;0;0;0;0;0;0;0
AGUASCALIENTES;LICENCIATURA EN GESTI흁 DEL CAPITAL HUMANO;140;40;180;23;3;26;0;0;0;0;0;0
AGUASCALIENTES;LICENCIATURA EN GESTI흁 E INNOVACI흁 HOTELERA Y TUR펩TICA;5;0;5;0;0;0;0;0;0;0;0;0
AGUASCALIENTES;LICENCIATURA EN GESTI흁 INSTITUCIONAL EDUCATIVA Y CURRICULAR;16;4;20;0;0;0;0;0;0;0;0;0
AGUASCALIENTES;LICENCIATURA EN GESTI흁 TUR펩TICA;101;24;125;18;6;24;19;4;23;14;4;18
AGUASCALIENTES;LICENCIATURA EN GESTI흁 Y DESARROLLO TUR펩TICO;12;6;18;12;6;18;0;0;0;0;0;0
AGUASCALIENTES;LICENCIATURA EN HISTORIA;40;69;109;6;20;26;7;6;13;9;6;15
AGUASCALIENTES;LICENCIATURA EN INFORM쳆ICA;2;14;16;0;0;0;0;0;0;5;4;9
AGUASCALIENTES;LICENCIATURA EN INFORM쳆ICA Y TECNOLOG페S COMPUTACIONALES   ;38;143;181;5;33;38;8;21;29;7;16;23
AGUASCALIENTES;LICENCIATURA EN INGENIER페 CIVIL;5;19;24;1;3;4;2;5;7;0;0;0
AGUASCALIENTES;LICENCIATURA EN INGENIER페 CIVIL Y ADMINISTRACI흁;6;39;45;2;12;14;0;0;0;0;0;0
AGUASCALIENTES;LICENCIATURA EN INGENIER페 EN INTELIGENCIA ARTIFICIAL;14;62;76;8;23;31;0;11;11;3;7;10
AGUASCALIENTES;LICENCIATURA EN INGENIER페 EN MEC쳁ICA AUTOMOTRIZ;2;69;71;0;23;23;1;4;5;0;0;0
AGUASCALIENTES;LICENCIATURA EN INGENIER페 EN SISTEMAS COMPUTACIONALES;28;101;129;17;70;87;1;5;6;0;4;4
AGUASCALIENTES;LICENCIATURA EN INGENIER페 EN SISTEMAS DE INFORMACI흁;34;47;81;7;17;24;0;0;0;0;0;0
AGUASCALIENTES;LICENCIATURA EN INGENIER페 EN TECNOLOG페S ENERG텞ICAS;9;26;35;4;4;8;6;7;13;4;2;6
AGUASCALIENTES;LICENCIATURA EN INGENIER페 INDUSTRIAL;89;297;386;28;87;115;0;0;0;0;0;0
AGUASCALIENTES;LICENCIATURA EN INGENIER페 INDUSTRIAL Y ADMINISTRACI흁;8;17;25;8;14;22;0;0;0;0;0;0
AGUASCALIENTES;LICENCIATURA EN INGENIER페 INDUSTRIAL Y CALIDAD;8;27;35;8;27;35;0;0;0;0;0;0
AGUASCALIENTES;LICENCIATURA EN INGENIER페 INDUSTRIAL Y DE SISTEMAS;6;19;25;0;0;0;4;3;7;3;1;4
AGUASCALIENTES;LICENCIATURA EN INGENIER페 INDUSTRIAL Y LOG펩TICA   ;3;2;5;3;2;5;0;0;0;0;0;0
AGUASCALIENTES;LICENCIATURA EN INGENIER페 MEC쳁ICA;66;785;851;16;152;168;12;140;152;1;36;37
AGUASCALIENTES;LICENCIATURA EN INGENIER페 MECATR흁ICA CON ENFOQUE AUTOMOTRIZ;6;27;33;2;5;7;0;0;0;0;0;0
AGUASCALIENTES;LICENCIATURA EN INGENIER페 PARA EL DISE헲 Y DESARROLLO DE SOFTWARE ;0;18;18;0;9;9;0;0;0;0;0;0
AGUASCALIENTES;LICENCIATURA EN INGENIER페 QU펤ICA;349;245;594;75;48;123;35;22;57;25;18;43
AGUASCALIENTES;LICENCIATURA EN INGENIERO ARQUITECTO;37;58;95;23;22;45;11;25;36;11;25;36
AGUASCALIENTES;LICENCIATURA EN INGL텝;60;19;79;30;8;38;0;0;0;0;0;0
AGUASCALIENTES;LICENCIATURA EN INNOVACI흁 CULINARIA Y GESTI흁;16;8;24;16;8;24;0;0;0;0;0;0
AGUASCALIENTES;LICENCIATURA EN INNOVACI흁 DE NEGOCIOS Y MERCADOTECNIA  ;12;3;15;12;3;15;0;0;0;0;0;0
AGUASCALIENTES;LICENCIATURA EN INNOVACI흁 DE NEGOCIOS Y MERCADOTECNIA   ;55;37;92;0;0;0;0;0;0;0;0;0
AGUASCALIENTES;LICENCIATURA EN INNOVACI흁 Y DIRECCI흁 DE NEGOCIOS;13;15;28;0;0;0;3;7;10;3;7;10
AGUASCALIENTES;LICENCIATURA EN INTERVENCI흁 EDUCATIVA;24;3;27;10;2;12;0;0;0;13;2;15
AGUASCALIENTES;LICENCIATURA EN KINESIOLOG페;107;76;183;32;26;58;11;10;21;6;4;10
AGUASCALIENTES;LICENCIATURA EN LETRAS HISP쳁ICAS;114;39;153;26;14;40;24;5;29;26;7;33
AGUASCALIENTES;LICENCIATURA EN LOG펩TICA EMPRESARIAL;229;166;395;48;31;79;34;26;60;27;16;43
AGUASCALIENTES;LICENCIATURA EN MATEM쳆ICAS APLICADAS;38;44;82;16;18;34;4;5;9;4;6;10
AGUASCALIENTES;LICENCIATURA EN MERCADOTECNIA;317;250;567;67;59;126;69;49;118;52;27;79
AGUASCALIENTES;LICENCIATURA EN MERCADOTECNIA DIGITAL;17;25;42;4;11;15;0;0;0;0;0;0
AGUASCALIENTES;LICENCIATURA EN MERCADOTECNIA Y COMUNICACI흁;3;0;3;0;0;0;4;1;5;4;1;5
AGUASCALIENTES;LICENCIATURA EN MERCADOTECNIA Y DISE헲 GR첹ICO;83;63;146;45;39;84;6;8;14;0;0;0
AGUASCALIENTES;LICENCIATURA EN MERCADOTECNIA Y MEDIOS DE COMUNICACI흁;60;59;119;24;29;53;19;7;26;0;0;0
AGUASCALIENTES;LICENCIATURA EN MERCADOTECNIA Y NEGOCIOS INTERNACIONALES;123;119;242;67;74;141;21;11;32;0;0;0
AGUASCALIENTES;LICENCIATURA EN MERCADOTECNIA Y RELACIONES P２LICAS;40;28;68;31;14;45;10;3;13;0;0;0
AGUASCALIENTES;LICENCIATURA EN MＣICA;40;56;96;8;16;24;4;8;12;4;6;10
AGUASCALIENTES;LICENCIATURA EN NEGOCIOS GASTRON흀ICOS Y EMPRESAS TUR펩TICAS;19;14;33;10;7;17;9;0;9;3;0;3
AGUASCALIENTES;LICENCIATURA EN NEGOCIOS Y ADMINISTRACI흁;327;152;479;114;56;170;64;29;93;34;10;44
AGUASCALIENTES;LICENCIATURA EN NUTRICI흁;420;181;601;121;68;189;77;30;107;72;16;88
AGUASCALIENTES;LICENCIATURA EN ODONTOLOG페;126;56;182;29;21;50;2;4;6;1;4;5
AGUASCALIENTES;LICENCIATURA EN OPTOMETR페;98;47;145;24;15;39;14;8;22;19;9;28
AGUASCALIENTES;LICENCIATURA EN PEDAGOG페;884;116;1000;355;51;406;93;13;106;23;2;25
AGUASCALIENTES;LICENCIATURA EN PEDAGOG페 INFANTIL;5;0;5;0;0;0;35;1;36;37;2;39
AGUASCALIENTES;LICENCIATURA EN PROTECCI흁 CIVIL;11;80;91;3;20;23;2;36;38;0;49;49
AGUASCALIENTES;LICENCIATURA EN PROTECCI흁 CIVIL Y EMERGENCIA;41;28;69;0;0;0;19;13;32;0;0;0
AGUASCALIENTES;LICENCIATURA EN PSICOLOG페;1051;373;1424;347;136;483;150;29;179;80;16;96
AGUASCALIENTES;LICENCIATURA EN PSICOLOG페 CL펥ICA;18;4;22;4;1;5;16;4;20;0;0;0
AGUASCALIENTES;LICENCIATURA EN PSICOLOG페 EDUCATIVA;4;1;5;4;1;5;4;1;5;0;0;0
AGUASCALIENTES;LICENCIATURA EN PSICOLOG페 HUMANISTA;17;4;21;17;4;21;5;0;5;5;0;5
AGUASCALIENTES;LICENCIATURA EN PSICOLOG페 HUMAN펩TICA;10;3;13;0;0;0;9;2;11;1;1;2
AGUASCALIENTES;LICENCIATURA EN PSICOLOG페 INDUSTRIAL;28;11;39;0;0;0;9;1;10;2;2;4
AGUASCALIENTES;LICENCIATURA EN PSICOLOG페 ORGANIZACIONAL;30;8;38;14;5;19;4;0;4;0;0;0
AGUASCALIENTES;LICENCIATURA EN PSICOLOG페 SOCIAL;11;4;15;4;1;5;0;0;0;0;0;0
AGUASCALIENTES;LICENCIATURA EN PSICOPEDAGOG페;39;1;40;12;0;12;28;1;29;2;0;2
AGUASCALIENTES;LICENCIATURA EN PUBLICIDAD;0;0;0;0;0;0;1;0;1;3;0;3
AGUASCALIENTES;LICENCIATURA EN PUBLICIDAD Y MERCADOTECNIA;1;0;1;0;0;0;0;0;0;0;0;0
AGUASCALIENTES;LICENCIATURA EN RELACIONES INDUSTRIALES;286;79;365;32;10;42;61;18;79;57;16;73
AGUASCALIENTES;LICENCIATURA EN RELACIONES INTERNACIONALES;2;0;2;0;0;0;0;0;0;0;0;0
AGUASCALIENTES;LICENCIATURA EN SALUD P２LICA;0;0;0;0;0;0;0;0;0;1;1;2
AGUASCALIENTES;LICENCIATURA EN SERVICIOS DE GASTRONOM페;0;0;0;0;0;0;3;4;7;0;2;2
AGUASCALIENTES;LICENCIATURA EN SOCIOLOG페;50;21;71;14;5;19;3;1;4;5;1;6
AGUASCALIENTES;LICENCIATURA EN TEATRO;26;25;51;12;7;19;14;8;22;6;6;12
AGUASCALIENTES;LICENCIATURA EN TECNOLOG페S DE INFORMACI흁;0;0;0;0;0;0;1;0;1;1;3;4
AGUASCALIENTES;LICENCIATURA EN TERAPIA F펩ICA;132;38;170;0;0;0;28;7;35;26;11;37
AGUASCALIENTES;LICENCIATURA EN TERAPIA F펩ICA Y REHABILITACI흁;194;89;283;0;0;0;74;27;101;70;16;86
AGUASCALIENTES;LICENCIATURA EN TRABAJO SOCIAL;198;18;216;38;5;43;42;8;50;28;1;29
AGUASCALIENTES;LICENCIATURA EN URBANISMO;36;99;135;12;28;40;7;20;27;10;22;32
AGUASCALIENTES;LICENCIATURA EN VETERINARIA Y ZOOTECNIA;73;111;184;27;40;67;0;1;1;0;0;0
AGUASCALIENTES;LICENCIATURA INTERNACIONAL EN ADMINISTRACI흁 DE EMPRESAS DE LA HOSPITALIDAD;20;6;26;0;0;0;7;2;9;3;2;5
AGUASCALIENTES;LICENCIATURA INTERNACIONAL EN ADMINISTRACI흁 DE EMPRESAS GASTRON흀ICAS;10;8;18;0;0;0;7;7;14;2;3;5
AGUASCALIENTES;M텏ICO CIRUJANO;460;308;768;61;35;96;83;71;154;65;67;132
AGUASCALIENTES;M텏ICO CIRUJANO INTEGRAL;336;252;588;134;101;235;10;6;16;22;11;33
AGUASCALIENTES;M텏ICO ESTOMAT휿OGO;481;211;692;24;15;39;56;25;81;60;20;80
AGUASCALIENTES;M텏ICO VETERINARIO ZOOTECNISTA;255;163;418;34;15;49;53;35;88;50;28;78
AGUASCALIENTES;NIVELACI흁 A LICENCIATURA EN ENFERMER페;151;32;183;27;5;32;149;25;174;4;0;4
AGUASCALIENTES;QU펤ICO FARMAC텟TICO BI휿OGO;247;135;382;33;17;50;42;12;54;33;9;42
AGUASCALIENTES;TRONCO COM＞ EN INGENIER페;25;41;66;20;37;57;0;0;0;0;0;0
AGUASCALIENTES;TRONCO COM＞ EN LICENCIATURA;75;42;117;41;31;72;0;0;0;0;0;0
BAJA CALIFORNIA;TOTAL;72178;67018;139196;18377;15909;34286;12263;9597;21860;8725;7050;15775
BAJA CALIFORNIA;LICENCIATURA EN EDUCACI흁 ART펩TICA;38;23;61;28;20;48;0;0;0;2;0;2
BAJA CALIFORNIA;LICENCIATURA EN EDUCACI흁 ESPECIAL EN EL REA DE ATENCI흁 AUDITIVA Y DE LENGUAJE;84;7;91;0;0;0;35;3;38;35;2;37
BAJA CALIFORNIA;LICENCIATURA EN EDUCACI흁 ESPECIAL EN EL REA DE ATENCI흁 INTELECTUAL;13;0;13;0;0;0;12;4;16;11;4;15
BAJA CALIFORNIA;LICENCIATURA EN EDUCACI흁 ESPECIAL EN EL REA DE ATENCI흁 MOTRIZ;0;0;0;0;0;0;14;1;15;14;1;15
BAJA CALIFORNIA;LICENCIATURA EN EDUCACI흁 F펩ICA;47;79;126;15;42;57;12;16;28;11;15;26
BAJA CALIFORNIA;LICENCIATURA EN EDUCACI흁 PREESCOLAR;577;3;580;195;1;196;104;2;106;95;1;96
BAJA CALIFORNIA;LICENCIATURA EN EDUCACI흁 PREESCOLAR IND펞ENA CON ENFOQUE INTERCULTURAL BILING㏊;38;2;40;28;2;30;0;0;0;0;0;0
BAJA CALIFORNIA;LICENCIATURA EN EDUCACI흁 PRIMARIA;738;183;921;327;110;437;154;25;179;164;28;192
BAJA CALIFORNIA;LICENCIATURA EN EDUCACI흁 SECUNDARIA CON ESPECIALIDAD EN ESPA헲L;50;5;55;0;0;0;31;3;34;30;2;32
BAJA CALIFORNIA;LICENCIATURA EN EDUCACI흁 SECUNDARIA CON ESPECIALIDAD EN HISTORIA;0;0;0;0;0;0;2;0;2;2;0;2
BAJA CALIFORNIA;LICENCIATURA EN EDUCACI흁 SECUNDARIA CON ESPECIALIDAD EN MATEM쳆ICAS;37;16;53;0;0;0;15;12;27;13;12;25
BAJA CALIFORNIA;LICENCIATURA EN EDUCACI흁 SECUNDARIA CON ESPECIALIDAD EN TELESECUNDARIA;16;1;17;0;0;0;6;2;8;6;2;8
BAJA CALIFORNIA;LICENCIATURA EN ENSE헤NZA Y APRENDIZAJE DE LAS MATEM쳆ICAS EN EDUCACI흁 SECUNDARIA;50;33;83;29;20;49;0;0;0;0;0;0
BAJA CALIFORNIA;LICENCIATURA EN ENSE헤NZA Y APRENDIZAJE DEL ESPA헲L EN EDUCACI흁 SECUNDARIA;80;16;96;47;9;56;0;0;0;0;0;0
BAJA CALIFORNIA;LICENCIATURA EN ENSE헤NZA Y APRENDIZAJE DEL INGL텝 EN EDUCACI흁 SECUNDARIA;51;25;76;36;20;56;0;0;0;0;0;0
BAJA CALIFORNIA;LICENCIATURA EN ENSE헤NZA Y APRENDIZAJE EN TELESECUNDARIA;31;16;47;20;14;34;0;0;0;0;0;0
BAJA CALIFORNIA;LICENCIATURA EN INCLUSI흁 EDUCATIVA;160;26;186;103;24;127;0;0;0;0;0;0
BAJA CALIFORNIA;ARQUITECTO;1058;1030;2088;228;183;411;148;144;292;168;128;296
BAJA CALIFORNIA;ARQUITECTURA;458;429;887;74;72;146;39;33;72;31;20;51
BAJA CALIFORNIA;BIOINGENIER페;432;584;1016;49;125;174;81;77;158;51;63;114
BAJA CALIFORNIA;BI휿OGO;185;143;328;16;24;40;24;14;38;22;18;40
BAJA CALIFORNIA;CIRUJANO DENTISTA;1869;854;2723;204;105;309;318;145;463;270;119;389
