ENTIDAD FEDERATIVA;NOMBRE PROGRAMA EDUCATIVO;Matr鞍ula Mujeres;Matr鞍ula Hombres;Matr鞍ula Total;Nuevo Ingreso Mujeres;Nuevo Ingreso Hombres;Nuevo Ingreso Total;Egresados Mujeres;Egresados Hombres;Egresados Total;Titulados Mujeres;Titulados Hombres;Titulados Total
M텢ICO;LICENCIATURA EN PSICOLOG페 EDUCATIVA;508;156;664;165;59;224;145;41;186;108;35;143
M텢ICO;LICENCIATURA EN PSICOLOG페 EDUCATIVA Y DESARROLLO HUMANO;107;36;143;19;9;28;31;6;37;16;6;22
M텢ICO;LICENCIATURA EN PSICOLOG페 EN SISTEMA DE EDUCACI흁 B쳅ICA Y A DISTANCIA;2790;1398;4188;642;556;1198;317;107;424;135;32;167
M텢ICO;LICENCIATURA EN PSICOLOG페 INDUSTRIAL;664;278;942;154;68;222;72;25;97;73;23;96
M텢ICO;LICENCIATURA EN PSICOLOG페 ORGANIZACIONAL;105;27;132;10;3;13;33;5;38;29;5;34
M텢ICO;LICENCIATURA EN PSICOLOG페 ORGANIZACIONAL Y SOCIAL;2;0;2;0;0;0;1;0;1;0;0;0
M텢ICO;LICENCIATURA EN PSICOLOG페 SOCIAL;867;326;1193;230;114;344;265;86;351;181;39;220
M텢ICO;LICENCIATURA EN PSICOLOG페 Y DESARROLLO HUMANO;169;62;231;118;35;153;18;11;29;5;4;9
M텢ICO;LICENCIATURA EN PSICOPEDAGOG페;1392;289;1681;421;103;524;244;45;289;163;20;183
M텢ICO;LICENCIATURA EN PUBLICIDAD;38;30;68;13;1;14;7;8;15;0;0;0
M텢ICO;LICENCIATURA EN PUBLICIDAD Y MEDIOS;108;68;176;19;14;33;40;18;58;21;20;41
M텢ICO;LICENCIATURA EN PUBLICIDAD Y MERCADOTECNIA DIGITAL;3;2;5;0;0;0;2;6;8;0;0;0
M텢ICO;LICENCIATURA EN PUBLICIDAD Y RELACIONES P２LICAS;11;10;21;0;0;0;8;6;14;1;1;2
M텢ICO;LICENCIATURA EN QU펤ICA;67;90;157;20;24;44;16;12;28;7;11;18
M텢ICO;LICENCIATURA EN QU펤ICA EN ALIMENTOS;130;42;172;33;11;44;19;5;24;10;7;17
M텢ICO;LICENCIATURA EN QU펤ICA FARMAC텟TICA BIOL휺ICA;547;286;833;132;77;209;97;57;154;102;48;150
M텢ICO;LICENCIATURA EN QU펤ICA INDUSTRIAL;191;227;418;44;60;104;21;12;33;14;19;33
M텢ICO;LICENCIATURA EN QUIROPR첶TICA;1105;631;1736;342;201;543;166;107;273;106;62;168
M텢ICO;LICENCIATURA EN RECURSOS H펛RICOS;75;119;194;15;22;37;4;6;10;5;3;8
M텢ICO;LICENCIATURA EN RECURSOS HUMANOS;50;27;77;17;11;28;10;2;12;1;0;1
M텢ICO;LICENCIATURA EN REDES;1;0;1;0;0;0;1;0;1;0;0;0
M텢ICO;LICENCIATURA EN RELACIONES ECON흀ICAS INTERNACIONALES;1033;553;1586;275;134;409;126;77;203;82;28;110
M텢ICO;LICENCIATURA EN RELACIONES INDUSTRIALES;54;43;97;10;8;18;9;5;14;10;4;14
M텢ICO;LICENCIATURA EN RELACIONES INTERNACIONALES;3369;2005;5374;823;530;1353;381;248;629;352;144;496
M텢ICO;LICENCIATURA EN RELACIONES INTERNACIONALES Y COMERCIO EXTERIOR;292;184;476;115;68;183;36;29;65;24;12;36
M텢ICO;LICENCIATURA EN RELACIONES P２LICAS;50;24;74;7;3;10;13;1;14;11;4;15
M텢ICO;LICENCIATURA EN RELACIONES P２LICAS Y ORGANIZACI흁 DE EVENTOS;6;2;8;4;2;6;0;0;0;0;0;0
M텢ICO;LICENCIATURA EN RESPONSABILIDAD Y LIDERAZGO SOCIAL;10;5;15;5;1;6;0;0;0;0;0;0
M텢ICO;LICENCIATURA EN SALUD INTERCULTURAL;368;122;490;123;48;171;23;11;34;11;4;15
M텢ICO;LICENCIATURA EN SEGURIDAD CIUDADANA;331;369;700;91;94;185;44;49;93;9;5;14
M텢ICO;LICENCIATURA EN SEGURIDAD P２LICA;132;271;403;53;84;137;25;47;72;0;3;3
M텢ICO;LICENCIATURA EN SEGURIDAD P２LICA E INVESTIGACI흁 POLICIAL;46;100;146;23;55;78;0;0;0;0;0;0
M텢ICO;LICENCIATURA EN SISTEMAS COMPUTACIONALES;86;372;458;49;181;230;16;73;89;15;62;77
M텢ICO;LICENCIATURA EN SISTEMAS INFORM쳆ICOS;0;0;0;0;0;0;0;4;4;0;3;3
M텢ICO;LICENCIATURA EN SOCIOLOG페;764;578;1342;165;179;344;112;89;201;57;37;94
M텢ICO;LICENCIATURA EN TEATRO Y ACTUACI흁;59;12;71;17;2;19;3;1;4;3;1;4
M텢ICO;LICENCIATURA EN TECNOLOG페 ELECTR흁ICA;8;26;34;3;6;9;3;5;8;0;2;2
M텢ICO;LICENCIATURA EN TECNOLOG페S DE LA INFORMACI흁;5;15;20;5;15;20;0;0;0;0;0;0
M텢ICO;LICENCIATURA EN TECNOLOG페S E INFORMACI흁;1;14;15;0;0;0;0;0;0;0;0;0
M텢ICO;LICENCIATURA EN TELEINFORM쳆ICA;3;5;8;3;5;8;1;3;4;1;1;2
M텢ICO;LICENCIATURA EN TERAPIA F펩ICA;977;362;1339;337;141;478;82;25;107;45;34;79
M텢ICO;LICENCIATURA EN TERAPIA F펩ICA Y REHABILITACI흁;320;130;450;90;50;140;62;22;84;47;9;56
M텢ICO;LICENCIATURA EN TERAPIA OCUPACIONAL;276;46;322;94;12;106;63;14;77;31;12;43
M텢ICO;LICENCIATURA EN TRABAJO SOCIAL;1203;220;1423;325;90;415;263;39;302;185;22;207
M텢ICO;LICENCIATURA EN TURISMO;2938;1229;4167;872;390;1262;463;197;660;285;106;391
M텢ICO;LICENCIATURA EN TURISMO CULTURAL;5;1;6;5;1;6;0;0;0;0;0;0
M텢ICO;LICENCIATURA EN TURISMO CULTURAL Y CULTURA GASTRON흀ICA;29;3;32;0;0;0;6;0;6;6;0;6
M텢ICO;LICENCIATURA EN TURISMO SUSTENTABLE;7;4;11;0;0;0;8;2;10;1;0;1
M텢ICO;LICENCIATURA INTERNACIONAL EN ADMINISTRACI흁 DE CENTROS DE CONVENCIONES Y EVENTOS;288;108;396;81;38;119;15;3;18;1;1;2
M텢ICO;LICENCIATURA INTERNACIONAL EN ADMINISTRACI흁 DE EMPRESAS DE LA HOSPITALIDAD;42;11;53;0;0;0;17;4;21;15;8;23
M텢ICO;LICENCIATURA INTERNACIONAL EN ADMINISTRACI흁 DE HOTELES Y COMPLEJOS TUR펩TICOS;65;25;90;0;0;0;54;15;69;30;7;37
M텢ICO;LICENCIATURA INTERNACIONAL EN GASTRONOM페;77;95;172;23;37;60;22;29;51;12;21;33
M텢ICO;LICENCIATURA INTERNACIONAL EN TURISMO Y REUNIONES;60;14;74;42;12;54;0;0;0;0;0;0
M텢ICO;LICENCIATURA QU펤ICO FARMAC텟TICO BI휿OGO;181;106;287;76;48;124;18;13;31;16;8;24
M텢ICO;M텏ICO CIRUJANO;4778;2636;7414;759;366;1125;740;481;1221;691;432;1123
M텢ICO;M텏ICO VETERINARIO ZOOTECNISTA;2438;1592;4030;541;286;827;250;166;416;178;187;365
M텢ICO;QU펤ICO;319;406;725;92;77;169;10;22;32;18;13;31
M텢ICO;QU펤ICO FARMAC텟TICO BIOTECN휿OGO;182;105;287;78;34;112;19;18;37;15;13;28
M텢ICO;TRONCO COM＞ EN ECONOM페 AGR펚OLA;139;114;253;139;114;253;0;0;0;0;0;0
M텢ICO;TRONCO COM＞ EN LICENCIATURA EN MERCADOTECNIA;1;0;1;0;0;0;5;2;7;4;1;5
MICHOAC쳁;TOTAL;60844;57100;117944;17226;16220;33446;10534;8577;19111;7720;6020;13740
MICHOAC쳁;LICENCIATURA EN EDUCACI흁 ESPECIAL EN EL REA DE ATENCI흁 INTELECTUAL;371;58;429;83;19;102;104;17;121;100;16;116
MICHOAC쳁;LICENCIATURA EN EDUCACI흁 PREESCOLAR;1321;80;1401;251;3;254;378;24;402;303;24;327
MICHOAC쳁;LICENCIATURA EN EDUCACI흁 PREESCOLAR INTERCULTURAL BILING㏊;27;23;50;27;23;50;32;12;44;32;12;44
MICHOAC쳁;LICENCIATURA EN EDUCACI흁 PRIMARIA;889;858;1747;251;246;497;226;242;468;202;225;427
MICHOAC쳁;LICENCIATURA EN EDUCACI흁 PRIMARIA INTERCULTURAL BILING㏊;20;30;50;20;30;50;11;28;39;11;28;39
MICHOAC쳁;LICENCIATURA EN EDUCACI흁 SECUNDARIA CON ESPECIALIDAD EN BIOLOG페;23;29;52;11;19;30;16;6;22;16;6;22
MICHOAC쳁;LICENCIATURA EN EDUCACI흁 SECUNDARIA CON ESPECIALIDAD EN ESPA헲L;137;68;205;39;18;57;23;15;38;21;14;35
MICHOAC쳁;LICENCIATURA EN EDUCACI흁 SECUNDARIA CON ESPECIALIDAD EN FORMACI흁 C펬ICA Y 텞ICA;27;18;45;0;0;0;13;10;23;13;9;22
MICHOAC쳁;LICENCIATURA EN EDUCACI흁 SECUNDARIA CON ESPECIALIDAD EN HISTORIA;63;58;121;25;31;56;6;8;14;5;8;13
MICHOAC쳁;LICENCIATURA EN EDUCACI흁 SECUNDARIA CON ESPECIALIDAD EN INGL텝;3;6;9;0;0;0;0;0;0;0;0;0
MICHOAC쳁;LICENCIATURA EN EDUCACI흁 SECUNDARIA CON ESPECIALIDAD EN LENGUA EXTRANJERA (INGL텝);21;15;36;0;0;0;10;13;23;10;12;22
MICHOAC쳁;LICENCIATURA EN EDUCACI흁 SECUNDARIA CON ESPECIALIDAD EN MATEM쳆ICAS;68;94;162;19;43;62;17;30;47;16;24;40
MICHOAC쳁;LICENCIATURA EN EDUCACI흁 SECUNDARIA CON ESPECIALIDAD EN QU펤ICA;25;17;42;0;0;0;0;0;0;0;0;0
MICHOAC쳁;LICENCIATURA EN EDUCACI흁 SECUNDARIA CON ESPECIALIDAD EN TELESECUNDARIA;59;69;128;13;19;32;15;14;29;15;14;29
MICHOAC쳁;TRONCO COM＞ EN LA LICENCIATURA EN EDUCACI흁 ESPECIAL;63;33;96;21;8;29;7;9;16;7;9;16
MICHOAC쳁;ARQUITECTO;855;1156;2011;235;322;557;97;161;258;117;161;278
MICHOAC쳁;ARQUITECTURA;278;445;723;95;156;251;16;26;42;3;5;8
MICHOAC쳁;CIRUJANO DENTISTA;1852;1059;2911;460;227;687;316;186;502;353;234;587
MICHOAC쳁;CONTADOR P２LICO;1009;663;1672;188;129;317;147;69;216;103;41;144
MICHOAC쳁;CONTADUR페 P２LICA;22;9;31;5;1;6;0;0;0;1;1;2
MICHOAC쳁;INGENIER페 AGR흁OMO;551;1364;1915;125;326;451;91;260;351;36;80;116
MICHOAC쳁;INGENIER페 AGR흁OMO HORTICULTOR;43;136;179;23;61;84;2;13;15;2;2;4
MICHOAC쳁;INGENIER페 AMBIENTAL;100;82;182;25;20;45;16;11;27;12;9;21
MICHOAC쳁;INGENIER페 ARQUITECTO;35;50;85;9;10;19;5;7;12;0;4;4
MICHOAC쳁;INGENIER페 BIOQU펤ICA;1136;705;1841;231;152;383;117;69;186;75;35;110
MICHOAC쳁;INGENIER페 CIVIL;585;2325;2910;156;605;761;64;253;317;46;275;321
MICHOAC쳁;INGENIER페 DE VIDEOJUEGOS;5;138;143;0;38;38;2;22;24;2;5;7
MICHOAC쳁;INGENIER페 ELECTRICISTA;19;227;246;7;69;76;1;23;24;3;28;31
MICHOAC쳁;INGENIER페 ELECTROMEC쳁ICA;7;96;103;0;19;19;2;18;20;1;8;9
MICHOAC쳁;INGENIER페 ELECTR흁ICA;56;459;515;15;135;150;8;71;79;6;39;45
MICHOAC쳁;INGENIER페 EN ADMINISTRACI흁;861;518;1379;185;129;314;113;63;176;109;51;160
MICHOAC쳁;INGENIER페 EN AGRONOM페;251;622;873;64;158;222;27;68;95;22;36;58
MICHOAC쳁;INGENIER페 EN BIOTECNOLOG페;162;107;269;0;0;0;26;24;50;0;0;0
MICHOAC쳁;INGENIER페 EN COMPUTACI흁;43;237;280;15;106;121;1;10;11;1;18;19
MICHOAC쳁;INGENIER페 EN DESARROLLO AGROINDUSTRIAL;82;121;203;13;27;40;6;17;23;3;3;6
MICHOAC쳁;INGENIER페 EN DESARROLLO COMUNITARIO;130;110;240;26;20;46;11;13;24;2;6;8
MICHOAC쳁;INGENIER페 EN EL텎TRICA;19;284;303;2;35;37;3;43;46;2;37;39
MICHOAC쳁;INGENIER페 EN ELECTROMEC쳁ICA;49;398;447;18;91;109;3;46;49;2;14;16
MICHOAC쳁;INGENIER페 EN ELECTR흁ICA;108;801;909;20;167;187;16;82;98;8;77;85
MICHOAC쳁;INGENIER페 EN ENERG페S RENOVABLES;10;68;78;1;23;24;1;0;1;1;0;1
MICHOAC쳁;INGENIER페 EN FORESTAL;34;74;108;7;16;23;7;9;16;2;6;8
MICHOAC쳁;INGENIER페 EN GEOCIENCIAS;44;83;127;6;13;19;12;24;36;18;42;60
MICHOAC쳁;INGENIER페 EN GESTI흁 EMPRESARIAL;2327;1546;3873;514;387;901;376;178;554;203;92;295
MICHOAC쳁;INGENIER페 EN INDUSTRIAS ALIMENTARIAS;692;444;1136;161;104;265;85;47;132;59;35;94
MICHOAC쳁;INGENIER페 EN INFORM쳆ICA;96;222;318;7;24;31;32;52;84;14;29;43
MICHOAC쳁;INGENIER페 EN INFORM쳆ICA ADMINISTRATIVA;1;7;8;0;0;0;2;7;9;4;2;6
MICHOAC쳁;INGENIER페 EN INNOVACI흁 AGR펚OLA SUSTENTABLE;539;1160;1699;188;432;620;46;98;144;29;41;70
MICHOAC쳁;INGENIERIA EN INNOVACI흁 TECNOL휺ICA SUSTENTABLE  ;22;40;62;16;29;45;0;0;0;0;0;0
MICHOAC쳁;INGENIER페 EN INNOVACI흁 Y TECNOLOG페 AGR펚OLA;1;10;11;1;7;8;0;0;0;0;0;0
MICHOAC쳁;INGENIER페 EN MANTENIMIENTO INDUSTRIAL;11;137;148;0;0;0;4;55;59;0;0;0
MICHOAC쳁;INGENIER페 EN MATERIALES;90;193;283;15;20;35;18;45;63;6;31;37
MICHOAC쳁;INGENIER페 EN MECATR흁ICA;132;843;975;28;179;207;8;69;77;7;69;76
MICHOAC쳁;INGENIER페 EN SISTEMAS COMPUTACIONALES;666;2754;3420;175;693;868;72;246;318;44;168;212
MICHOAC쳁;INGENIER페 EN SISTEMAS COMPUTACIONALES CON TERMINALES EN: ADMINISTRACI흁 DE REDES Y DISE헲 DE PLATAFORMAS WEB, DISE헲 EN ANIMACION E INTERACCION EN 2D Y 3D, DISE헲 GRAFICO, INTELIGENCIA DE NEGOCIOS Y/O PROTOCOLOS DE SEGURIDAD DIGITAL;11;20;31;3;7;10;3;15;18;1;3;4
MICHOAC쳁;INGENIER페 EN SISTEMAS DE INFORMACI흁;4;29;33;2;10;12;0;4;4;1;5;6
MICHOAC쳁;INGENIER페 EN TECNOLOG페 DE LA MADERA;31;67;98;9;21;30;8;15;23;2;10;12
MICHOAC쳁;INGENIER페 EN TECNOLOG페S DE LA INFORMACI흁;63;185;248;0;0;0;17;73;90;0;0;0
MICHOAC쳁;INGENIER페 EN TECNOLOG페S DE LA INFORMACI흁 Y COMUNICACI흁;158;356;514;34;66;100;18;54;72;17;40;57
MICHOAC쳁;INGENIER페 EN TECNOLOG페S DE LA INFORMACI흁 Y COMUNICACIONES;66;206;272;3;13;16;15;42;57;14;35;49
MICHOAC쳁;INGENIER페 FINANCIERA;10;12;22;1;2;3;5;6;11;0;1;1
MICHOAC쳁;INGENIER페 FORESTAL;0;0;0;0;0;0;0;0;0;0;1;1
MICHOAC쳁;INGENIER페 FORESTAL COMUNITARIA;12;19;31;10;13;23;0;0;0;0;0;0
MICHOAC쳁;INGENIER페 INDUSTRIAL;1723;3597;5320;371;836;1207;231;384;615;137;276;413
MICHOAC쳁;INGENIER페 INDUSTRIAL EN PROCESOS Y SERVICIOS;15;34;49;0;0;0;0;7;7;3;6;9
MICHOAC쳁;INGENIER페 INDUSTRIAL Y DE SISTEMAS;10;15;25;0;1;1;0;2;2;0;2;2
MICHOAC쳁;INGENIER페 MEC쳁ICA;115;1398;1513;30;312;342;11;142;153;7;170;177
MICHOAC쳁;INGENIER페 MECATR흁ICA;74;464;538;13;110;123;4;10;14;0;0;0
MICHOAC쳁;INGENIER페 QU펤ICA;186;121;307;44;41;85;19;11;30;8;7;15
MICHOAC쳁;INGENIER페 QU펤ICO;293;422;715;80;132;212;25;45;70;26;34;60
MICHOAC쳁;LICENCIADO EN ADMINISTRACI흁 CON REA TERMINAL EN COMERCIO INTERNACIONAL Y ADUANAS ;30;22;52;14;11;25;5;1;6;0;0;0
MICHOAC쳁;LICENCIADO EN ADMINISTRACI흁 CON REA TERMINAL EN GESTI흁 P２LICA ;0;1;1;0;0;0;0;0;0;0;0;0
MICHOAC쳁;LICENCIATURA EN ABOGAC페 INTERNACIONAL;10;13;23;4;7;11;8;10;18;2;2;4
MICHOAC쳁;LICENCIATURA EN ACTUACI흁 EN TEATRO, CINE Y TELEVISI흁;5;4;9;4;3;7;2;0;2;1;0;1
MICHOAC쳁;LICENCIATURA EN ADMINISTRACI흁;2374;1593;3967;537;399;936;486;275;761;298;142;440
MICHOAC쳁;LICENCIATURA EN ADMINISTRACI흁 CON REAS TERMINALES EN: COMERCIO INTERNACIONAL Y ADUANAS, MERCADOTEC;104;66;170;32;24;56;28;18;46;20;7;27
MICHOAC쳁;LICENCIATURA EN ADMINISTRACI흁 CON TERMINAL EN MERCADOTECN페;0;1;1;0;0;0;0;0;0;0;0;0
MICHOAC쳁;LICENCIATURA EN ADMINISTRACI흁 CON TERMINAL EN RECURSOS HUMANOS   ;0;1;1;0;0;0;0;0;0;0;0;0
MICHOAC쳁;LICENCIATURA EN ADMINISTRACI흁 CON TERMINAL EN TURISMO    ;1;0;1;0;0;0;0;0;0;0;0;0
MICHOAC쳁;LICENCIATURA EN ADMINISTRACI흁 DE EMPRESAS;955;925;1880;307;298;605;273;220;493;174;158;332
MICHOAC쳁;LICENCIATURA EN ADMINISTRACI흁 DE EMPRESAS AGROPECUARIAS;0;1;1;0;0;0;1;0;1;1;1;2
MICHOAC쳁;LICENCIATURA EN ADMINISTRACI흁 DE EMPRESAS TUR펩TICAS;128;50;178;36;10;46;60;21;81;45;12;57
MICHOAC쳁;LICENCIATURA EN ADMINISTRACI흁 DE LA GASTRONOM페;8;6;14;6;6;12;0;0;0;0;0;0
MICHOAC쳁;LICENCIATURA EN ADMINISTRACI흁 DE RECURSOS HUMANOS;47;13;60;9;2;11;4;1;5;0;0;0
MICHOAC쳁;LICENCIATURA EN ADMINISTRACI흁 E INNOVACI흁 DE NEGOCIOS;112;80;192;32;26;58;0;0;0;0;0;0
MICHOAC쳁;LICENCIATURA EN ADMINISTRACI흁 E INNOVACI흁 EMPRESARIAL;13;13;26;5;8;13;0;0;0;0;0;0
MICHOAC쳁;LICENCIATURA EN ADMINISTRACI흁 EDUCATIVA;1;0;1;0;0;0;0;0;0;0;0;0
MICHOAC쳁;LICENCIATURA EN ADMINISTRACI흁 EMPRESARIAL;1;0;1;0;0;0;0;0;0;0;0;0
MICHOAC쳁;LICENCIATURA EN ADMINISTRACI흁 EN MERCADOTECNIA;41;47;88;0;0;0;21;15;36;0;0;0
MICHOAC쳁;LICENCIATURA EN ADMINISTRACI흁 FINANCIERA;1;1;2;0;0;0;0;2;2;0;2;2
MICHOAC쳁;LICENCIATURA EN ADMINISTRACI흁 GESTI흁 Y PLANEACI흁 ESTRAT텒ICA;1;0;1;1;0;1;0;0;0;0;0;0
MICHOAC쳁;LICENCIATURA EN ADMINISTRACI흁 P２LICA Y CIENCIAS POL펪ICAS;1;1;2;1;1;2;0;0;0;0;0;0
MICHOAC쳁;LICENCIATURA EN ADMINISTRACI흁 TUR펩TICA;46;11;57;28;8;36;0;0;0;0;0;0
MICHOAC쳁;LICENCIATURA EN ADMINISTRACI흁 Y COMERCIO INTERNACIONAL;18;23;41;9;18;27;5;2;7;2;2;4
MICHOAC쳁;LICENCIATURA EN ADMINISTRACI흁 Y DIRECCI흁 EMPRESARIAL;57;45;102;16;14;30;13;9;22;14;11;25
MICHOAC쳁;LICENCIATURA EN ADMINISTRACI흁 Y ESTRATEGIA DE NEGOCIOS;12;27;39;0;1;1;0;0;0;0;0;0
MICHOAC쳁;LICENCIATURA EN ADMINISTRACI흁 Y GESTI흁 DE PYMES;40;43;83;11;18;29;19;10;29;19;10;29
MICHOAC쳁;LICENCIATURA EN ADMINISTRACI흁: FINANZAS;27;51;78;7;18;25;5;7;12;9;3;12
MICHOAC쳁;LICENCIATURA EN ADM흁 CON TERMINAL EN MERCADOTECNIA, COMERCIO INT Y ADUANAS, GESTI흁 P２LICA, REC HUM Y TURISMO;26;18;44;26;18;44;21;10;31;11;2;13
MICHOAC쳁;LICENCIATURA EN ADUANAS Y ADMINISTRACI흁 NAVIERA;8;2;10;8;2;10;5;0;5;4;0;4
MICHOAC쳁;LICENCIATURA EN AGRONEGOCIOS;2;3;5;2;3;5;0;0;0;0;0;0
MICHOAC쳁;LICENCIATURA EN ANIMACI흁 Y ARTE DIGITAL;0;0;0;0;0;0;0;1;1;0;1;1
MICHOAC쳁;LICENCIATURA EN ANIMACI흁, ARTE DIGITAL Y MULTIMEDIA;18;40;58;8;9;17;0;4;4;2;2;4
MICHOAC쳁;LICENCIATURA EN ARQUITECTURA;193;346;539;82;176;258;19;45;64;26;21;47
MICHOAC쳁;LICENCIATURA EN ARQUITECTURA CON TERMINALES EN: DISE헲 DE INTERIORES, OBRA CIVIL Y CONTRUCCI흁, URBA;45;104;149;19;45;64;8;27;35;2;14;16
MICHOAC쳁;LICENCIATURA EN ARQUITECTURA CON TERMINALES EN: OBRA CIVIL Y CONSTRUCCI흁, URBANISMO Y ARQUITECTURA  SUSTENTABLE;30;59;89;6;27;33;7;15;22;4;6;10
MICHOAC쳁;LICENCIATURA EN ARQUITECTURA DIGITAL;3;8;11;0;0;0;1;5;6;2;2;4
MICHOAC쳁;LICENCIATURA EN ARQUITECTURA Y DISE헲;28;36;64;14;18;32;9;8;17;0;0;0
MICHOAC쳁;LICENCIATURA EN ARTE Y PATRIMONIO CULTURAL;48;40;88;26;18;44;4;5;9;2;0;2
MICHOAC쳁;LICENCIATURA EN ARTES CULINARIAS, CHEF;66;60;126;18;21;39;21;28;49;21;28;49
MICHOAC쳁;LICENCIATURA EN ARTES VISUALES;166;119;285;42;39;81;21;20;41;11;3;14
MICHOAC쳁;LICENCIATURA EN BIOLOG페;482;412;894;131;104;235;91;59;150;61;34;95
MICHOAC쳁;LICENCIATURA EN BIOTECNOLOG페;235;211;446;68;66;134;0;0;0;0;0;0
MICHOAC쳁;LICENCIATURA EN CIENCIA POL펪ICA Y ADMINISTRACI흁 P２LICA;11;19;30;11;19;30;0;0;0;0;0;0
MICHOAC쳁;LICENCIATURA EN CIENCIAS DE LA COMUNICACI흁;216;171;387;66;68;134;62;34;96;31;17;48
MICHOAC쳁;LICENCIATURA EN CIENCIAS DE LA COMUNICACI흁 CON TERMINALES EN: COMUNICACI흁 ORGANIZACIONAL, PERIODISMO DEPORTIVO Y/O MERCADOTECNIA E IMAGEN P２LICA;11;7;18;4;3;7;2;1;3;0;0;0
MICHOAC쳁;LICENCIATURA EN CIENCIAS DE LA EDUCACI흁;84;24;108;33;15;48;18;2;20;6;3;9
MICHOAC쳁;LICENCIATURA EN CIENCIAS DE LA EDUCACI흁 CON TERMINAL EN EDUCACI흁 INICIAL;18;0;18;0;0;0;16;1;17;4;1;5
MICHOAC쳁;LICENCIATURA EN CIENCIAS DE LA NUTRICI흁;159;45;204;36;10;46;50;12;62;0;0;0
MICHOAC쳁;LICENCIATURA EN CIENCIAS F펩ICO MATEM쳆ICAS;96;237;333;26;83;109;6;15;21;10;16;26
MICHOAC쳁;LICENCIATURA EN CIENCIAS POL펪ICAS Y ADMINISTRACI흁 P２LICA;8;13;21;1;6;7;4;4;8;1;2;3
MICHOAC쳁;LICENCIATURA EN CIENCIAS Y T텎NICAS DE LA COMUNICACI흁;158;145;303;54;44;98;41;53;94;41;31;72
MICHOAC쳁;LICENCIATURA EN CIRUJANO DENTISTA;71;41;112;26;14;40;0;0;0;0;0;0
MICHOAC쳁;LICENCIATURA EN COMERCIO EXTERIOR;223;102;325;65;38;103;8;15;23;8;7;15
MICHOAC쳁;LICENCIATURA EN COMERCIO INTERNACIONAL;264;214;478;65;50;115;80;52;132;34;15;49
MICHOAC쳁;LICENCIATURA EN COMERCIO INTERNACIONAL Y ADUANAS;74;51;125;38;31;69;10;5;15;1;0;1
MICHOAC쳁;LICENCIATURA EN COMERCIO Y ADMINISTRACION DE ADUANAS;52;58;110;52;58;110;18;28;46;0;0;0
MICHOAC쳁;LICENCIATURA EN COMERCIO Y LOG펩TICA INTERNACIONAL;18;10;28;13;4;17;0;0;0;0;0;0
MICHOAC쳁;LICENCIATURA EN COMERCIO Y NEGOCIOS INTERNACIONALES;160;120;280;57;45;102;20;16;36;11;8;19
MICHOAC쳁;LICENCIATURA EN COMUNICACI흁;124;98;222;57;44;101;22;12;34;1;0;1
MICHOAC쳁;LICENCIATURA EN COMUNICACI흁 EDUCATIVA;15;5;20;0;0;0;11;7;18;13;5;18
MICHOAC쳁;LICENCIATURA EN COMUNICACI흁 INTERCULTURAL;20;16;36;13;8;21;0;0;0;0;0;0
MICHOAC쳁;LICENCIATURA EN CONTABILIDAD;22;11;33;0;0;0;0;0;0;0;0;0
MICHOAC쳁;LICENCIATURA EN CONTABILIDAD FINANCIERA;182;105;287;37;34;71;0;0;0;0;0;0
MICHOAC쳁;LICENCIATURA EN CONTABILIDAD Y FINANZAS;52;33;85;24;14;38;13;12;25;11;7;18
MICHOAC쳁;LICENCIATURA EN CONTADUR페;1794;1067;2861;468;315;783;290;146;436;258;103;361
MICHOAC쳁;LICENCIATURA EN CONTADUR페 FISCAL Y FINANZAS;143;88;231;48;23;71;0;0;0;0;0;0
MICHOAC쳁;LICENCIATURA EN CONTADUR페 P２LICA;165;102;267;37;24;61;58;28;86;27;11;38
MICHOAC쳁;LICENCIATURA EN CONTADUR페 P２LICA Y FINANZAS;18;15;33;10;3;13;5;0;5;2;1;3
MICHOAC쳁;LICENCIATURA EN CONTADUR페 Y FINANZAS;36;28;64;11;13;24;19;10;29;5;2;7
MICHOAC쳁;LICENCIATURA EN COSMETOLOG페 Y EST텞ICA CORPORAL;43;0;43;22;0;22;0;0;0;0;0;0
MICHOAC쳁;LICENCIATURA EN CRIMINOLOG페;241;216;457;88;88;176;33;24;57;14;8;22
MICHOAC쳁;LICENCIATURA EN CRIMINOLOG페 Y CRIMINAL펩TICA;41;36;77;16;11;27;0;0;0;0;0;0
MICHOAC쳁;LICENCIATURA EN CULTURA F펩ICA Y DEPORTE;64;194;258;23;86;109;16;59;75;2;26;28
MICHOAC쳁;LICENCIATURA EN CULTURA F펩ICA Y DEPORTE CON TERMINALES EN: ENTRENAMIENTO DEPORTIVO, DIVERSIDAD FUNCIONAL Y EDUCACI흁 F펩ICA;34;98;132;29;83;112;0;0;0;0;0;0
MICHOAC쳁;LICENCIATURA EN CULTURA F펩ICA Y DEPORTES;138;386;524;53;175;228;26;79;105;17;32;49
MICHOAC쳁;LICENCIATURA EN CULTURA F펩ICA, RECREACI흁 Y DEPORTES;12;24;36;12;24;36;3;13;16;0;0;0
MICHOAC쳁;LICENCIATURA EN DANZA;68;14;82;18;2;20;8;0;8;0;0;0
MICHOAC쳁;LICENCIATURA EN DERECHO;5208;3827;9035;1442;1047;2489;873;663;1536;729;605;1334
MICHOAC쳁;LICENCIATURA EN DERECHO CON ENFOQUE DE PLURALISMO JUR펛ICO;180;149;329;171;149;320;0;0;0;0;0;0
MICHOAC쳁;LICENCIATURA EN DERECHO CON TERMINALES EN: DERECHO FISCAL, DERECHO CONSTITUCIONAL Y AMPARO, DERECHO LABORAL Y/O CRIMINOLOGIA;159;125;284;61;46;107;61;29;90;20;12;32
MICHOAC쳁;LICENCIATURA EN DERECHO Y CIENCIAS JUR펛ICAS;1;0;1;0;0;0;0;0;0;0;0;0
MICHOAC쳁;LICENCIATURA EN DESARROLLO COMUNITARIO;13;12;25;0;0;0;13;7;20;4;5;9
MICHOAC쳁;LICENCIATURA EN DESARROLLO EMPRESARIAL;115;60;175;28;15;43;23;13;36;1;2;3
MICHOAC쳁;LICENCIATURA EN DESARROLLO HUMANO;14;3;17;0;0;0;4;0;4;2;1;3
MICHOAC쳁;LICENCIATURA EN DESARROLLO INFANTIL;131;1;132;37;0;37;33;1;34;20;1;21
MICHOAC쳁;LICENCIATURA EN DESARROLLO REGIONAL SUSTENTABLE;4;4;8;0;0;0;0;2;2;1;0;1
MICHOAC쳁;LICENCIATURA EN DESARROLLO SUSTENTABLE;212;216;428;90;86;176;43;33;76;8;11;19
MICHOAC쳁;LICENCIATURA EN DIRECCI흁 PERIOD펩TICA Y PRODUCCI흁 AUDIOVISUAL;6;14;20;4;9;13;0;0;0;0;0;0
MICHOAC쳁;LICENCIATURA EN DISE헲 DE INTERIORES Y AMBIENTACI흁;32;4;36;11;2;13;9;0;9;0;0;0
MICHOAC쳁;LICENCIATURA EN DISE헲 DE INTERIORES Y ARQUITECTURA SUSTENTABLE;37;14;51;19;5;24;12;2;14;12;2;14
MICHOAC쳁;LICENCIATURA EN DISE헲 DE LA COMUNICACI흁 GR첹ICA;24;18;42;8;2;10;11;4;15;11;3;14
MICHOAC쳁;LICENCIATURA EN DISE헲 DE MODA;6;2;8;6;2;8;0;0;0;0;0;0
MICHOAC쳁;LICENCIATURA EN DISE헲 DE MODAS;0;0;0;0;0;0;0;0;0;1;1;2
MICHOAC쳁;LICENCIATURA EN DISE헲 DE MODAS ART펩TICO E INDUSTRIAL;17;3;20;5;1;6;0;0;0;0;0;0
MICHOAC쳁;LICENCIATURA EN DISE헲 DE MODAS Y MERCADOTECNIA PUBLICITARIA;51;9;60;25;3;28;15;1;16;15;1;16
MICHOAC쳁;LICENCIATURA EN DISE헲 DIGITAL DE MODA;10;1;11;0;0;0;7;3;10;3;0;3
MICHOAC쳁;LICENCIATURA EN DISE헲 E INDUSTRIA DEL VESTIDO;7;2;9;0;0;0;0;0;0;5;0;5
MICHOAC쳁;LICENCIATURA EN DISE헲 GR첹ICO;194;135;329;69;59;128;32;33;65;13;7;20
MICHOAC쳁;LICENCIATURA EN DISE헲 GR첹ICO DIGITAL;29;10;39;9;4;13;12;3;15;11;2;13
MICHOAC쳁;LICENCIATURA EN DISE헲 GRAFICO ESTRATEGICO;21;21;42;8;5;13;5;2;7;0;0;0
MICHOAC쳁;LICENCIATURA EN DISE헲 Y ASESOR페 DE IMAGEN;10;1;11;0;0;0;7;1;8;4;0;4
MICHOAC쳁;LICENCIATURA EN DISE헲 Y COMUNICACI흁 MULTIMEDIA;10;13;23;3;5;8;5;8;13;5;8;13
MICHOAC쳁;LICENCIATURA EN DISE헲 Y MODA INDUSTRIAL;87;15;102;0;0;0;26;3;29;0;0;0
MICHOAC쳁;LICENCIATURA EN ECONOM페;254;321;575;75;84;159;38;41;79;38;32;70
MICHOAC쳁;LICENCIATURA EN EDUCACI흁;16;4;20;3;1;4;10;2;12;4;0;4
MICHOAC쳁;LICENCIATURA EN EDUCACI흁 ART펩TICA;141;66;207;33;22;55;44;30;74;39;32;71
MICHOAC쳁;LICENCIATURA EN EDUCACI흁 F펩ICA Y DEPORTE;97;309;406;37;107;144;20;93;113;9;65;74
MICHOAC쳁;LICENCIATURA EN EDUCACI흁 F펩ICA Y DEPORTES;118;269;387;54;120;174;30;87;117;17;45;62
MICHOAC쳁;LICENCIATURA EN EDUCACI흁 MEDIA SUPERIOR;56;36;92;5;6;11;27;29;56;26;24;50
MICHOAC쳁;LICENCIATURA EN EDUCACI흁 PREESCOLAR;0;0;0;0;0;0;0;0;0;3;3;6
MICHOAC쳁;LICENCIATURA EN EDUCACI흁 PREESCOLAR EN EL MEDIO IND펞ENA;74;5;79;26;1;27;29;3;32;13;2;15
MICHOAC쳁;LICENCIATURA EN EDUCACI흁 PREESCOLAR IND펞ENA;92;30;122;36;8;44;32;14;46;1;2;3
MICHOAC쳁;LICENCIATURA EN EDUCACI흁 PREESCOLAR PARA EL MEDIO IND펞ENA;71;4;75;34;3;37;14;1;15;4;0;4
MICHOAC쳁;LICENCIATURA EN EDUCACI흁 PREESCOLAR Y PRIMARIA EN EL MEDIO IND펞ENA;4;3;7;0;0;0;0;0;0;1;0;1
MICHOAC쳁;LICENCIATURA EN EDUCACI흁 PRIMARIA;130;59;189;51;20;71;38;21;59;24;5;29
MICHOAC쳁;LICENCIATURA EN EDUCACI흁 PRIMARIA PARA EL MEDIO IND펞ENA;108;54;162;33;26;59;41;31;72;11;2;13
MICHOAC쳁;LICENCIATURA EN EDUCACI흁 Y DESARROLLO HUMANO;68;11;79;19;1;20;8;6;14;9;1;10
MICHOAC쳁;LICENCIATURA EN ENERG페S RENOVABLES;24;66;90;0;0;0;8;33;41;0;0;0
MICHOAC쳁;LICENCIATURA EN ENFERMER페;2245;566;2811;587;133;720;405;137;542;340;115;455
MICHOAC쳁;LICENCIATURA EN ENFERMER페 Y OBSTETRICIA;430;32;462;142;9;151;72;6;78;81;10;91
MICHOAC쳁;LICENCIATURA EN ENSE헤NZA DE INGL텝;28;15;43;0;0;0;0;0;0;0;0;0
MICHOAC쳁;LICENCIATURA EN ENSE헤NZA DE LAS LENGUAS EXTRANJERAS;36;18;54;15;9;24;5;2;7;1;1;2
MICHOAC쳁;LICENCIATURA EN ENSE헤NZA DEL IDIOMA INGL텝;84;48;132;16;13;29;10;8;18;9;6;15
MICHOAC쳁;LICENCIATURA EN ENSE헤NZA DEL INGL텝;33;17;50;2;3;5;10;5;15;7;5;12
MICHOAC쳁;LICENCIATURA EN ENTRENAMIENTO DEPORTIVO;11;33;44;1;9;10;2;6;8;0;1;1
MICHOAC쳁;LICENCIATURA EN ESTILISMO E IMAGEN;6;0;6;0;0;0;0;0;0;0;0;0
MICHOAC쳁;LICENCIATURA EN ESTUDIOS CINEMATOGR첹ICOS;5;21;26;1;13;14;2;9;11;0;0;0
MICHOAC쳁;LICENCIATURA EN ESTUDIOS MULTICULTURALES;49;50;99;22;18;40;8;3;11;0;1;1
MICHOAC쳁;LICENCIATURA EN EVALUACI흁 Y DESARROLLO AMBIENTAL;35;60;95;6;8;14;2;3;5;0;2;2
MICHOAC쳁;LICENCIATURA EN FILOSOF페;50;642;692;18;210;228;17;138;155;5;75;80
MICHOAC쳁;LICENCIATURA EN F펩ICOCONSTRUCTIVISMO Y FITNESS;22;32;54;10;8;18;2;4;6;0;0;0
MICHOAC쳁;LICENCIATURA EN FISIOTERAPIA;429;192;621;193;86;279;0;0;0;0;0;0
MICHOAC쳁;LICENCIATURA EN GASTRONOM페;555;454;1009;124;112;236;155;155;310;68;63;131
MICHOAC쳁;LICENCIATURA EN GEN흀ICA ALIMENTARIA;101;109;210;36;36;72;15;14;29;3;11;14
MICHOAC쳁;LICENCIATURA EN GESTI흁 COMUNITARIA Y GOBIERNOS LOCALES;6;0;6;0;0;0;3;1;4;1;5;6
MICHOAC쳁;LICENCIATURA EN GESTI흁 EMPRESARIAL;229;156;385;46;39;85;33;22;55;42;21;63
MICHOAC쳁;LICENCIATURA EN GESTI흁 URBANA Y RURAL;12;13;25;0;0;0;4;2;6;0;0;0
MICHOAC쳁;LICENCIATURA EN GOBERNABILIDAD Y NUEVA CIUDADAN페;12;6;18;0;0;0;5;8;13;2;2;4
MICHOAC쳁;LICENCIATURA EN HERBOLARIA Y FITOTERAPIA;376;185;561;68;39;107;0;0;0;0;0;0
MICHOAC쳁;LICENCIATURA EN HISTORIA;129;192;321;35;55;90;44;44;88;28;23;51
MICHOAC쳁;LICENCIATURA EN HISTORIA DEL ARTE;8;4;12;5;2;7;2;3;5;5;1;6
MICHOAC쳁;LICENCIATURA EN HOMEOPAT페;8;7;15;0;2;2;3;2;5;3;1;4
MICHOAC쳁;LICENCIATURA EN IDIOMAS;93;56;149;53;33;86;11;9;20;3;8;11
MICHOAC쳁;LICENCIATURA EN IDIOMAS CON TERMINALES EN INGLES, FRANC텝 Y ESPA헲L;15;8;23;11;7;18;0;0;0;0;0;0
MICHOAC쳁;LICENCIATURA EN INFORM쳆ICA;0;0;0;0;0;0;1;0;1;5;7;12
MICHOAC쳁;LICENCIATURA EN INFORM쳆ICA ADMINISTRATIVA;174;242;416;43;74;117;12;19;31;11;23;34
MICHOAC쳁;LICENCIATURA EN INGENIER페 AGROINDUSTRIAL;75;91;166;20;39;59;14;11;25;14;11;25
MICHOAC쳁;LICENCIATURA EN INGENIER페 AMBIENTAL;206;146;352;82;49;131;3;5;8;5;0;5
MICHOAC쳁;LICENCIATURA EN INGENIER페 BIOM텏ICA;132;181;313;42;70;112;15;18;33;2;5;7
MICHOAC쳁;LICENCIATURA EN INGENIER페 BIOQU펤ICA;0;0;0;0;0;0;1;0;1;0;0;0
MICHOAC쳁;LICENCIATURA EN INGENIER페 ECON흀ICA Y COMERCIAL;5;4;9;0;0;0;0;0;0;0;1;1
MICHOAC쳁;LICENCIATURA EN INGENIER페 EN AGRONEGOCIOS;58;86;144;27;39;66;11;11;22;0;0;0
