ENTIDAD FEDERATIVA;NOMBRE PROGRAMA EDUCATIVO;Matr鞍ula Mujeres;Matr鞍ula Hombres;Matr鞍ula Total;Nuevo Ingreso Mujeres;Nuevo Ingreso Hombres;Nuevo Ingreso Total;Egresados Mujeres;Egresados Hombres;Egresados Total;Titulados Mujeres;Titulados Hombres;Titulados Total
QUINTANA ROO;LICENCIATURA EN CONTABILIDAD FINANCIERA;164;124;288;77;63;140;0;0;0;0;0;0
QUINTANA ROO;LICENCIATURA EN CONTABILIDAD Y FINANZAS;72;102;174;26;44;70;9;11;20;2;4;6
QUINTANA ROO;LICENCIATURA EN CONTADUR페;160;153;313;61;48;109;25;36;61;9;14;23
QUINTANA ROO;LICENCIATURA EN CONTADUR페 P２LICA;273;304;577;113;128;241;51;53;104;25;27;52
QUINTANA ROO;LICENCIATURA EN CONTADUR페 Y FINANZAS;189;149;338;64;57;121;12;3;15;5;1;6
QUINTANA ROO;LICENCIATURA EN COSMIATR페 INTEGRAL;67;3;70;56;3;59;0;0;0;0;0;0
QUINTANA ROO;LICENCIATURA EN CRIMINOLOG페;102;75;177;53;38;91;36;24;60;0;0;0
QUINTANA ROO;LICENCIATURA EN CRIMINOLOG페 Y CRIMINAL펩TICA;113;72;185;42;28;70;12;13;25;4;1;5
QUINTANA ROO;LICENCIATURA EN CULTURA F펩ICA Y ENTRENAMIENTO DEPORTIVO;5;10;15;2;3;5;0;0;0;0;0;0
QUINTANA ROO;LICENCIATURA EN DERECHO;2105;1724;3829;706;549;1255;378;358;736;173;147;320
QUINTANA ROO;LICENCIATURA EN DERECHO Y CIENCIAS JUR펛ICAS;38;49;87;8;13;21;3;2;5;3;2;5
QUINTANA ROO;LICENCIATURA EN DERECHO Y LITIGACION ESTRATEGICA;12;8;20;9;5;14;0;0;0;0;0;0
QUINTANA ROO;LICENCIATURA EN DIRECCI흁 DE EMPRESAS DE ENTRETENIMIENTO;49;32;81;14;9;23;0;0;0;0;0;0
QUINTANA ROO;LICENCIATURA EN DISE헲 DE MODA;13;1;14;4;1;5;0;0;0;0;0;0
QUINTANA ROO;LICENCIATURA EN DISE헲 DE MODAS;36;5;41;10;2;12;5;1;6;7;0;7
QUINTANA ROO;LICENCIATURA EN DISE헲 GR첹ICO;193;158;351;66;63;129;62;29;91;44;16;60
QUINTANA ROO;LICENCIATURA EN DISE헲 GR첹ICO DIGITAL;170;165;335;83;80;163;38;37;75;17;16;33
QUINTANA ROO;LICENCIATURA EN DISE헲 GR첹ICO Y DIGITAL;48;35;83;20;26;46;0;0;0;0;0;0
QUINTANA ROO;LICENCIATURA EN DISE헲 INDUSTRIAL;19;9;28;10;6;16;0;0;0;0;0;0
QUINTANA ROO;LICENCIATURA EN DISE헲 INTERACTIVO;13;27;40;3;7;10;8;1;9;0;0;0
QUINTANA ROO;LICENCIATURA EN DISE헲 MULTIMEDIA;6;5;11;6;5;11;0;0;0;0;0;0
QUINTANA ROO;LICENCIATURA EN DISE헲, ARTE Y ANIMACI흁 DIGITAL;24;20;44;11;11;22;7;6;13;6;2;8
QUINTANA ROO;LICENCIATURA EN ECONOM페 Y FINANZAS;54;65;119;18;22;40;10;9;19;4;14;18
QUINTANA ROO;LICENCIATURA EN EDUCACI흁;160;46;206;70;25;95;18;4;22;6;1;7
QUINTANA ROO;LICENCIATURA EN EDUCACI흁 F펩ICA RECREACI흁 Y DEPORTES;2;4;6;0;0;0;0;2;2;0;0;0
QUINTANA ROO;LICENCIATURA EN EDUCACI흁 F펩ICA Y DEPORTES;60;160;220;32;70;102;15;46;61;9;23;32
QUINTANA ROO;LICENCIATURA EN EDUCACI흁 F펩ICA, RECREACI흁 Y DEPORTE;14;24;38;7;17;24;0;0;0;0;0;0
QUINTANA ROO;LICENCIATURA EN EDUCACION INICIAL Y PREESCOLAR;11;0;11;11;0;11;0;0;0;0;0;0
QUINTANA ROO;LICENCIATURA EN EDUCACI흁 PREESCOLAR;5;1;6;5;1;6;0;0;0;0;0;0
QUINTANA ROO;LICENCIATURA EN EDUCACI흁 PREESCOLAR INTERCULTURAL BILING㏊;8;0;8;0;0;0;0;0;0;0;0;0
QUINTANA ROO;LICENCIATURA EN EDUCACI흁 Y TECNOLOG페S PARA EL APRENDIZAJE;7;2;9;0;0;0;0;0;0;0;0;0
QUINTANA ROO;LICENCIATURA EN ENFERMER페;511;215;726;203;89;292;90;28;118;74;26;100
QUINTANA ROO;LICENCIATURA EN ENFERMER페 Y OBSTETRICIA;125;69;194;59;29;88;0;0;0;0;0;0
QUINTANA ROO;LICENCIATURA EN FARMACIA;53;47;100;11;8;19;2;4;6;9;7;16
QUINTANA ROO;LICENCIATURA EN FINANZAS Y CONTADUR페 P２LICA;27;23;50;15;14;29;9;11;20;0;0;0
QUINTANA ROO;LICENCIATURA EN FISIOTERAPIA;21;12;33;14;9;23;0;0;0;0;0;0
QUINTANA ROO;LICENCIATURA EN FISIOTERAPIA Y REHABILITACI흁;44;26;70;14;12;26;0;0;0;0;0;0
QUINTANA ROO;LICENCIATURA EN GASTRONOM페;572;659;1231;132;196;328;203;206;409;156;138;294
QUINTANA ROO;LICENCIATURA EN GESTI흁 DE EMPRESAS  ;18;24;42;10;17;27;12;4;16;11;2;13
QUINTANA ROO;LICENCIATURA EN GESTI흁 DE SERVICIOS TUR펩TICOS;162;79;241;48;29;77;6;1;7;2;0;2
QUINTANA ROO;LICENCIATURA EN GESTI흁 DEL CAPITAL HUMANO;54;35;89;0;0;0;0;0;0;0;0;0
QUINTANA ROO;LICENCIATURA EN GESTI흁 DEL TURISMO ALTERNATIVO;58;41;99;25;17;42;0;0;0;0;0;0
QUINTANA ROO;LICENCIATURA EN GESTI흁 EMPRESARIAL;34;37;71;16;11;27;9;9;18;0;0;0
QUINTANA ROO;LICENCIATURA EN GESTI흁 MUNICIPAL;42;28;70;11;12;23;1;1;2;1;0;1
QUINTANA ROO;LICENCIATURA EN GESTI흁 Y DESARROLLO DE LAS ARTES;33;34;67;11;14;25;2;0;2;0;1;1
QUINTANA ROO;LICENCIATURA EN GESTI흁 Y DESARROLLO TUR펩TICO;161;115;276;0;0;0;121;69;190;102;57;159
QUINTANA ROO;LICENCIATURA EN GOBIERNO Y GESTI흁 P２LICA;102;115;217;23;29;52;17;17;34;13;16;29
QUINTANA ROO;LICENCIATURA EN HOTELER페;61;34;95;12;6;18;10;10;20;16;5;21
QUINTANA ROO;LICENCIATURA EN HUMANIDADES;61;35;96;21;12;33;4;3;7;3;1;4
QUINTANA ROO;LICENCIATURA EN IDIOMA INGL텝;65;44;109;19;15;34;3;0;3;0;0;0
QUINTANA ROO;LICENCIATURA EN IDIOMAS Y RELACIONES P２LICAS;131;49;180;48;19;67;32;5;37;19;3;22
QUINTANA ROO;LICENCIATURA EN INFORM쳆ICA;0;0;0;0;0;0;0;0;0;1;8;9
QUINTANA ROO;LICENCIATURA EN INFORM쳆ICA ADMINISTRATIVA;2;8;10;0;0;0;1;1;2;0;0;0
QUINTANA ROO;LICENCIATURA EN INGENIER페 AMBIENTAL;121;106;227;25;25;50;6;2;8;0;0;0
QUINTANA ROO;LICENCIATURA EN INGENIER페 CIVIL;9;41;50;4;14;18;2;4;6;2;7;9
QUINTANA ROO;LICENCIATURA EN INGENIER페 EMPRESARIAL;134;122;256;40;39;79;3;7;10;6;6;12
QUINTANA ROO;LICENCIATURA EN INGENIER페 EN ADMINISTRACI흁;115;104;219;32;28;60;11;7;18;12;10;22
QUINTANA ROO;LICENCIATURA EN INGENIER페 EN DESARROLLO DE SOFTWARE;5;14;19;3;10;13;0;0;0;0;0;0
QUINTANA ROO;LICENCIATURA EN INGENIER페 EN INFORM쳆ICA Y NEGOCIOS DIGITALES;4;15;19;4;15;19;0;0;0;0;0;0
QUINTANA ROO;LICENCIATURA EN INGENIER페 EN MEC쳁ICA AUTOMOTRIZ;5;228;233;3;109;112;0;24;24;0;0;0
QUINTANA ROO;LICENCIATURA EN INGENIER페 EN SISTEMAS COMPUTACIONALES;6;63;69;5;39;44;0;0;0;0;0;0
QUINTANA ROO;LICENCIATURA EN INGENIER페 EN SISTEMAS DE INFORMACI흁;26;129;155;11;58;69;1;9;10;1;4;5
QUINTANA ROO;LICENCIATURA EN INGENIER페 EN TECNOLOG페S DE LA INFORMACI흁 Y COMUNICACI흁;20;45;65;8;22;30;1;6;7;1;6;7
QUINTANA ROO;LICENCIATURA EN INGENIER페 EN TELEM쳆ICA;1;27;28;0;0;0;0;19;19;0;0;0
QUINTANA ROO;LICENCIATURA EN INGENIER페 INDUSTRIAL;101;469;570;26;93;119;11;54;65;4;11;15
QUINTANA ROO;LICENCIATURA EN INGENIER페 INDUSTRIAL PARA LA DIRECCI흁;18;42;60;4;15;19;1;4;5;2;4;6
QUINTANA ROO;LICENCIATURA EN INGENIERIA INDUSTRIAL Y DE PROCESOS PRODUCTIVOS;12;27;39;0;0;0;0;0;0;0;0;0
QUINTANA ROO;LICENCIATURA EN INNOVACI흁 DE NEGOCIOS Y MERCADOT텎NIA   ;52;59;111;0;0;0;0;0;0;0;0;0
QUINTANA ROO;LICENCIATURA EN INNOVACI흁 EMPRESARIAL;251;249;500;78;63;141;53;33;86;0;0;0
QUINTANA ROO;LICENCIATURA EN INTERVENCI흁 EDUCATIVA;141;39;180;24;8;32;55;8;63;0;0;0
QUINTANA ROO;LICENCIATURA EN LENGUA INGLESA;314;179;493;93;51;144;25;16;41;17;9;26
QUINTANA ROO;LICENCIATURA EN LENGUA Y CULTURA;77;56;133;24;19;43;6;1;7;1;0;1
QUINTANA ROO;LICENCIATURA EN LENGUAS EXTRANJERAS;208;120;328;93;48;141;29;16;45;3;1;4
QUINTANA ROO;LICENCIATURA EN MANEJO DE RECURSOS NATURALES;82;68;150;17;16;33;14;7;21;16;10;26
QUINTANA ROO;LICENCIATURA EN MEDICINA;375;337;712;31;29;60;36;38;74;58;51;109
QUINTANA ROO;LICENCIATURA EN M텏ICO CIRUJANO;220;136;356;73;32;105;18;17;35;18;16;34
QUINTANA ROO;LICENCIATURA EN M텏ICO CIRUJANO DENTISTA;41;23;64;22;9;31;0;0;0;0;0;0
QUINTANA ROO;LICENCIATURA EN MERCADOTECNIA;384;378;762;133;146;279;65;50;115;30;21;51
QUINTANA ROO;LICENCIATURA EN MERCADOTECNIA ESTRAT텒ICA;40;26;66;12;12;24;2;3;5;2;3;5
QUINTANA ROO;LICENCIATURA EN MERCADOTECNIA Y DISE헲 PUBLICITARIO;29;22;51;17;15;32;4;1;5;0;0;0
QUINTANA ROO;LICENCIATURA EN MERCADOTECNIA Y NEGOCIOS;225;166;391;74;65;139;6;1;7;0;0;0
QUINTANA ROO;LICENCIATURA EN MERCADOTECNIA Y PUBLICIDAD;32;39;71;8;18;26;2;0;2;0;0;0
QUINTANA ROO;LICENCIATURA EN MUSICA POPULAR CONTEMPORANEA;6;12;18;2;8;10;0;0;0;0;0;0
QUINTANA ROO;LICENCIATURA EN MＣICA Y EDUCACI흁 MUSICAL;7;22;29;3;10;13;3;5;8;0;0;0
QUINTANA ROO;LICENCIATURA EN NEGOCIOS INTERNACIONALES;571;448;1019;174;132;306;72;45;117;10;10;20
QUINTANA ROO;LICENCIATURA EN NUTRICI흁;381;156;537;134;66;200;58;17;75;30;11;41
QUINTANA ROO;LICENCIATURA EN NUTRICI흁 Y DIET텞ICA;17;7;24;17;7;24;0;0;0;0;0;0
QUINTANA ROO;LICENCIATURA EN NUTRICI흁 Y GASTRONOM페;69;21;90;23;9;32;15;3;18;12;0;12
QUINTANA ROO;LICENCIATURA EN ODONTOLOG페;56;37;93;30;17;47;2;2;4;0;0;0
QUINTANA ROO;LICENCIATURA EN PEDAGOG페;535;114;649;205;45;250;74;12;86;48;4;52
QUINTANA ROO;LICENCIATURA EN PSICOLOG페;806;262;1068;284;101;385;152;43;195;40;10;50
QUINTANA ROO;LICENCIATURA EN PSICOLOG페 CL펥ICA;144;35;179;54;16;70;36;11;47;4;2;6
QUINTANA ROO;LICENCIATURA EN PSICOLOGIA CLINICA ORGANIZACIONAL;4;1;5;0;0;0;0;0;0;0;0;0
QUINTANA ROO;LICENCIATURA EN PSICOLOG페 CRIMINOL휺ICA;35;12;47;19;5;24;0;0;0;0;0;0
QUINTANA ROO;LICENCIATURA EN PSICOLOG페 EDUCATIVA;231;65;296;84;17;101;0;0;0;0;0;0
QUINTANA ROO;LICENCIATURA EN PSICOLOG페 EDUCATIVA INFANTIL ;42;2;44;16;0;16;5;1;6;0;0;0
QUINTANA ROO;LICENCIATURA EN PSICOLOG페 ORGANIZACIONAL;281;101;382;109;44;153;86;28;114;45;14;59
QUINTANA ROO;LICENCIATURA EN PSICOPEDAGOG페;213;35;248;97;21;118;45;3;48;16;2;18
QUINTANA ROO;LICENCIATURA EN RECREACI흁;14;30;44;4;10;14;3;2;5;0;0;0
QUINTANA ROO;LICENCIATURA EN RELACIONES COMERCIALES;2;6;8;2;6;8;0;0;0;0;0;0
QUINTANA ROO;LICENCIATURA EN RELACIONES INTERNACIONALES;208;104;312;63;31;94;15;8;23;16;8;24
QUINTANA ROO;LICENCIATURA EN RELACIONES PUBLICAS TURISTICAS E IDIOMAS;75;52;127;75;52;127;6;3;9;0;0;0
QUINTANA ROO;LICENCIATURA EN SALUD COMUNITARIA;50;21;71;16;9;25;6;0;6;0;0;0
QUINTANA ROO;LICENCIATURA EN SEGURIDAD P２LICA;58;106;164;17;26;43;8;14;22;5;11;16
QUINTANA ROO;LICENCIATURA EN SISTEMAS COMERCIALES;137;115;252;32;26;58;30;32;62;35;19;54
QUINTANA ROO;LICENCIATURA EN TECNOLOG페 EDUCATIVA;0;1;1;0;0;0;16;1;17;0;0;0
QUINTANA ROO;LICENCIATURA EN TECNOLOG페S DE LA INFORMACI흁;5;1;6;0;0;0;0;1;1;0;0;0
QUINTANA ROO;LICENCIATURA EN TERAPIA F펩ICA;435;208;643;127;82;209;70;30;100;56;21;77
QUINTANA ROO;LICENCIATURA EN TRABAJO SOCIAL;195;43;238;54;12;66;48;6;54;0;0;0
QUINTANA ROO;LICENCIATURA EN TURISMO;40;35;75;22;18;40;10;3;13;2;1;3
QUINTANA ROO;LICENCIATURA EN TURISMO ALTERNATIVO;75;70;145;24;17;41;7;5;12;0;0;0
QUINTANA ROO;LICENCIATURA EN TURISMO ALTERNATIVO Y GESTI흁 DEL PATRIMONIO ;43;23;66;43;23;66;0;0;0;0;0;0
QUINTANA ROO;LICENCIATURA EN TURISMO INTERNACIONAL;55;33;88;16;4;20;9;5;14;9;5;14
QUINTANA ROO;LICENCIATURA EN TURISMO SUSTENTABLE Y GESTI흁 HOTELERA;393;213;606;92;51;143;38;26;64;0;0;0
QUINTANA ROO;LICENCIATURA EN URGENCIAS MEDICAS PREHOSPITALARIAS;68;40;108;25;15;40;0;0;0;0;0;0
SAN LUIS POTOS;TOTAL;46724;44703;91427;13590;12331;25921;7592;6369;13961;6031;4821;10852
SAN LUIS POTOS;LICENCIATURA EN EDUCACION ARTISTICA;0;0;0;0;0;0;17;6;23;15;6;21
SAN LUIS POTOS;LICENCIATURA EN EDUCACI흁 ESPECIAL EN EL REA DE ATENCI흁 AUDITIVA Y DE LENGUAJE;130;14;144;16;0;16;57;10;67;52;10;62
SAN LUIS POTOS;LICENCIATURA EN EDUCACI흁 F펩ICA;69;195;264;16;61;77;18;66;84;17;63;80
SAN LUIS POTOS;LICENCIATURA EN EDUCACI흁 PREESCOLAR;891;39;930;314;19;333;173;2;175;164;2;166
SAN LUIS POTOS;LICENCIATURA EN EDUCACI흁 PREESCOLAR IND펞ENA CON ENFOQUE INTERCULTURAL BILING㏊;92;10;102;63;7;70;0;0;0;0;0;0
SAN LUIS POTOS;LICENCIATURA EN EDUCACI흁 PREESCOLAR INTERCULTURAL BILING㏊;82;15;97;0;0;0;25;8;33;24;8;32
SAN LUIS POTOS;LICENCIATURA EN EDUCACI흁 PRIMARIA;1120;419;1539;455;161;616;220;102;322;220;98;318
SAN LUIS POTOS;LICENCIATURA EN EDUCACI흁 PRIMARIA IND펞ENA CON ENFOQUE INTERCULTURAL BILING㏊;151;76;227;89;49;138;0;0;0;0;0;0
SAN LUIS POTOS;LICENCIATURA EN EDUCACI흁 PRIMARIA INTERCULTURAL BILING㏊;55;24;79;0;0;0;50;8;58;50;8;58
SAN LUIS POTOS;LICENCIATURA EN EDUCACI흁 SECUNDARIA CON ESPECIALIDAD EN BIOLOG페;10;11;21;0;0;0;0;0;0;0;0;0
SAN LUIS POTOS;LICENCIATURA EN EDUCACI흁 SECUNDARIA CON ESPECIALIDAD EN ESPA헲L;67;27;94;0;0;0;30;13;43;30;12;42
SAN LUIS POTOS;LICENCIATURA EN EDUCACI흁 SECUNDARIA CON ESPECIALIDAD EN FORMACI흁 C펬ICA Y 텞ICA;24;22;46;0;0;0;0;0;0;0;0;0
SAN LUIS POTOS;LICENCIATURA EN EDUCACI흁 SECUNDARIA CON ESPECIALIDAD EN GEOGRAF페;18;13;31;0;0;0;0;0;0;0;0;0
SAN LUIS POTOS;LICENCIATURA EN EDUCACI흁 SECUNDARIA CON ESPECIALIDAD EN LENGUA EXTRANJERA (INGL텝);28;13;41;8;3;11;79;66;145;78;66;144
SAN LUIS POTOS;LICENCIATURA EN EDUCACI흁 SECUNDARIA CON ESPECIALIDAD EN MATEM쳆ICAS;34;35;69;0;0;0;10;5;15;10;4;14
SAN LUIS POTOS;LICENCIATURA EN EDUCACI흁 SECUNDARIA CON ESPECIALIDAD EN QU펤ICA;30;10;40;0;0;0;30;10;40;30;10;40
SAN LUIS POTOS;LICENCIATURA EN EDUCACI흁 SECUNDARIA CON ESPECIALIDAD EN TELESECUNDARIA;700;488;1188;175;116;291;77;35;112;77;35;112
SAN LUIS POTOS;LICENCIATURA EN ENSE헤NZA Y APRENDIZAJE DE LAS MATEM쳆ICAS EN EDUCACI흁 SECUNDARIA;28;18;46;20;13;33;0;0;0;0;0;0
SAN LUIS POTOS;LICENCIATURA EN ENSE헤NZA Y APRENDIZAJE DEL ESPA헲L EN EDUCACI흁 SECUNDARIA;44;19;63;26;10;36;0;0;0;0;0;0
SAN LUIS POTOS;LICENCIATURA EN ENSE헤NZA Y APRENDIZAJE DEL INGL텝 EN EDUCACI흁 SECUNDARIA;20;12;32;10;8;18;0;0;0;0;0;0
SAN LUIS POTOS;LICENCIATURA EN ENSE헤NZA Y APRENDIZAJE EN TELESECUNDARIA;175;116;291;175;116;291;0;0;0;0;0;0
SAN LUIS POTOS;LICENCIATURA EN INCLUSI흁 EDUCATIVA;54;3;57;32;2;34;0;0;0;0;0;0
SAN LUIS POTOS;ARQUITECTO;408;476;884;93;81;174;43;52;95;37;37;74
SAN LUIS POTOS;ARQUITECTURA;38;82;120;14;29;43;5;7;12;2;4;6
SAN LUIS POTOS;BIOQU펤ICO;160;116;276;42;33;75;38;24;62;43;33;76
SAN LUIS POTOS;CONTADOR P２LICO;861;615;1476;164;166;330;187;92;279;165;81;246
SAN LUIS POTOS;CONTADOR P２LICO Y AUDITOR;50;48;98;15;17;32;5;2;7;0;0;0
SAN LUIS POTOS;DISE헤DOR INDUSTRIAL;8;1;9;0;0;0;0;1;1;0;1;1
SAN LUIS POTOS;DISE헲 DE ESPACIOS Y AMBIENTES CON EL GRADO DE LICENCIATURA;22;3;25;9;1;10;2;1;3;0;0;0
SAN LUIS POTOS;INGENIER페 AGROINDUSTRIAL;189;262;451;50;64;114;41;19;60;15;11;26
SAN LUIS POTOS;INGENIER페 AGRON흀ICA EN FITOTECNIA;51;105;156;17;20;37;4;8;12;3;13;16
SAN LUIS POTOS;INGENIER페 AGR흁OMO ZOOTECNISTA;86;159;245;24;34;58;5;9;14;6;11;17
SAN LUIS POTOS;INGENIER페 AMBIENTAL;328;223;551;93;58;151;41;31;72;33;32;65
SAN LUIS POTOS;INGENIER페 AMBIENTAL Y ECOLOG페;4;11;15;1;5;6;0;0;0;0;0;0
SAN LUIS POTOS;INGENIER페 CIVIL;353;1086;1439;86;263;349;43;142;185;27;118;145
SAN LUIS POTOS;INGENIER페 EL텎TRICA;13;114;127;5;31;36;2;16;18;0;12;12
SAN LUIS POTOS;INGENIER페 ELECTR흁ICA;14;81;95;3;21;24;1;13;14;3;21;24
SAN LUIS POTOS;INGENIER페 ELECTR흁ICO;69;206;275;12;53;65;2;13;15;1;28;29
SAN LUIS POTOS;INGENIER페 EN ADMINISTRACI흁;322;120;442;91;36;127;32;21;53;30;7;37
SAN LUIS POTOS;INGENIER페 EN AGROECOLOG페;76;47;123;24;14;38;8;5;13;11;10;21
SAN LUIS POTOS;INGENIER페 EN AGRONEGOCIOS;62;77;139;23;23;46;16;11;27;1;3;4
SAN LUIS POTOS;INGENIER페 EN AGRONOM페;0;0;0;0;0;0;0;0;0;0;1;1
SAN LUIS POTOS;INGENIER페 EN ALIMENTOS;217;125;342;46;40;86;21;6;27;17;4;21
SAN LUIS POTOS;INGENIER페 EN BIOPROCESOS;125;66;191;33;19;52;11;4;15;10;4;14
SAN LUIS POTOS;INGENIER페 EN COMPUTACI흁;53;248;301;9;48;57;4;18;22;4;20;24
SAN LUIS POTOS;INGENIER페 EN DESARROLLO E INNOVACI흁 EMPRESARIAL;58;22;80;0;0;0;28;16;44;28;16;44
SAN LUIS POTOS;INGENIER페 EN DISE헲 INDUSTRIAL;16;18;34;9;8;17;3;1;4;1;4;5
SAN LUIS POTOS;INGENIER페 EN ELECTRICIDAD Y AUTOMATIZACI흁;25;168;193;7;47;54;2;18;20;1;22;23
SAN LUIS POTOS;INGENIER페 EN ENERG페S RENOVABLES;50;72;122;15;24;39;0;0;0;0;0;0
SAN LUIS POTOS;INGENIER페 EN GEOINFORM쳆ICA;14;40;54;4;10;14;0;0;0;0;0;0
SAN LUIS POTOS;INGENIER페 EN GEOLOG페;72;111;183;12;29;41;7;24;31;13;25;38
SAN LUIS POTOS;INGENIER페 EN GEOM쳆ICA;9;14;23;0;0;0;10;7;17;5;5;10
SAN LUIS POTOS;INGENIER페 EN GESTI흁 EMPRESARIAL;1203;746;1949;305;218;523;167;83;250;73;36;109
SAN LUIS POTOS;INGENIER페 EN INDUSTRIAS ALIMENTARIAS;162;122;284;33;29;62;23;19;42;16;14;30
SAN LUIS POTOS;INGENIER페 EN INFORM쳆ICA;48;124;172;5;10;15;6;19;25;4;11;15
SAN LUIS POTOS;INGENIER페 EN INNOVACI흁 AGR펚OLA SUSTENTABLE;101;153;254;28;50;78;12;19;31;1;8;9
SAN LUIS POTOS;INGENIER페 EN LOG펩TICA INTERNACIONAL;70;43;113;0;0;0;36;8;44;36;8;44
SAN LUIS POTOS;INGENIER페 EN MANTENIMIENTO INDUSTRIAL;9;66;75;0;0;0;0;21;21;0;21;21
SAN LUIS POTOS;INGENIER페 EN MEC쳁ICA ADMINISTRATIVA;36;129;165;12;28;40;3;18;21;5;8;13
SAN LUIS POTOS;INGENIER페 EN MECATR흁ICA;96;669;765;24;128;152;15;96;111;13;80;93
SAN LUIS POTOS;INGENIER페 EN METAL MEC쳁ICA;8;51;59;0;0;0;2;16;18;2;16;18
SAN LUIS POTOS;INGENIER페 EN MINERALES;63;106;169;14;26;40;0;0;0;0;0;0
SAN LUIS POTOS;INGENIER페 EN NANOTECNOLOG페 Y ENERG페S RENOVABLES;59;137;196;22;38;60;8;8;16;8;7;15
SAN LUIS POTOS;INGENIER페 EN NEGOCIOS Y GESTI흁 EMPRESARIAL;603;245;848;72;35;107;80;24;104;25;15;40
SAN LUIS POTOS;INGENIER페 EN SISTEMAS COMPUTACIONALES;475;1262;1737;115;323;438;97;179;276;65;114;179
SAN LUIS POTOS;INGENIER페 EN SISTEMAS DE INFORMACI흁;1;20;21;1;13;14;2;6;8;0;0;0
SAN LUIS POTOS;INGENIER페 EN SISTEMAS INTELIGENTES;46;242;288;16;93;109;0;0;0;0;0;0
SAN LUIS POTOS;INGENIER페 EN SISTEMAS PRODUCTIVOS;69;121;190;0;0;0;35;45;80;35;45;80
SAN LUIS POTOS;INGENIER페 EN SISTEMAS Y TECNOLOG페S INDUSTRIALES;777;1091;1868;235;300;535;54;98;152;47;76;123
SAN LUIS POTOS;INGENIER페 EN SOFTWARE Y SISTEMAS COMPUTACIONALES;51;125;176;23;51;74;5;14;19;1;4;5
SAN LUIS POTOS;INGENIER페 EN TECNOLOG페S DE INFORMACI흁 Y TELECOMUNICACIONES;16;55;71;0;0;0;17;44;61;12;33;45
SAN LUIS POTOS;INGENIER페 EN TECNOLOG페S DE LA INFORMACI흁;110;397;507;26;118;144;10;36;46;15;37;52
SAN LUIS POTOS;INGENIER페 EN TECNOLOG페S DE LA INFORMACI흁 Y COMUNICACIONES;0;1;1;0;0;0;0;2;2;0;1;1
SAN LUIS POTOS;INGENIER페 EN TECNOLOG페S DE LA INFORMACI흁 Y COMUNICACIONES EN COMPETENCIAS;19;41;60;0;0;0;5;5;10;5;5;10
SAN LUIS POTOS;INGENIER페 EN TECNOLOG페S DE MANUFACTURA;245;1107;1352;68;267;335;22;103;125;5;80;85
SAN LUIS POTOS;INGENIER페 EN TECNOLOG페S PARA LA AUTOMATIZACI흁;6;94;100;0;0;0;1;25;26;1;25;26
SAN LUIS POTOS;INGENIER페 EN TELEM쳆ICA;44;131;175;5;23;28;5;14;19;5;25;30
SAN LUIS POTOS;INGENIER페 EN TOPOGRAF페 Y CONSTRUCCI흁;39;89;128;5;34;39;2;7;9;0;10;10
SAN LUIS POTOS;INGENIER페 F펩ICO;25;97;122;11;33;44;1;2;3;3;7;10
SAN LUIS POTOS;INGENIER페 FORESTAL;14;21;35;14;21;35;0;0;0;0;0;0
SAN LUIS POTOS;INGENIER페 INDUSTRIAL;2182;4608;6790;473;908;1381;392;1013;1405;218;650;868
SAN LUIS POTOS;INGENIER페 INDUSTRIAL EN MANUFACTURA;19;28;47;2;4;6;5;6;11;5;6;11
SAN LUIS POTOS;INGENIER페 INDUSTRIAL MECATR흁ICA;186;761;947;80;265;345;25;125;150;11;19;30
SAN LUIS POTOS;INGENIER페 INDUSTRIAL Y DE SISTEMAS;60;91;151;0;0;0;12;21;33;12;20;32
SAN LUIS POTOS;INGENIER페 INFORM쳆ICA;43;78;121;15;13;28;7;19;26;1;7;8
SAN LUIS POTOS;INGENIER페 MEC쳁ICA;89;745;834;15;132;147;6;77;83;1;32;33
SAN LUIS POTOS;INGENIER페 MEC쳁ICA ADMINISTRATIVA;198;265;463;41;63;104;18;39;57;17;37;54
SAN LUIS POTOS;INGENIER페 MEC쳁ICA AUTOMOTRIZ;2;131;133;0;45;45;0;0;0;0;0;0
SAN LUIS POTOS;INGENIER페 MEC쳁ICA EL텎TRICA;45;410;455;15;92;107;4;40;44;4;46;50
SAN LUIS POTOS;INGENIER페 MEC쳁ICO ADMINISTRADOR;11;29;40;5;9;14;1;5;6;0;3;3
SAN LUIS POTOS;INGENIER페 MECATR흁ICA;241;1396;1637;43;263;306;15;184;199;4;86;90
SAN LUIS POTOS;INGENIER페 METALURGICA Y DE MATERIALES;91;186;277;18;40;58;6;12;18;10;22;32
SAN LUIS POTOS;INGENIER페 QU펤ICA;98;63;161;24;16;40;9;6;15;11;5;16
SAN LUIS POTOS;INGENIER페 QU펤ICO;226;259;485;45;64;109;35;36;71;21;26;47
SAN LUIS POTOS;INGENIERO AGROINDUSTRIAL;48;28;76;10;7;17;6;4;10;3;4;7
SAN LUIS POTOS;INGENIERO EN ADMINISTRACI흁 Y GESTI흁 TECNOL휺ICA;4;4;8;1;0;1;0;0;0;0;0;0
SAN LUIS POTOS;INGENIERO EN DESARROLLO DE NUEVOS NEGOCIOS;1;0;1;0;0;0;0;0;0;0;0;0
SAN LUIS POTOS;INGENIERO MEC쳁ICO ELECTRICISTA;11;101;112;4;34;38;0;9;9;0;7;7
SAN LUIS POTOS;LICENCIATURA CONTADOR P２LICO Y AUDITOR;37;10;47;7;3;10;10;4;14;0;0;0
SAN LUIS POTOS;LICENCIATURA DE INGENIERO AGR흁OMO EN PRODUCCI흁 EN INVERNADEROS;55;104;159;21;19;40;3;8;11;5;7;12
SAN LUIS POTOS;LICENCIATURA DE INGENIERO EN TELECOMUNICACIONES;28;74;102;12;18;30;1;4;5;2;8;10
SAN LUIS POTOS;LICENCIATURA DISE헲 DE LA IMAGEN Y DEL BIENESTAR;54;0;54;23;0;23;1;0;1;0;0;0
SAN LUIS POTOS;LICENCIATURA EN ADMINISTRACI흁;2660;1624;4284;508;369;877;484;270;754;358;204;562
SAN LUIS POTOS;LICENCIATURA EN ADMINISTRACI흁 DE CENTROS DE SALUD ;6;3;9;4;3;7;0;0;0;0;0;0
SAN LUIS POTOS;LICENCIATURA EN ADMINISTRACI흁 DE EMPRESAS;1181;831;2012;530;407;937;78;64;142;60;47;107
SAN LUIS POTOS;LICENCIATURA EN ADMINISTRACI흁 DE EMPRESAS HOTELERAS;10;1;11;10;1;11;0;0;0;0;0;0
SAN LUIS POTOS;LICENCIATURA EN ADMINISTRACI흁 DE EMPRESAS TUR펩TICAS;43;15;58;23;9;32;14;3;17;3;1;4
SAN LUIS POTOS;LICENCIATURA EN ADMINISTRACI흁 DE NEGOCIOS DE COMUNICACI흁 Y ENTRETENIMIENTO;8;5;13;0;0;0;18;6;24;11;3;14
SAN LUIS POTOS;LICENCIATURA EN ADMINISTRACI흁 DE NEGOCIOS DE LA COMUNICACI흁 Y EL ENTRETENIMIENTO;23;13;36;5;7;12;0;0;0;0;0;0
SAN LUIS POTOS;LICENCIATURA EN ADMINISTRACI흁 DE NEGOCIOS DE TURISMO Y HOSPITALIDAD;8;3;11;2;3;5;0;0;0;0;0;0
SAN LUIS POTOS;LICENCIATURA EN ADMINISTRACI흁 DE RECURSOS HUMANOS;0;0;0;0;0;0;0;0;0;2;0;2
SAN LUIS POTOS;LICENCIATURA EN ADMINISTRACI흁 DEL DEPORTE;8;23;31;2;14;16;1;3;4;2;3;5
SAN LUIS POTOS;LICENCIATURA EN ADMINISTRACI흁 FINANCIERA;66;59;125;1;0;1;13;11;24;13;11;24
SAN LUIS POTOS;LICENCIATURA EN ADMINISTRACI흁 HOTELERA Y TUR펩TICA;3;1;4;0;0;0;5;4;9;2;3;5
SAN LUIS POTOS;LICENCIATURA EN ADMINISTRACI흁 P２LICA;27;35;62;0;3;3;32;19;51;28;13;41
SAN LUIS POTOS;LICENCIATURA EN ADMINISTRACI흁 P２LICA MUNICIPAL;133;65;198;44;28;72;36;29;65;2;3;5
SAN LUIS POTOS;LICENCIATURA EN ADMINISTRACI흁 TUR펩TICA;23;7;30;11;2;13;2;1;3;7;1;8
SAN LUIS POTOS;LICENCIATURA EN ADMINISTRACI흁 Y DIRECCI흁 EMPRESARIAL;15;25;40;11;13;24;2;5;7;2;5;7
SAN LUIS POTOS;LICENCIATURA EN ADMINISTRACI흁 Y GESTI흁;579;304;883;122;91;213;82;34;116;39;24;63
SAN LUIS POTOS;LICENCIATURA EN ADMINISTRACI흁 Y GESTI흁 DE EMPRESAS;19;23;42;11;12;23;2;3;5;0;0;0
SAN LUIS POTOS;LICENCIATURA EN ADMINISTRACI흁 Y GESTI흁 DE PEQUE헤S Y MEDIANAS EMPRESAS;348;156;504;140;57;197;45;16;61;18;3;21
SAN LUIS POTOS;LICENCIATURA EN ADMINISTRACI흁 Y GESTI흁 EMPRESARIAL;165;108;273;64;27;91;27;21;48;4;3;7
SAN LUIS POTOS;LICENCIATURA EN ADMINISTRACI흁 Y POL펪ICAS P２LICAS;116;102;218;27;32;59;0;0;0;0;0;0
SAN LUIS POTOS;LICENCIATURA EN AGRONEGOCIOS;49;61;110;12;15;27;7;2;9;6;1;7
SAN LUIS POTOS;LICENCIATURA EN ANTROPOLOG페;65;55;120;19;11;30;5;6;11;7;3;10
SAN LUIS POTOS;LICENCIATURA EN ARCHIVOLOG페;1;1;2;0;0;0;6;0;6;15;4;19
SAN LUIS POTOS;LICENCIATURA EN ARQUEOLOG페;41;29;70;8;10;18;4;6;10;2;4;6
SAN LUIS POTOS;LICENCIATURA EN ARQUITECTURA;263;551;814;89;206;295;28;41;69;19;33;52
SAN LUIS POTOS;LICENCIATURA EN ARTE CONTEMPOR쳁EO;80;51;131;27;19;46;0;0;0;0;0;0
SAN LUIS POTOS;LICENCIATURA EN ARTE DRAM쳆ICO;14;16;30;5;5;10;3;5;8;4;0;4
SAN LUIS POTOS;LICENCIATURA EN ARTES PL쳅TICAS;45;40;85;14;12;26;8;7;15;4;1;5
SAN LUIS POTOS;LICENCIATURA EN BIBLIOTECOLOG페;1;0;1;0;0;0;6;3;9;9;4;13
SAN LUIS POTOS;LICENCIATURA EN BIOF펩ICA;30;57;87;7;18;25;2;1;3;4;3;7
SAN LUIS POTOS;LICENCIATURA EN BIOLOG페;99;76;175;22;17;39;7;4;11;8;3;11
SAN LUIS POTOS;LICENCIATURA EN CIENCIAS AMBIENTALES Y SALUD;90;22;112;26;9;35;23;4;27;10;10;20
SAN LUIS POTOS;LICENCIATURA EN CIENCIAS DE LA COMUNICACI흁;262;305;567;80;95;175;64;49;113;77;52;129
SAN LUIS POTOS;LICENCIATURA EN CIENCIAS DE LA COMUNICACI흁 Y GESTI흁 DE SISTEMAS DEL CONOCIMIENTO  ;0;7;7;0;2;2;0;0;0;0;0;0
SAN LUIS POTOS;LICENCIATURA EN CIENCIAS DE LA EDUCACI흁;137;49;186;23;5;28;2;3;5;2;3;5
SAN LUIS POTOS;LICENCIATURA EN CIENCIAS POL펪ICAS Y ADMINISTRACI흁 P２LICA;2;4;6;0;0;0;0;4;4;2;3;5
SAN LUIS POTOS;LICENCIATURA EN CIENCIAS Y T텎NICAS DE LA COMUNICACI흁;23;23;46;9;14;23;13;15;28;13;15;28
SAN LUIS POTOS;LICENCIATURA EN COMERCIO EXTERIOR;0;0;0;0;0;0;0;0;0;1;1;2
SAN LUIS POTOS;LICENCIATURA EN COMERCIO INTERNACIONAL;560;368;928;159;121;280;61;43;104;49;33;82
SAN LUIS POTOS;LICENCIATURA EN COMERCIO Y NEGOCIOS INTERNACIONALES;441;326;767;115;94;209;84;58;142;67;41;108
SAN LUIS POTOS;LICENCIATURA EN COMPOSICI흁;11;48;59;4;13;17;1;3;4;0;2;2
SAN LUIS POTOS;LICENCIATURA EN COMUNICACI흁;11;16;27;6;8;14;4;2;6;0;0;0
SAN LUIS POTOS;LICENCIATURA EN COMUNICACI흁 GR첹ICA;16;11;27;6;7;13;3;2;5;2;2;4
SAN LUIS POTOS;LICENCIATURA EN COMUNICACI흁 HUMANA;0;0;0;0;0;0;0;0;0;2;1;3
SAN LUIS POTOS;LICENCIATURA EN COMUNICACI흁 INTERCULTURAL;7;1;8;0;0;0;0;0;0;0;0;0
SAN LUIS POTOS;LICENCIATURA EN CONSERVACI흁 Y RESTAURACI흁 DE BIENES CULTURALES MUEBLES;87;35;122;27;8;35;17;2;19;10;5;15
SAN LUIS POTOS;LICENCIATURA EN CONTADOR P２LICO;269;144;413;58;30;88;151;92;243;86;55;141
SAN LUIS POTOS;LICENCIATURA EN CONTADUR페;25;30;55;12;13;25;1;2;3;6;4;10
SAN LUIS POTOS;LICENCIATURA EN CONTADUR페 P２LICA;571;359;930;215;133;348;60;31;91;63;31;94
SAN LUIS POTOS;LICENCIATURA EN CONTADUR페 P２LICA Y FINANZAS;207;117;324;48;27;75;26;15;41;23;14;37
SAN LUIS POTOS;LICENCIATURA EN CREACI흁, DIRECCI흁 Y ADMINISTRACI흁 DE EMPRESAS  ;4;2;6;4;2;6;0;0;0;0;0;0
SAN LUIS POTOS;LICENCIATURA EN CRIMINAL펩TICA;27;18;45;0;0;0;0;0;0;0;0;0
SAN LUIS POTOS;LICENCIATURA EN CRIMINOLOG페;476;431;907;147;101;248;33;36;69;16;18;34
SAN LUIS POTOS;LICENCIATURA EN CRIMINOLOG페 Y CRIMINAL펩TICA;40;42;82;11;11;22;11;8;19;11;8;19
SAN LUIS POTOS;LICENCIATURA EN DANZA CONTEMPOR쳁EA;8;3;11;0;0;0;8;2;10;0;0;0
SAN LUIS POTOS;LICENCIATURA EN DANZA FOLKLRICA;3;2;5;0;0;0;2;0;2;0;1;1
SAN LUIS POTOS;LICENCIATURA EN DERECHO;3728;3239;6967;1270;1035;2305;637;627;1264;487;476;963
SAN LUIS POTOS;LICENCIATURA EN DERECHO CON ORIENTACI흁 EN: ASUNTOS IND펞ENAS;0;0;0;0;0;0;0;0;0;7;19;26
SAN LUIS POTOS;LICENCIATURA EN DESARROLLO ECON흀ICO REGIONAL;0;0;0;0;0;0;0;0;0;0;1;1
SAN LUIS POTOS;LICENCIATURA EN DISE헲 ARQUITECT흁ICO Y DE INTERIORES;12;31;43;0;0;0;0;0;0;0;0;0
SAN LUIS POTOS;LICENCIATURA EN DISE헲 DE MODAS;15;1;16;9;1;10;6;0;6;0;0;0
SAN LUIS POTOS;LICENCIATURA EN DISE헲 E INDUSTRIA DEL VESTIDO;33;5;38;25;3;28;6;0;6;0;0;0
SAN LUIS POTOS;LICENCIATURA EN DISE헲 GR첹ICO;408;263;671;112;70;182;69;46;115;47;27;74
SAN LUIS POTOS;LICENCIATURA EN DISE헲 GR첹ICO DIGITAL;33;32;65;24;21;45;0;0;0;1;2;3
