ENTIDAD FEDERATIVA;NOMBRE PROGRAMA EDUCATIVO;Matr鞍ula Mujeres;Matr鞍ula Hombres;Matr鞍ula Total;Nuevo Ingreso Mujeres;Nuevo Ingreso Hombres;Nuevo Ingreso Total;Egresados Mujeres;Egresados Hombres;Egresados Total;Titulados Mujeres;Titulados Hombres;Titulados Total
CIUDAD DE M텢ICO;LICENCIATURA EN TECNOLOG페S DE LA INFORMACI흁;72;273;345;12;57;69;12;57;69;8;11;19
CIUDAD DE M텢ICO;LICENCIATURA EN TECNOLOG페S DE LA INFORMACI흁 EN LOS NEGOCIOS;9;22;31;4;12;16;4;5;9;0;0;0
CIUDAD DE M텢ICO;LICENCIATURA EN TECNOLOG페S PARA LA INFORMACI흁 EN CIENCIAS;23;76;99;9;24;33;0;0;0;0;0;0
CIUDAD DE M텢ICO;LICENCIATURA EN TECNOLOG페S Y SISTEMAS DE INFORMACI흁;69;216;285;16;53;69;2;10;12;1;5;6
CIUDAD DE M텢ICO;LICENCIATURA EN TEOLOG페;43;262;305;12;81;93;8;37;45;7;29;36
CIUDAD DE M텢ICO;LICENCIATURA EN TERAPIA F펩ICA;149;52;201;60;17;77;35;9;44;41;12;53
CIUDAD DE M텢ICO;LICENCIATURA EN TERAPIA OCUPACIONAL;39;3;42;9;2;11;18;0;18;8;1;9
CIUDAD DE M텢ICO;LICENCIATURA EN TERAPISTA EN COMUNICACI흁 HUMANA;35;2;37;18;2;20;9;0;9;12;1;13
CIUDAD DE M텢ICO;LICENCIATURA EN TRABAJO SOCIAL;3214;983;4197;685;353;1038;540;126;666;498;97;595
CIUDAD DE M텢ICO;LICENCIATURA EN TRADUCCI흁;141;37;178;56;14;70;6;2;8;0;0;0
CIUDAD DE M텢ICO;LICENCIATURA EN TRADUCCI흁, LOCALIZACI흁 E INTERPRETACI흁;101;28;129;43;14;57;3;3;6;5;4;9
CIUDAD DE M텢ICO;LICENCIATURA EN TROMB흁;1;18;19;0;3;3;0;3;3;0;2;2
CIUDAD DE M텢ICO;LICENCIATURA EN TROMPETA;0;13;13;0;0;0;1;8;9;0;5;5
CIUDAD DE M텢ICO;LICENCIATURA EN TUBA;0;8;8;0;1;1;0;3;3;0;0;0
CIUDAD DE M텢ICO;LICENCIATURA EN TURISMO;3334;1584;4918;1134;619;1753;419;196;615;406;159;565
CIUDAD DE M텢ICO;LICENCIATURA EN URBANISMO;110;123;233;28;25;53;11;16;27;3;5;8
CIUDAD DE M텢ICO;LICENCIATURA EN URBANISMO Y DESARROLLO METROPOLITANO  ;36;46;82;36;46;82;0;0;0;0;0;0
CIUDAD DE M텢ICO;LICENCIATURA EN VENTA Y COMERCIALIZACI흁;0;0;0;0;0;0;0;1;1;0;0;0
CIUDAD DE M텢ICO;LICENCIATURA EN VENTAS;10;18;28;0;0;0;5;10;15;5;10;15
CIUDAD DE M텢ICO;LICENCIATURA EN VIOLA;5;8;13;1;0;1;1;2;3;1;0;1
CIUDAD DE M텢ICO;LICENCIATURA EN VIOL펥;23;20;43;1;4;5;3;4;7;1;0;1
CIUDAD DE M텢ICO;LICENCIATURA EN VIOLONCELLO;11;12;23;0;1;1;0;2;2;0;0;0
CIUDAD DE M텢ICO;LICENCIATURA INTERNACIONAL EN ADMINISTRACI흁 DE CENTROS DE CONVENCIONES Y EVENTOS;326;139;465;89;40;129;8;0;8;5;2;7
CIUDAD DE M텢ICO;LICENCIATURA INTERNACIONAL EN ADMINISTRACI흁 DE EMPRESAS DE LA HOSPITALIDAD;61;20;81;0;0;0;0;0;0;0;0;0
CIUDAD DE M텢ICO;LICENCIATURA INTERNACIONAL EN ADMINISTRACI흁 DE EMPRESAS GASTRON흀ICAS;34;36;70;0;0;0;0;0;0;0;0;0
CIUDAD DE M텢ICO;LICENCIATURA INTERNACIONAL EN ADMINISTRACI흁 DE EMPRESAS TUR펩TICAS;118;43;161;0;2;2;3;2;5;2;1;3
CIUDAD DE M텢ICO;LICENCIATURA INTERNACIONAL EN ADMINISTRACI흁 DE HOTELES Y COMPLEJOS TUR펩TICOS;93;40;133;0;0;0;63;25;88;16;10;26
CIUDAD DE M텢ICO;LICENCIATURA INTERNACIONAL EN GASTRONOM페;152;140;292;44;35;79;15;20;35;8;18;26
CIUDAD DE M텢ICO;LICENCIATURA INTERNACIONAL EN MERCADOS GLOBALES;0;0;0;0;0;0;1;0;1;1;0;1
CIUDAD DE M텢ICO;LICENCIATURA INTERNACIONAL EN MERCADOTECNIA E INTEGRACI흁 DE MERCADOS;0;0;0;0;0;0;0;0;0;1;0;1
CIUDAD DE M텢ICO;LICENCIATURA QU펤ICO FARMAC텟TICO BI휿OGO;93;51;144;15;13;28;12;8;20;8;1;9
CIUDAD DE M텢ICO;MEDICINA GENERAL;570;467;1037;116;81;197;75;56;131;60;67;127
CIUDAD DE M텢ICO;M텏ICO CIRUJANO;1436;932;2368;277;180;457;154;126;280;95;78;173
CIUDAD DE M텢ICO;M텏ICO CIRUJANO MILITAR;186;368;554;57;86;143;18;53;71;18;53;71
CIUDAD DE M텢ICO;M텏ICO CIRUJANO NAVAL;215;218;433;72;72;144;13;31;44;14;28;42
CIUDAD DE M텢ICO;M텏ICO CIRUJANO Y HOME흃ATA;1201;757;1958;138;48;186;126;79;205;142;102;244
CIUDAD DE M텢ICO;M텏ICO CIRUJANO Y PARTERO;3923;2888;6811;439;302;741;452;381;833;652;532;1184
CIUDAD DE M텢ICO;M텏ICO HOME흃ATA, CIRUJANO Y PARTERO;119;86;205;34;23;57;5;8;13;7;7;14
CIUDAD DE M텢ICO;M텏ICO VETERINARIO ZOOTECNISTA;954;446;1400;210;63;273;74;44;118;74;69;143
CIUDAD DE M텢ICO;PROGRAMA DE ESTUDIOS COMPLEMENTARIOS DE LA COMPETENCIAS DE LA LICENCIATURA EN ENFERMER페;0;0;0;0;0;0;0;0;0;1;1;2
CIUDAD DE M텢ICO;QU펤ICO BACTERI휿OGO Y PARASIT휿OGO;752;573;1325;170;116;286;100;57;157;103;64;167
CIUDAD DE M텢ICO;QU펤ICO FARMAC텟TICO BI휿OGO;855;596;1451;178;118;296;133;76;209;93;62;155
CIUDAD DE M텢ICO;QU펤ICO FARMAC텟TICO BIOTECN휿OGO;174;103;277;74;46;120;5;7;12;3;4;7
CIUDAD DE M텢ICO;QU펤ICO FARMAC텟TICO INDUSTRIAL;564;414;978;127;92;219;53;39;92;48;48;96
COAHUILA;TOTAL;53644;53675;107319;15974;14513;30487;9324;8675;17999;6944;6878;13822
COAHUILA;LICENCIATURA EN EDUCACI흁 ESPECIAL EN EL REA DE ATENCI흁 AUDITIVA Y DE LENGUAJE;8;1;9;0;0;0;10;0;10;10;0;10
COAHUILA;LICENCIATURA EN EDUCACI흁 ESPECIAL EN EL REA DE ATENCI흁 INTELECTUAL;91;12;103;20;5;25;21;0;21;21;0;21
COAHUILA;LICENCIATURA EN EDUCACI흁 ESPECIAL EN EL REA DE ATENCI흁 MOTRIZ;10;0;10;0;0;0;0;0;0;0;0;0
COAHUILA;LICENCIATURA EN EDUCACI흁 F펩ICA;29;49;78;6;22;28;7;13;20;7;13;20
COAHUILA;LICENCIATURA EN EDUCACI흁 PREESCOLAR;597;8;605;270;7;277;61;1;62;61;1;62
COAHUILA;LICENCIATURA EN EDUCACI흁 PRIMARIA;698;164;862;361;83;444;71;15;86;71;15;86
COAHUILA;LICENCIATURA EN EDUCACI흁 SECUNDARIA CON ESPECIALIDAD EN ESPA헲L;48;17;65;18;11;29;9;2;11;8;2;10
COAHUILA;LICENCIATURA EN EDUCACI흁 SECUNDARIA CON ESPECIALIDAD EN LENGUA EXTRANJERA (INGL텝);164;35;199;14;3;17;5;2;7;5;2;7
COAHUILA;LICENCIATURA EN EDUCACI흁 SECUNDARIA CON ESPECIALIDAD EN MATEM쳆ICAS;12;4;16;12;4;16;9;4;13;8;3;11
COAHUILA;LICENCIATURA EN INCLUSI흁 EDUCATIVA;56;2;58;34;1;35;0;0;0;0;0;0
COAHUILA;ARQUITECTO;522;492;1014;102;87;189;61;62;123;54;67;121
COAHUILA;ARQUITECTURA;64;91;155;31;52;83;4;14;18;0;0;0
COAHUILA;BI휿OGO EN RECURSOS NATURALES;3;1;4;0;0;0;1;3;4;0;0;0
COAHUILA;CIRUJANO DENTISTA;621;223;844;117;29;146;73;36;109;69;40;109
COAHUILA;CONTABILIDAD Y FINANZAS;24;12;36;12;7;19;0;1;1;5;3;8
COAHUILA;CONTADOR P２LICO;902;459;1361;205;131;336;190;63;253;195;78;273
COAHUILA;CONTADOR P２LICO AUDITOR;16;4;20;0;0;0;12;8;20;12;7;19
COAHUILA;CONTADOR P２LICO Y AUDITOR;108;41;149;39;14;53;8;2;10;26;11;37
COAHUILA;CONTADUR페 P２LICA;105;36;141;48;16;64;32;13;45;10;1;11
COAHUILA;GE휿OGO;49;58;107;15;13;28;11;15;26;5;3;8
COAHUILA;INGENIER페 AGR펚OLA Y AMBIENTAL;49;76;125;17;15;32;18;20;38;0;6;6
COAHUILA;INGENIER페 AGROINDUSTRIAL;50;69;119;30;42;72;0;0;0;0;0;0
COAHUILA;INGENIER페 AGR흁OMO;138;342;480;40;97;137;14;64;78;16;47;63
COAHUILA;INGENIER페 AGR흁OMO ADMINISTRADOR;62;64;126;15;16;31;15;12;27;7;6;13
COAHUILA;INGENIER페 AGR흁OMO EN DESARROLLO RURAL;35;54;89;15;18;33;4;11;15;5;4;9
COAHUILA;INGENIER페 AGR흁OMO EN HORTICULTURA;170;473;643;47;116;163;31;79;110;19;45;64
COAHUILA;INGENIER페 AGR흁OMO EN IRRIGACI흁;40;178;218;16;46;62;2;36;38;1;16;17
COAHUILA;INGENIER페 AGR흁OMO EN PRODUCCI흁;104;322;426;17;78;95;17;49;66;11;22;33
COAHUILA;INGENIER페 AGR흁OMO PARASIT휿OGO;114;295;409;22;80;102;13;34;47;8;19;27
COAHUILA;INGENIER페 AGR흁OMO ZOOTECNISTA;166;302;468;54;73;127;22;50;72;15;32;47
COAHUILA;INGENIER페 AMBIENTAL;74;63;137;11;11;22;53;68;121;37;48;85
COAHUILA;INGENIER페 BIOM텏ICO;58;73;131;31;43;74;0;0;0;0;0;0
COAHUILA;INGENIER페 BIOQU펤ICA EN ALIMENTOS ESPECIALIDAD EN FERMENTACIONES;438;253;691;90;41;131;52;36;88;67;35;102
COAHUILA;INGENIER페 CIVIL;183;632;815;29;98;127;25;87;112;21;116;137
COAHUILA;INGENIER페 EL텎TRICA;13;206;219;3;36;39;0;24;24;0;20;20
COAHUILA;INGENIER페 ELECTROMEC쳁ICA;5;12;17;0;8;8;0;7;7;0;7;7
COAHUILA;INGENIER페 ELECTR흁ICA;58;590;648;12;130;142;21;115;136;8;75;83
COAHUILA;INGENIER페 ELECTR흁ICA Y DE COMUNICACIONES;16;65;81;6;25;31;3;8;11;3;4;7
COAHUILA;INGENIER페 EN ADMINISTRACI흁;366;193;559;102;53;155;74;22;96;49;19;68
COAHUILA;INGENIER페 EN ADMINISTRACI흁 DE DESARROLLO SUSTENTABLE;0;2;2;0;2;2;0;0;0;0;0;0
COAHUILA;INGENIER페 EN ADMINISTRACI흁 DE TECNOLOG페S DE LA INFORMACI흁 ;1;2;3;1;2;3;0;0;0;0;0;0
COAHUILA;INGENIER페 EN AGRICULTURA SUSTENTABLE Y PROTEGIDA;0;5;5;0;0;0;1;0;1;1;0;1
COAHUILA;INGENIER페 EN AGROBIOLOG페;55;57;112;15;18;33;8;10;18;5;9;14
COAHUILA;INGENIER페 EN AGROECOLOG페;28;45;73;13;18;31;2;4;6;1;2;3
COAHUILA;INGENIER페 EN AGRONOM페;12;27;39;4;10;14;2;0;2;0;0;0
COAHUILA;INGENIER페 EN AUDIO Y PRODUCCI흁 MUSICAL;0;34;34;0;13;13;1;6;7;0;2;2
COAHUILA;INGENIER페 EN BIOTECNOLOG페;23;13;36;0;0;0;20;7;27;20;7;27
COAHUILA;INGENIER페 EN CIENCIA Y TECNOLOG페 DE ALIMENTOS;147;84;231;36;30;66;27;11;38;12;8;20
COAHUILA;INGENIER페 EN CONFIABILIDAD DE PLANTA;7;49;56;0;0;0;4;36;40;4;36;40
COAHUILA;INGENIER페 EN DESARROLLO DE SOFTWARE;9;12;21;9;12;21;0;0;0;0;0;0
COAHUILA;INGENIER페 EN DESARROLLO E INNOVACI흁 EMPRESARIAL;433;144;577;0;0;0;206;61;267;187;59;246
COAHUILA;INGENIER페 EN DESARROLLO Y DISE헲 DE SOFTWARE;9;26;35;4;12;16;0;0;0;0;0;0
COAHUILA;INGENIER페 EN EL텎TRICA;0;0;0;0;0;0;0;0;0;0;4;4
COAHUILA;INGENIER페 EN ELECTROMEC쳁ICA;15;258;273;8;74;82;0;44;44;0;69;69
COAHUILA;INGENIER페 EN ELECTR흁ICA;0;0;0;0;0;0;0;0;0;0;4;4
COAHUILA;INGENIER페 EN ELECTR흁ICA INDUSTRIAL;24;127;151;4;51;55;3;23;26;8;37;45
COAHUILA;INGENIER페 EN ENERG페;59;116;175;15;37;52;18;6;24;0;5;5
COAHUILA;INGENIER페 EN ENERG페S ALTERNATIVAS;5;13;18;1;5;6;0;0;0;0;0;0
COAHUILA;INGENIER페 EN ENERG페S RENOVABLES;191;278;469;30;60;90;7;18;25;4;25;29
COAHUILA;INGENIER페 EN GESTI흁 DE PROCESOS INDUSTRIALES;3;14;17;3;14;17;0;0;0;0;0;0
COAHUILA;INGENIER페 EN GESTI흁 EMPRESARIAL;2901;1195;4096;578;280;858;503;197;700;403;162;565
COAHUILA;INGENIER페 EN INDUSTRIAS ALIMENTARIAS;76;28;104;18;4;22;9;5;14;10;1;11
COAHUILA;INGENIER페 EN INFORM쳆ICA;31;53;84;5;14;19;13;25;38;10;25;35
COAHUILA;INGENIER페 EN LOG펩TICA;81;84;165;12;30;42;8;12;20;4;0;4
COAHUILA;INGENIER페 EN LOG펩TICA INTERNACIONAL;40;19;59;0;0;0;9;2;11;1;1;2
COAHUILA;INGENIER페 EN MANTENIMIENTO INDUSTRIAL;106;586;692;0;0;0;10;136;146;24;247;271
COAHUILA;INGENIER페 EN MATERIALES;296;326;622;49;62;111;42;47;89;32;40;72
COAHUILA;INGENIER페 EN MECATR흁ICA;226;1555;1781;29;141;170;53;544;597;59;559;618
COAHUILA;INGENIER페 EN METAL MEC쳁ICA;11;90;101;0;0;0;3;28;31;3;28;31
COAHUILA;INGENIER페 EN METROLOG페 INDUSTRIAL;44;63;107;18;24;42;20;18;38;4;6;10
COAHUILA;INGENIER페 EN MINER페;21;26;47;0;0;0;0;0;0;0;0;0
COAHUILA;INGENIER페 EN NANOTECNOLOG페;3;11;14;0;0;0;4;16;20;4;16;20
COAHUILA;INGENIER페 EN PROCESOS AMBIENTALES;115;78;193;35;23;58;13;8;21;12;5;17
COAHUILA;INGENIER페 EN PROCESOS DE MANUFACTURA;68;155;223;35;80;115;7;11;18;0;0;0
COAHUILA;INGENIER페 EN PROCESOS Y OPERACIONES INDUSTRIALES;67;124;191;0;0;0;37;81;118;37;81;118
COAHUILA;INGENIER페 EN RECURSOS MINERALES Y ENERG텞ICOS;35;67;102;5;8;13;8;25;33;11;28;39
COAHUILA;INGENIER페 EN SEGURIDAD AMBIENTAL SUSTENTABLE;16;7;23;0;0;0;12;3;15;12;3;15
COAHUILA;INGENIER페 EN SISTEMAS COMPUTACIONALES;429;1137;1566;123;291;414;64;124;188;62;108;170
COAHUILA;INGENIER페 EN SISTEMAS COMPUTACIONALES Y ADMINISTRACI흁 DE EMPRESAS;8;6;14;5;3;8;0;1;1;0;1;1
COAHUILA;INGENIER페 EN SISTEMAS PRODUCTIVOS;63;95;158;0;0;0;36;41;77;29;63;92
COAHUILA;INGENIER페 EN SISTEMAS Y PRODUCTIVIDAD INDUSTRIAL;35;59;94;10;12;22;2;10;12;1;5;6
COAHUILA;INGENIER페 EN TECNOLOG페 AMBIENTAL;97;58;155;37;20;57;22;15;37;28;16;44
COAHUILA;INGENIER페 EN TECNOLOG페 DE LA INFORMACI흁 Y LA COMUNICACI흁;35;80;115;20;27;47;19;31;50;13;18;31
COAHUILA;INGENIER페 EN TECNOLOG페S DE INFORMACI흁;0;0;0;0;0;0;0;2;2;0;5;5
COAHUILA;INGENIER페 EN TECNOLOG페S DE INFORMACI흁 Y COMUNICACIONES;0;1;1;0;0;0;0;1;1;0;1;1
COAHUILA;INGENIER페 EN TECNOLOG페S DE LA INFORMACI흁;46;73;119;0;0;0;49;53;102;49;53;102
COAHUILA;INGENIER페 EN TECNOLOG페S DE LA INFORMACI흁 Y COMUNICACI흁;23;29;52;8;15;23;3;6;9;7;6;13
COAHUILA;INGENIER페 EN TECNOLOG페S DE LA PRODUCCI흁;120;133;253;0;0;0;62;39;101;62;39;101
COAHUILA;INGENIER페 EN TECNOLOG페S DE MANUFACTURA;220;419;639;96;186;282;27;40;67;9;11;20
COAHUILA;INGENIER페 F펩ICA;46;93;139;10;39;49;2;6;8;2;3;5
COAHUILA;INGENIER페 FORESTAL;63;150;213;22;40;62;17;23;40;16;29;45
COAHUILA;INGENIER페 HIDROL휺ICA;18;29;47;1;9;10;0;0;0;0;0;0
COAHUILA;INGENIER페 INDUSTRIAL;1933;3698;5631;445;879;1324;227;391;618;177;308;485
COAHUILA;INGENIER페 INDUSTRIAL CON ACENTUACI흁 EN CALIDAD Y PRODUCTIVIDAD;10;28;38;10;28;38;6;15;21;5;12;17
COAHUILA;INGENIER페 INDUSTRIAL EN CALIDAD;18;45;63;4;11;15;1;4;5;1;1;2
COAHUILA;INGENIER페 INDUSTRIAL EN MANUFACTURA;37;78;115;9;34;43;4;17;21;1;1;2
COAHUILA;INGENIER페 INDUSTRIAL Y ADMINISTRACI흁 DE EMPRESAS;4;23;27;3;13;16;0;1;1;0;2;2
COAHUILA;INGENIER페 INDUSTRIAL Y DE SISTEMAS;820;1866;2686;176;379;555;119;262;381;67;151;218
COAHUILA;INGENIER페 INFORM쳆ICA;53;106;159;14;32;46;24;23;47;10;14;24
COAHUILA;INGENIER페 MEC쳁ICA;84;784;868;21;177;198;15;109;124;10;70;80
COAHUILA;INGENIER페 MEC쳁ICA EL텎TRICA;18;329;347;1;45;46;1;42;43;4;58;62
COAHUILA;INGENIER페 MEC쳁ICA EN PROCESOS DE INYECCI흁;0;5;5;0;5;5;0;0;0;0;0;0
COAHUILA;INGENIER페 MEC쳁ICO ADMINISTRADOR;75;258;333;11;30;41;12;50;62;10;76;86
COAHUILA;INGENIER페 MEC쳁ICO AGR펚OLA;15;152;167;6;56;62;18;20;38;0;6;6
COAHUILA;INGENIER페 MEC쳁ICO ELECTRICISTA;71;552;623;21;125;146;3;58;61;4;44;48
COAHUILA;INGENIER페 MEC쳁ICO EN PROCESOS DE INYECCI흁;30;135;165;6;29;35;5;43;48;4;13;17
COAHUILA;INGENIER페 MECATR흁ICA;239;1594;1833;39;270;309;28;170;198;25;113;138
COAHUILA;INGENIER페 PETROLERA;55;96;151;17;23;40;0;0;0;0;0;0
COAHUILA;INGENIER페 QU펤ICA;0;0;0;0;0;0;0;0;0;2;7;9
COAHUILA;INGENIER페 QU펤ICO;212;237;449;50;49;99;23;25;48;22;39;61
COAHUILA;INGENIER페 QU펤ICO METALURGISTA Y MATERIALES;145;247;392;30;62;92;27;30;57;31;39;70
COAHUILA;INGENIERO AUTOMOTRIZ;34;369;403;9;99;108;1;3;4;0;0;0
COAHUILA;INGENIERO EN BIOTECNOLOG페;88;80;168;43;22;65;0;0;0;0;0;0
COAHUILA;INGENIERO EN CIENCIAS AGRARIAS;51;138;189;17;40;57;0;0;0;0;0;0
COAHUILA;INGENIERO INDUSTRIAL ADMINISTRADOR;0;0;0;0;0;0;2;2;4;1;0;1
COAHUILA;INGENIERO INDUSTRIAL Y DE SISTEMAS;23;114;137;14;74;88;3;11;14;2;3;5
COAHUILA;LICENCIADO EN ADMINISTRACI흁 DE EMPRESAS;34;36;70;27;25;52;0;0;0;0;0;0
COAHUILA;LICENCIADO EN COMERCIO EXTERIOR Y ADUANAS;253;118;371;105;36;141;0;0;0;0;0;0
COAHUILA;LICENCIADO EN COMUNICACI흁 EN PRODUCCI흁 DE MEDIOS;98;97;195;16;23;39;0;0;0;0;0;0
COAHUILA;LICENCIADO EN DERECHO;240;134;374;97;61;158;31;18;49;17;7;24
COAHUILA;LICENCIADO EN EDUCACI흁;17;6;23;11;3;14;2;0;2;2;0;2
COAHUILA;LICENCIADO EN ENFERMER페;190;62;252;33;9;42;24;5;29;18;5;23
COAHUILA;LICENCIADO EN NEGOCIOS INTERNACIONALES;4;1;5;4;1;5;2;0;2;3;1;4
COAHUILA;LICENCIADO EN PSICOLOG페;271;71;342;146;36;182;51;8;59;0;0;0
COAHUILA;LICENCIADO EN SISTEMAS DE COMPUTACI흁 ADMINISTRATIVA ;3;1;4;3;1;4;0;0;0;1;2;3
COAHUILA;LICENCIATURA EJECUTIVA EN SEGURIDAD P２LICA;0;2;2;0;2;2;4;5;9;4;5;9
COAHUILA;LICENCIATURA EN ADMINISTRACI흁;716;582;1298;246;237;483;422;237;659;85;35;120
COAHUILA;LICENCIATURA EN ADMINISTRACI흁 DE EMPRESAS;3270;2149;5419;1032;711;1743;537;285;822;409;217;626
COAHUILA;LICENCIATURA EN ADMINISTRACI흁 DE EMPRESAS CON ACENTUACI흁 EN COMERCIALIZACI흁;377;242;619;65;59;124;74;23;97;40;21;61
COAHUILA;LICENCIATURA EN ADMINISTRACI흁 DE EMPRESAS CON ACENTUACI흁 EN PRODUCCI흁;158;85;243;36;22;58;23;10;33;13;7;20
COAHUILA;LICENCIATURA EN ADMINISTRACI흁 DE EMPRESAS TUR펩TICAS;189;59;248;37;20;57;41;16;57;19;7;26
COAHUILA;LICENCIATURA EN ADMINISTRACI흁 DE NEGOCIOS DE LA HOSPITALIDAD;38;7;45;9;4;13;6;1;7;0;0;0
COAHUILA;LICENCIATURA EN ADMINISTRACI흁 DE NEGOCIOS INTERNACIONALES;57;61;118;19;20;39;7;2;9;3;1;4
COAHUILA;LICENCIATURA EN ADMINISTRACI흁 DE RECURSOS HUMANOS;926;237;1163;253;50;303;132;36;168;111;50;161
COAHUILA;LICENCIATURA EN ADMINISTRACI흁 DE TECNOLOG페S DE INFORMACI흁;0;3;3;0;3;3;0;0;0;0;0;0
COAHUILA;LICENCIATURA EN ADMINISTRACI흁 DEL TRANSPORTE;0;5;5;0;5;5;0;0;0;0;0;0
COAHUILA;LICENCIATURA EN ADMINISTRACI흁 ESTRAT텒ICA;43;33;76;18;6;24;40;18;58;1;4;5
COAHUILA;LICENCIATURA EN ADMINISTRACI흁 FINANCIERA;154;168;322;28;30;58;18;17;35;13;15;28
COAHUILA;LICENCIATURA EN ADMINISTRACI흁 FISCAL;182;135;317;31;33;64;37;14;51;12;8;20
COAHUILA;LICENCIATURA EN ADMINISTRACI흁 Y DESARROLLO EMPRESARIAL;2;0;2;1;0;1;2;0;2;2;0;2
COAHUILA;LICENCIATURA EN ADMINISTRACI흁 Y DIRECCI흁 EMPRESARIAL;37;28;65;19;14;33;0;0;0;0;0;0
COAHUILA;LICENCIATURA EN ADMINISTRACI흁 Y ESTRATEGIA DE NEGOCIOS;15;14;29;15;14;29;0;0;0;0;0;0
COAHUILA;LICENCIATURA EN ADMINISTRACI흁 Y FINANZAS;33;29;62;0;0;0;10;8;18;0;0;0
COAHUILA;LICENCIATURA EN ADMINISTRACI흁 Y GESTI흁 EMPRESARIAL;36;31;67;8;10;18;0;0;0;0;0;0
COAHUILA;LICENCIATURA EN ADMINISTRACI흁 Y MERCADOTECNIA;60;39;99;20;12;32;14;5;19;15;4;19
COAHUILA;LICENCIATURA EN ADMINISTRACI흁 Y NEGOCIOS;5;8;13;0;1;1;2;0;2;0;0;0
COAHUILA;LICENCIATURA EN ARQUITECTURA;384;467;851;131;177;308;32;41;73;17;20;37
COAHUILA;LICENCIATURA EN ARTES ESC텙ICAS Y GESTI흁 CULTURAL;38;17;55;11;6;17;0;0;0;0;0;0
COAHUILA;LICENCIATURA EN ARTES PL쳅TICAS;73;43;116;28;13;41;11;6;17;3;4;7
COAHUILA;LICENCIATURA EN CIENCIAS APLICADAS A LA PREVENCI흁 Y COMBATE DE SINIESTROS;2;12;14;1;8;9;3;11;14;0;0;0
COAHUILA;LICENCIATURA EN CIENCIAS DE LA COMUNICACI흁;262;233;495;49;63;112;80;38;118;76;33;109
COAHUILA;LICENCIATURA EN CIENCIAS DE LA COMUNICACI흁 ORGANIZACIONAL Y RELACIONES PUBLICAS;90;45;135;16;8;24;0;0;0;0;0;0
COAHUILA;LICENCIATURA EN CIENCIAS DE LA EDUCACI흁;437;78;515;142;34;176;68;9;77;83;12;95
COAHUILA;LICENCIATURA EN CIENCIAS DE LA EDUCACI흁 INFANTIL;32;0;32;9;0;9;2;0;2;2;0;2
COAHUILA;LICENCIATURA EN CIENCIAS EDUCATIVAS;0;0;0;0;0;0;2;1;3;0;0;0
COAHUILA;LICENCIATURA EN CIENCIAS JUR펛ICAS Y DERECHO;0;1;1;0;0;0;0;0;0;0;0;0
COAHUILA;LICENCIATURA EN CIENCIAS POL펪ICAS Y ADMINISTRACI흁 P２LICA;47;51;98;13;14;27;9;2;11;2;2;4
COAHUILA;LICENCIATURA EN CIENCIAS POL펪ICAS Y GESTI흁 P２LICA;2;1;3;0;0;0;2;0;2;2;0;2
COAHUILA;LICENCIATURA EN CIENCIAS QU펤ICAS;99;44;143;28;10;38;19;8;27;14;2;16
COAHUILA;LICENCIATURA EN CIENCIAS Y T텎NICAS DE LA COMUNICACI흁;65;53;118;24;23;47;17;9;26;5;10;15
COAHUILA;LICENCIATURA EN CIENCIAS Y T텎NICAS EDUCATIVAS;2;2;4;0;2;2;2;0;2;1;0;1
COAHUILA;LICENCIATURA EN COMERCIO EXTERIOR Y ADUANAS;57;60;117;10;15;25;4;8;12;6;8;14
COAHUILA;LICENCIATURA EN COMERCIO INTERNACIONAL;585;449;1034;178;145;323;95;71;166;89;41;130
COAHUILA;LICENCIATURA EN COMERCIO INTERNACIONAL Y ADMINISTRACI흁 DE EMPRESAS;11;4;15;3;2;5;1;0;1;2;0;2
COAHUILA;LICENCIATURA EN COMERCIO INTERNACIONAL Y ADUANAS;953;558;1511;403;252;655;222;110;332;125;46;171
COAHUILA;LICENCIATURA EN COMERCIO INTERNACIONAL Y LOG펩TICA;18;17;35;13;15;28;0;0;0;0;0;0
COAHUILA;LICENCIATURA EN COMERCIO Y NEGOCIOS INTERNACIONALES;57;36;93;31;21;52;0;0;0;0;0;0
COAHUILA;LICENCIATURA EN COMUNICACI흁;191;155;346;57;55;112;44;29;73;16;17;33
COAHUILA;LICENCIATURA EN COMUNICACI흁 AUDIOVISUAL Y MULTIMEDIA ;4;6;10;4;6;10;0;0;0;0;0;0
COAHUILA;LICENCIATURA EN COMUNICACI흁 E IMAGEN P２LICA;25;18;43;0;0;0;8;6;14;11;6;17
COAHUILA;LICENCIATURA EN COMUNICACI흁 Y PERIODISMO;64;64;128;14;19;33;7;7;14;6;4;10
COAHUILA;LICENCIATURA EN COMUNICACIONES Y ADMINISTRACI흁 DE EMPRESAS;1;4;5;1;2;3;0;0;0;0;0;0
COAHUILA;LICENCIATURA EN CONSEJER페 FAMILIAR;14;4;18;1;0;1;3;1;4;0;0;0
COAHUILA;LICENCIATURA EN CONTADOR P２LICO;60;45;105;13;9;22;7;2;9;7;4;11
COAHUILA;LICENCIATURA EN CONTADOR P２LICO Y AUDITOR;124;60;184;49;32;81;0;0;0;0;0;0
COAHUILA;LICENCIATURA EN CONTADUR페;75;58;133;14;12;26;27;15;42;1;2;3
COAHUILA;LICENCIATURA EN CONTADUR페 P２LICA;1880;1149;3029;526;334;860;331;183;514;279;151;430
COAHUILA;LICENCIATURA EN CONTADUR페 P２LICA Y CONSULTOR페 DE NEGOCIOS;46;64;110;10;15;25;10;4;14;8;5;13
COAHUILA;LICENCIATURA EN CONTADUR페 P２LICA Y FINANZAS;4;1;5;4;1;5;0;0;0;2;2;4
COAHUILA;LICENCIATURA EN CREACI흁 Y DESARROLLO DE EMPRESAS;5;15;20;0;0;0;1;0;1;1;0;1
COAHUILA;LICENCIATURA EN CREATIVIDAD TECNOL휺ICA;12;39;51;7;22;29;0;0;0;0;0;0
COAHUILA;LICENCIATURA EN CREATIVIDAD VISUAL Y NUEVOS MEDIOS  ;5;2;7;4;2;6;0;0;0;0;0;0
COAHUILA;LICENCIATURA EN CRIMINOLOG페;792;627;1419;365;272;637;100;59;159;16;9;25
COAHUILA;LICENCIATURA EN CRIMINOLOG페 Y CIENCIAS FORENSES;83;130;213;57;70;127;26;12;38;0;0;0
COAHUILA;LICENCIATURA EN CRIMINOLOG페 Y CRIMINAL펩TICA;36;18;54;20;13;33;0;0;0;0;0;0
COAHUILA;LICENCIATURA EN DANZA CONTEMPOR쳁EA;10;6;16;4;4;8;3;1;4;0;0;0
COAHUILA;LICENCIATURA EN DERECHO;3870;2924;6794;1284;1009;2293;562;465;1027;348;325;673
COAHUILA;LICENCIATURA EN DERECHO CON ACENTUACI흁 EN AMRICA DEL NORTE;20;15;35;3;3;6;6;1;7;5;1;6
COAHUILA;LICENCIATURA EN DERECHO Y CIENCIAS JUR펛ICAS;66;53;119;36;32;68;12;19;31;16;15;31
COAHUILA;LICENCIATURA EN DERECHO Y CIENCIAS SOCIALES;4;4;8;2;1;3;2;1;3;1;0;1
COAHUILA;LICENCIATURA EN DERECHO Y ECONOM페;4;11;15;4;7;11;0;0;0;0;0;0
COAHUILA;LICENCIATURA EN DESARROLLO E INNOVACI흁 EDUCATIVA;39;0;39;13;0;13;13;0;13;11;0;11
COAHUILA;LICENCIATURA EN DIRECCI흁 COMERCIAL Y MERCADOTECNIA;44;28;72;10;3;13;8;3;11;3;2;5
COAHUILA;LICENCIATURA EN DIRECCI흁 DE EMPRESAS GASTRON흀ICAS;5;2;7;0;0;0;0;0;0;0;0;0
COAHUILA;LICENCIATURA EN DIRECCI흁 DE VENTAS Y ADMINISTRACI흁;2;0;2;2;0;2;0;0;0;0;0;0
COAHUILA;LICENCIATURA EN DISE헲 DE INTERIORES;21;2;23;10;0;10;6;0;6;0;0;0
COAHUILA;LICENCIATURA EN DISE헲 DE LA MODA E INDUSTRIA DEL VESTIDO;8;0;8;0;0;0;9;0;9;9;0;9
COAHUILA;LICENCIATURA EN DISE헲 DIGITAL;2;1;3;2;1;3;0;0;0;0;0;0
COAHUILA;LICENCIATURA EN DISE헲 E INDUSTRIA DEL VESTIDO;52;8;60;23;4;27;2;0;2;5;0;5
COAHUILA;LICENCIATURA EN DISE헲 GR첹ICO;379;293;672;120;105;225;71;27;98;33;15;48
COAHUILA;LICENCIATURA EN DISE헲 GR첹ICO DIGITAL;46;37;83;23;14;37;7;8;15;12;4;16
COAHUILA;LICENCIATURA EN DISE헲 GR첹ICO Y ANIMACI흁;34;34;68;12;13;25;6;10;16;6;8;14
COAHUILA;LICENCIATURA EN DISE헲 GR첹ICO Y MULTIMEDIA;25;33;58;0;0;0;6;9;15;4;2;6
COAHUILA;LICENCIATURA EN DISE헲 GR첹ICO Y PUBLICITARIO;9;12;21;2;4;6;0;0;0;2;2;4
COAHUILA;LICENCIATURA EN DISE헲 INDUSTRIAL;198;57;255;40;11;51;37;7;44;18;6;24
COAHUILA;LICENCIATURA EN DISE헲 Y COMUNICACI흁 GR첹ICA;24;19;43;10;7;17;6;0;6;0;1;1
COAHUILA;LICENCIATURA EN DISE헲 Y DECORACI흁 DE INTERIORES;7;1;8;0;0;0;6;2;8;2;0;2
COAHUILA;LICENCIATURA EN DISE헲 Y MERCADOTECNIA EN MODAS;26;4;30;7;2;9;5;0;5;4;0;4
COAHUILA;LICENCIATURA EN ECONOM페;108;114;222;39;32;71;15;15;30;12;12;24
COAHUILA;LICENCIATURA EN ECONOM페 AGR펚OLA Y AGRONEGOCIOS;53;43;96;18;13;31;4;9;13;2;7;9
COAHUILA;LICENCIATURA EN ECONOM페 Y FINANZAS;3;1;4;3;1;4;0;0;0;0;0;0
COAHUILA;LICENCIATURA EN EDUCACI흁;1193;181;1374;563;93;656;259;27;286;180;14;194
COAHUILA;LICENCIATURA EN EDUCACI흁 E INNOVACI흁 PEDAG휺ICA;493;25;518;458;16;474;0;0;0;0;0;0
COAHUILA;LICENCIATURA EN EDUCACI흁 INICIAL Y PREESCOLAR;12;1;13;6;0;6;0;0;0;0;0;0
COAHUILA;LICENCIATURA EN EDUCACI흁 MEDIA SUPERIOR;2;0;2;0;0;0;0;0;0;0;0;0
COAHUILA;LICENCIATURA EN EDUCACI흁 MUSICAL;6;14;20;2;4;6;0;2;2;1;2;3
COAHUILA;LICENCIATURA EN EDUCACI흁 SECUNDARIA;6;5;11;2;4;6;0;0;0;0;0;0
COAHUILA;LICENCIATURA EN EDUCACI흁 Y GESTI흁 DE INSTITUCIONES EDUCATIVAS;71;3;74;34;2;36;0;0;0;0;0;0
COAHUILA;LICENCIATURA EN EDUCACI흁 Y PRACTICA DOCENTE;31;1;32;6;0;6;5;0;5;2;0;2
COAHUILA;LICENCIATURA EN ENFERMER페;1932;541;2473;689;184;873;283;80;363;229;65;294
COAHUILA;LICENCIATURA EN ENFERMER페 Y OBSTETRICIA;331;100;431;154;45;199;43;18;61;50;18;68
COAHUILA;LICENCIATURA EN EXPRESI흁 ART펩TICA;22;27;49;10;14;24;0;0;0;0;0;0
COAHUILA;LICENCIATURA EN FILOSOF페;1;48;49;1;14;15;0;15;15;0;15;15
COAHUILA;LICENCIATURA EN FISIOTERAPIA;183;73;256;56;30;86;34;10;44;55;23;78
COAHUILA;LICENCIATURA EN FOTOGRAF페 PROFESIONAL;12;5;17;6;5;11;0;0;0;0;0;0
COAHUILA;LICENCIATURA EN GASTRONOM페;295;292;587;146;164;310;66;41;107;3;0;3
COAHUILA;LICENCIATURA EN GERONTOLOG페 SOCIAL;3;0;3;3;0;3;0;0;0;0;0;0
COAHUILA;LICENCIATURA EN GESTI흁 DE NEGOCIOS Y PROYECTOS   ;42;28;70;0;0;0;0;0;0;0;0;0
COAHUILA;LICENCIATURA EN GESTI흁 TUR펩TICA;59;16;75;41;13;54;26;11;37;0;0;0
COAHUILA;LICENCIATURA EN GESTI흁 Y ADMINISTRACI흁 DE PYMES;88;38;126;51;18;69;0;0;0;1;0;1
COAHUILA;LICENCIATURA EN GESTI흁 Y DESARROLLO TUR펩TICO;4;4;8;0;0;0;1;0;1;1;0;1
COAHUILA;LICENCIATURA EN HISTORIA;58;45;103;12;17;29;8;9;17;2;1;3
COAHUILA;LICENCIATURA EN IDIOMA INGL텝;4;6;10;4;6;10;0;0;0;0;0;0
COAHUILA;LICENCIATURA EN IDIOMAS;117;40;157;45;10;55;20;9;29;2;0;2
COAHUILA;LICENCIATURA EN IDIOMAS Y RELACIONES P２LICAS;129;28;157;49;13;62;8;2;10;3;1;4
COAHUILA;LICENCIATURA EN INFORM쳆ICA;2;2;4;0;0;0;0;0;0;4;4;8
COAHUILA;LICENCIATURA EN INFORM쳆ICA ADMINISTRATIVA;32;67;99;19;42;61;91;52;143;0;0;0
COAHUILA;LICENCIATURA EN INGENIER페 AMBIENTAL Y SEGURIDAD INDUSTRIAL;11;8;19;3;2;5;4;2;6;2;1;3
COAHUILA;LICENCIATURA EN INGENIER페 ELECTROMEC쳁ICA;36;305;341;10;71;81;2;23;25;2;17;19
COAHUILA;LICENCIATURA EN INGENIER페 ELECTR흁ICA;16;100;116;4;33;37;3;7;10;0;1;1
COAHUILA;LICENCIATURA EN INGENIER페 ELECTR흁ICA Y TELECOMUNICACIONES;27;109;136;8;41;49;6;37;43;6;37;43
COAHUILA;LICENCIATURA EN INGENIER페 EN BIONEGOCIOS;29;12;41;0;0;0;2;2;4;2;2;4
COAHUILA;LICENCIATURA EN INGENIER페 EN EL텎TRICA;38;269;307;5;32;37;7;63;70;8;82;90
COAHUILA;LICENCIATURA EN INGENIER페 EN ELECTR흁ICA;46;224;270;5;29;34;12;40;52;8;47;55
COAHUILA;LICENCIATURA EN INGENIER페 EN GESTI흁 DE PROYECTOS;91;34;125;0;0;0;53;19;72;53;19;72
COAHUILA;LICENCIATURA EN INGENIER페 EN LOG펩TICA;117;91;208;36;17;53;15;11;26;4;5;9
COAHUILA;LICENCIATURA EN INGENIER페 EN MANTENIMIENTO INDUSTRIAL  ;25;131;156;0;0;0;7;38;45;4;30;34
COAHUILA;LICENCIATURA EN INGENIER페 EN MANUFACTURA Y ROB흆ICA ;1;4;5;1;4;5;0;0;0;0;0;0
COAHUILA;LICENCIATURA EN INGENIER페 EN MECATR흁ICA;31;163;194;12;42;54;9;35;44;4;39;43
COAHUILA;LICENCIATURA EN INGENIER페 EN SISTEMAS COMPUTACIONALES;265;866;1131;62;182;244;38;100;138;48;88;136
COAHUILA;LICENCIATURA EN INGENIER페 EN SISTEMAS DE INFORMACI흁;7;35;42;2;12;14;0;7;7;2;2;4
COAHUILA;LICENCIATURA EN INGENIER페 EN SISTEMAS PRODUCTIVOS;112;89;201;0;0;0;36;34;70;34;34;68
COAHUILA;LICENCIATURA EN INGENIER페 EN TECNOLOG페 AMBIENTAL;69;61;130;21;17;38;27;26;53;27;26;53
