SAN LUIS POTOS;LICENCIATURA EN ARTES PL쳅TICAS;28;21;13;34;15;11;26;53;29;82;4;5;9
SAN LUIS POTOS;LICENCIATURA EN BIBLIOTECONOM페;66;11;19;30;29;37;66;93;127;220;5;20;25
SAN LUIS POTOS;LICENCIATURA EN BIOF펩ICA;20;12;8;20;10;9;19;31;29;60;2;3;5
SAN LUIS POTOS;LICENCIATURA EN BIOLOG페;30;23;35;58;13;17;30;13;17;30;0;0;0
SAN LUIS POTOS;LICENCIATURA EN CIENCIA ANTROPOL휺ICAS;15;7;9;16;2;2;4;9;10;19;2;2;4
SAN LUIS POTOS;LICENCIATURA EN CIENCIAS AMBIENTALES Y SALUD;30;14;36;50;7;23;30;21;54;75;0;0;0
SAN LUIS POTOS;LICENCIATURA EN CIENCIAS DE LA COMUNICACI흁;293;200;244;444;93;107;200;277;320;597;58;73;131
SAN LUIS POTOS;LICENCIATURA EN CIENCIAS DE LA EDUCACI흁;30;4;16;20;4;16;20;4;16;20;0;0;0
SAN LUIS POTOS;LICENCIATURA EN CIENCIAS DE LA EDUCACI흁 SUPERIOR;10;7;15;22;4;7;11;12;20;32;4;13;17
SAN LUIS POTOS;LICENCIATURA EN CIENCIAS HISTRICAS;15;3;4;7;1;1;2;7;8;15;2;1;3
SAN LUIS POTOS;LICENCIATURA EN CIENCIAS POL펪ICAS Y ADMINISTRACI흁 P２LICA;19;10;9;19;3;5;8;19;15;34;3;1;4
SAN LUIS POTOS;LICENCIATURA EN CIENCIAS Y T텎NICAS DE LA COMUNICACI흁;28;54;46;100;13;14;27;46;38;84;9;11;20
SAN LUIS POTOS;LICENCIATURA EN COMERCIO EXTERIOR;35;0;0;0;0;0;0;9;6;15;4;2;6
SAN LUIS POTOS;LICENCIATURA EN COMERCIO INTERNACIONAL;160;79;81;160;63;73;136;174;231;405;32;52;84
SAN LUIS POTOS;LICENCIATURA EN COMERCIO Y NEGOCIOS INTERNACIONALES;110;152;212;364;45;46;91;182;282;464;22;50;72
SAN LUIS POTOS;LICENCIATURA EN COMPOSICI흁;15;23;12;35;12;3;15;35;12;47;1;0;1
SAN LUIS POTOS;LICENCIATURA EN COMUNICACI흁;60;7;14;21;6;12;18;16;28;44;3;9;12
SAN LUIS POTOS;LICENCIATURA EN COMUNICACI흁 GR첹ICA;395;154;241;395;2;10;12;20;35;55;2;9;11
SAN LUIS POTOS;LICENCIATURA EN COMUNICACI흁 HUMANA;55;15;40;55;8;34;42;9;58;67;0;0;0
SAN LUIS POTOS;LICENCIATURA EN COMUNICACI흁 Y PERIODISMO;0;0;0;0;0;0;0;0;0;0;1;1;2
SAN LUIS POTOS;LICENCIATURA EN CONSERVACI흁 Y RESTAURACI흁 DE BIENES CULTURALES MUEBLES;34;26;42;68;11;23;34;56;94;150;0;0;0
SAN LUIS POTOS;LICENCIATURA EN CONTABILIDAD;0;0;0;0;0;0;0;8;10;18;1;3;4
SAN LUIS POTOS;LICENCIATURA EN CONTADOR P２LICO;255;102;74;176;55;80;135;172;280;452;35;61;96
SAN LUIS POTOS;LICENCIATURA EN CONTADUR페;90;23;17;40;5;6;11;51;69;120;22;26;48
SAN LUIS POTOS;LICENCIATURA EN CONTADUR페 P２LICA;150;53;90;143;36;59;95;185;316;501;24;44;68
SAN LUIS POTOS;LICENCIATURA EN CONTADUR페 P２LICA Y FINANZAS;7;3;3;6;3;3;6;18;11;29;0;0;0
SAN LUIS POTOS;LICENCIATURA EN CREACI흁 Y DESARROLLO DE EMPRESAS;23;9;7;16;9;7;16;58;31;89;7;3;10
SAN LUIS POTOS;LICENCIATURA EN CRIMINOLOG페;40;20;20;40;16;17;33;59;48;107;0;0;0
SAN LUIS POTOS;LICENCIATURA EN DANZA CONTEMPOR쳁EA;0;0;0;0;0;0;0;6;10;16;3;7;10
SAN LUIS POTOS;LICENCIATURA EN DANZA FOLKLRICA;0;0;0;0;0;0;0;4;5;9;0;5;5
SAN LUIS POTOS;LICENCIATURA EN DERECHO;1816;1147;1159;2306;717;685;1402;2456;2539;4995;424;517;941
SAN LUIS POTOS;LICENCIATURA EN DERECHO CON ORIENTACI흁 EN: ASUNTOS IND펞ENAS;160;84;85;169;84;80;164;152;156;308;4;5;9
SAN LUIS POTOS;LICENCIATURA EN DESARROLLO ECON흀ICO REGIONAL;120;0;0;0;0;0;0;18;17;35;13;10;23
SAN LUIS POTOS;LICENCIATURA EN DESARROLLO HUMANO;0;0;0;0;0;0;0;0;0;0;0;1;1
SAN LUIS POTOS;LICENCIATURA EN DISE헲 E INDUSTRIA DEL VESTIDO;31;20;64;84;2;32;34;3;81;84;1;16;17
SAN LUIS POTOS;LICENCIATURA EN DISE헲 GR첹ICO;291;245;252;497;104;109;213;400;463;863;41;40;81
SAN LUIS POTOS;LICENCIATURA EN DISE헲 GR첹ICO Y ANIMACI흁;0;10;24;34;10;24;34;23;33;56;2;4;6
SAN LUIS POTOS;LICENCIATURA EN DISE헲 INDUSTRIAL;80;111;156;267;27;52;79;162;242;404;8;19;27
SAN LUIS POTOS;LICENCIATURA EN DISE헲 URBANO Y DEL PAISAJE;34;35;33;68;22;12;34;82;62;144;0;0;0
SAN LUIS POTOS;LICENCIATURA EN DISE헲 Y ARQUITECTURA DE INTERIORES;30;1;23;24;1;23;24;16;62;78;1;7;8
SAN LUIS POTOS;LICENCIATURA EN DISE헲 Y MERCADOTECNIA EN MODAS;35;3;32;35;3;32;35;9;69;78;0;14;14
SAN LUIS POTOS;LICENCIATURA EN ECONOM페;90;68;53;121;50;40;90;191;185;376;32;35;67
SAN LUIS POTOS;LICENCIATURA EN EDIFICACI흁 Y ADMINISTRACI흁 DE OBRAS;75;98;37;135;54;21;75;322;107;429;16;7;23
SAN LUIS POTOS;LICENCIATURA EN EDUCACI흁;439;221;535;756;116;312;428;454;1119;1573;20;81;101
SAN LUIS POTOS;LICENCIATURA EN EDUCACI흁 EN LA ENSE헤NZA DE LENGUAS EXTRANJERAS;115;40;75;115;29;54;83;82;182;264;4;16;20
SAN LUIS POTOS;LICENCIATURA EN EDUCACI흁 ESPECIAL;100;40;60;100;18;29;47;50;90;140;5;33;38
SAN LUIS POTOS;LICENCIATURA EN EDUCACI흁 ESPECIAL EN EL REA DE ATENCI흁 AUDITIVA Y DE LENGUAJE;36;10;71;81;2;34;36;11;117;128;2;26;28
SAN LUIS POTOS;LICENCIATURA EN EDUCACI흁 F펩ICA;134;191;57;248;69;12;81;226;48;274;47;15;62
SAN LUIS POTOS;LICENCIATURA EN EDUCACI흁 F펩ICA Y DEPORTE;232;112;120;232;146;42;188;447;106;553;21;11;32
SAN LUIS POTOS;LICENCIATURA EN EDUCACI흁 INICIAL;0;0;0;0;0;0;0;0;49;49;0;0;0
SAN LUIS POTOS;LICENCIATURA EN EDUCACI흁 MUSICAL;20;35;20;55;13;9;22;43;34;77;8;4;12
SAN LUIS POTOS;LICENCIATURA EN EDUCACI흁 PREESCOLAR;383;92;843;935;38;380;418;120;1250;1370;7;195;202
SAN LUIS POTOS;LICENCIATURA EN EDUCACI흁 PREESCOLAR PARA EL MEDIO IND펞ENA;50;16;18;34;14;15;29;31;86;117;0;0;0
SAN LUIS POTOS;LICENCIATURA EN EDUCACI흁 PRIMARIA;781;581;1216;1797;233;483;716;670;1512;2182;51;216;267
SAN LUIS POTOS;LICENCIATURA EN EDUCACI흁 PRIMARIA INTERCULTURAL BILING㏊;75;141;206;347;71;78;149;142;165;307;13;18;31
SAN LUIS POTOS;LICENCIATURA EN EDUCACI흁 PRIMARIA PARA EL MEDIO IND펞ENA;90;41;44;85;30;39;69;145;139;284;0;0;0
SAN LUIS POTOS;LICENCIATURA EN EDUCACI흁 SECUNDARIA CON ESPECIALIDAD EN BIOLOG페;47;20;27;47;17;26;43;43;55;98;0;0;0
SAN LUIS POTOS;LICENCIATURA EN EDUCACI흁 SECUNDARIA CON ESPECIALIDAD EN ESPA헲L;36;36;59;95;14;22;36;82;164;246;20;30;50
SAN LUIS POTOS;LICENCIATURA EN EDUCACI흁 SECUNDARIA CON ESPECIALIDAD EN F펩ICA;0;0;0;0;0;0;0;8;19;27;0;0;0
SAN LUIS POTOS;LICENCIATURA EN EDUCACI흁 SECUNDARIA CON ESPECIALIDAD EN FORMACI흁 C펬ICA Y 텞ICA;0;0;0;0;0;0;0;20;36;56;7;12;19
SAN LUIS POTOS;LICENCIATURA EN EDUCACI흁 SECUNDARIA CON ESPECIALIDAD EN HISTORIA;52;26;26;52;26;26;52;49;53;102;0;0;0
SAN LUIS POTOS;LICENCIATURA EN EDUCACI흁 SECUNDARIA CON ESPECIALIDAD EN INGL텝;0;0;0;0;0;0;0;14;22;36;0;0;0
SAN LUIS POTOS;LICENCIATURA EN EDUCACI흁 SECUNDARIA CON ESPECIALIDAD EN LENGUA EXTRANJERA (INGL텝);30;22;32;54;14;16;30;21;30;51;0;0;0
SAN LUIS POTOS;LICENCIATURA EN EDUCACI흁 SECUNDARIA CON ESPECIALIDAD EN MATEM쳆ICAS;48;58;74;132;40;46;86;117;119;236;18;23;41
SAN LUIS POTOS;LICENCIATURA EN EDUCACI흁 SECUNDARIA CON ESPECIALIDAD EN TELESECUNDARIA;135;73;62;135;73;62;135;141;149;290;0;0;0
SAN LUIS POTOS;LICENCIATURA EN EDUCACI흁 SECUNDARIA ESPECIALIDAD EN TELESECUNDARIA;185;76;109;185;76;109;185;76;109;185;0;0;0
SAN LUIS POTOS;LICENCIATURA EN ENFERMER페;682;225;939;1164;134;520;654;357;1588;1945;30;195;225
SAN LUIS POTOS;LICENCIATURA EN ENFERMER페 Y OBSTETRICIA;150;45;158;203;37;108;145;94;371;465;1;38;39
SAN LUIS POTOS;LICENCIATURA EN FILOSOF페;15;9;6;15;4;2;6;22;4;26;4;2;6
SAN LUIS POTOS;LICENCIATURA EN F펩ICA;20;21;0;21;20;1;21;59;24;83;6;5;11
SAN LUIS POTOS;LICENCIATURA EN FISIOTERAPIA;49;18;31;49;16;25;41;48;86;134;0;0;0
SAN LUIS POTOS;LICENCIATURA EN GASTRONOM페;202;81;65;146;46;40;86;166;147;313;24;23;47
SAN LUIS POTOS;LICENCIATURA EN GEOGRAF페;30;16;9;25;12;17;29;61;73;134;6;11;17
SAN LUIS POTOS;LICENCIATURA EN GESTI흁 Y DESARROLLO EMPRESARIAL;35;6;12;18;0;8;8;0;8;8;0;0;0
SAN LUIS POTOS;LICENCIATURA EN GESTI흁 Y POL펪ICAS P２LICAS;60;8;10;18;11;19;30;69;136;205;0;0;0
SAN LUIS POTOS;LICENCIATURA EN GESTI흁 Y TRABAJO SOCIAL;25;3;22;25;1;18;19;3;58;61;5;18;23
SAN LUIS POTOS;LICENCIATURA EN HISTORIA;30;29;20;49;20;10;30;80;42;122;8;5;13
SAN LUIS POTOS;LICENCIATURA EN INFORM쳆ICA;90;5;1;6;0;0;0;217;190;407;75;54;129
SAN LUIS POTOS;LICENCIATURA EN INFORM쳆ICA ADMINISTRATIVA;490;228;244;472;200;222;422;478;563;1041;38;35;73
SAN LUIS POTOS;LICENCIATURA EN INGENIER페 BIOM텏ICA;30;49;54;103;14;16;30;32;28;60;0;0;0
SAN LUIS POTOS;LICENCIATURA EN INGENIER페 DE DESARROLLO DE SOFTWARE;5;10;0;10;5;0;5;9;1;10;0;0;0
SAN LUIS POTOS;LICENCIATURA EN INGENIER페 EN MECATR흁ICA;11;9;2;11;8;1;9;38;6;44;4;0;4
SAN LUIS POTOS;LICENCIATURA EN INGENIER페 EN NEGOCIOS INTERNACIONALES;0;0;0;0;0;0;0;0;0;0;1;3;4
SAN LUIS POTOS;LICENCIATURA EN INGENIER페 EN PROCESOS DE MANUFACTURA;11;8;3;11;5;1;6;5;1;6;0;0;0
SAN LUIS POTOS;LICENCIATURA EN INGENIER페 EN PROCESOS ORGANIZACIONALES;0;0;0;0;0;0;0;0;0;0;1;0;1
SAN LUIS POTOS;LICENCIATURA EN INGENIER페 EN SEGURIDAD COMPUTACIONAL;0;0;0;0;0;0;0;0;0;0;1;0;1
SAN LUIS POTOS;LICENCIATURA EN INGENIER페 EN SISTEMAS COMPUTACIONALES;0;0;0;0;0;0;0;0;0;0;0;0;0
SAN LUIS POTOS;LICENCIATURA EN INGENIER페 EN SISTEMAS DE LOG펩TICA;0;0;0;0;0;0;0;5;6;11;0;0;0
SAN LUIS POTOS;LICENCIATURA EN INGENIER페 INDUSTRIAL;43;59;25;84;59;25;84;129;49;178;27;16;43
SAN LUIS POTOS;LICENCIATURA EN INGENIER페 INDUSTRIAL ADMINISTRADOR;26;20;6;26;5;8;13;20;12;32;2;0;2
SAN LUIS POTOS;LICENCIATURA EN INGENIER페 INDUSTRIAL Y DE SISTEMAS;44;35;9;44;31;8;39;149;29;178;18;5;23
SAN LUIS POTOS;LICENCIATURA EN INGENIER페 MEC쳁ICA AUTOMOTRIZ;100;60;1;61;60;1;61;535;7;542;91;3;94
SAN LUIS POTOS;LICENCIATURA EN INSTRUMENTO;10;10;10;20;4;5;9;22;12;34;6;3;9
SAN LUIS POTOS;LICENCIATURA EN INTERVENCI흁 EDUCATIVA;0;0;0;0;0;0;0;0;0;0;5;22;27
SAN LUIS POTOS;LICENCIATURA EN LEGISLACI흁 COMERCIAL INTERNACIONAL;25;8;3;11;0;0;0;5;3;8;0;0;0
SAN LUIS POTOS;LICENCIATURA EN LENGUA INGLESA;17;4;13;17;4;13;17;10;35;45;4;1;5
SAN LUIS POTOS;LICENCIATURA EN LENGUA Y LITERATURAS HISPANOAMERICANAS;30;21;33;54;14;16;30;45;65;110;0;0;0
SAN LUIS POTOS;LICENCIATURA EN MATEM쳆ICA EDUCATIVA;25;21;10;31;9;16;25;27;41;68;0;0;0
SAN LUIS POTOS;LICENCIATURA EN MATEM쳆ICAS;0;0;0;0;0;0;0;18;25;43;2;6;8
SAN LUIS POTOS;LICENCIATURA EN MATEM쳆ICAS APLICADAS;20;12;9;21;10;8;18;14;9;23;0;1;1
SAN LUIS POTOS;LICENCIATURA EN MEDICINA VETERINARIA Y ZOOTECNIA;55;119;118;237;31;23;54;63;34;97;2;2;4
SAN LUIS POTOS;LICENCIATURA EN M텏ICO CIRUJANO;50;15;35;50;14;33;47;14;33;47;0;0;0
SAN LUIS POTOS;LICENCIATURA EN MERCADOTECNIA;359;152;210;362;91;127;218;331;432;763;55;85;140
SAN LUIS POTOS;LICENCIATURA EN MERCADOTECNIA INTERNACIONAL;218;161;305;466;83;135;218;268;470;738;14;22;36
SAN LUIS POTOS;LICENCIATURA EN NEGOCIOS GASTRON흀ICOS;0;0;0;0;0;0;0;9;14;23;8;9;17
SAN LUIS POTOS;LICENCIATURA EN NEGOCIOS INTERNACIONALES;60;10;10;20;9;8;17;36;40;76;3;4;7
SAN LUIS POTOS;LICENCIATURA EN NUTRICI흁;235;212;404;616;41;130;171;145;533;678;0;0;0
SAN LUIS POTOS;LICENCIATURA EN ODONTOLOG페;100;25;35;60;19;29;48;70;127;197;43;66;109
SAN LUIS POTOS;LICENCIATURA EN PEDAGOG페;413;158;223;381;81;169;250;290;618;908;65;141;206
SAN LUIS POTOS;LICENCIATURA EN PEDAGOG페 EN EDUCACI흁 MEDIA SUPERIOR Y SUPERIOR;8;3;5;8;3;5;8;3;5;8;0;0;0
SAN LUIS POTOS;LICENCIATURA EN PSICOLOG페;639;306;924;1230;144;421;565;507;1442;1949;49;199;248
SAN LUIS POTOS;LICENCIATURA EN PSICOLOG페 CON ACENTUACI흁 EN EL REA CL펥ICA;0;0;0;0;0;0;0;6;25;31;3;12;15
SAN LUIS POTOS;LICENCIATURA EN PSICOLOG페 CON ACENTUACI흁 EN EL REA EDUCATIVA;0;0;0;0;0;0;0;1;7;8;2;6;8
SAN LUIS POTOS;LICENCIATURA EN PSICOLOG페 INDUSTRIAL;60;5;6;11;1;3;4;6;15;21;2;3;5
SAN LUIS POTOS;LICENCIATURA EN PSICOPEDAGOG페;35;10;30;40;5;20;25;5;20;25;0;0;0
SAN LUIS POTOS;LICENCIATURA EN PUERICULTURA;160;0;139;139;0;107;107;2;428;430;0;139;139
SAN LUIS POTOS;LICENCIATURA EN QU펤ICA;25;18;15;33;13;11;24;58;76;134;8;20;28
SAN LUIS POTOS;LICENCIATURA EN RELACIONES COMERCIALES;30;0;0;0;1;2;3;6;4;10;1;6;7
SAN LUIS POTOS;LICENCIATURA EN RELACIONES COMERCIALES INTERNACIONALES;75;5;2;7;0;0;0;0;4;4;1;0;1
SAN LUIS POTOS;LICENCIATURA EN RELACIONES INTERNACIONALES;14;4;10;14;3;6;9;29;43;72;3;3;6
SAN LUIS POTOS;LICENCIATURA EN RELACIONES P２LICAS;13;3;10;13;3;7;10;11;40;51;2;4;6
SAN LUIS POTOS;LICENCIATURA EN SALUD COMUNITARIA;90;20;34;54;20;34;54;68;87;155;0;0;0
SAN LUIS POTOS;LICENCIATURA EN SISTEMAS COMERCIALES Y ADMINISTRATIVAS INTERNACIONALES;50;10;7;17;5;4;9;21;29;50;2;4;6
SAN LUIS POTOS;LICENCIATURA EN SISTEMAS COMPUTACIONALES;11;4;3;7;0;0;0;13;3;16;8;5;13
SAN LUIS POTOS;LICENCIATURA EN SOCIOLOG페;3;1;1;2;1;1;2;13;3;16;1;2;3
SAN LUIS POTOS;LICENCIATURA EN TRABAJO SOCIAL;181;22;132;154;21;131;152;32;389;421;1;53;54
SAN LUIS POTOS;LICENCIATURA EN TURISMO;70;0;3;3;0;1;1;11;18;29;6;10;16
SAN LUIS POTOS;LICENCIATURA EN TURISMO SUSTENTABLE;150;44;85;129;31;71;102;110;248;358;2;2;4
SAN LUIS POTOS;LICENCIATURA EN VENTAS;8;2;4;6;2;4;6;6;14;20;0;0;0
SAN LUIS POTOS;LICENCIATURA INTERNACIONAL EN ADMINISTRACI흁 DE EMPRESAS TUR펩TICAS;56;20;36;56;17;27;44;84;139;223;0;0;0
SAN LUIS POTOS;MEDICINA GENERAL;30;114;123;237;17;13;30;17;13;30;0;0;0
SAN LUIS POTOS;M텏ICO CIRUJANO;232;614;775;1389;93;85;178;574;492;1066;52;54;106
SAN LUIS POTOS;M텏ICO ESTOMAT휿OGO;128;125;271;396;39;89;128;249;546;795;59;85;144
SAN LUIS POTOS;QU펤ICO FARMACOBI휿OGO;83;71;120;191;30;49;79;147;270;417;20;43;63
SAN LUIS POTOS;TRONCO COM＞ EN ADMINISTRACI흁;0;0;0;0;0;0;0;1;1;2;0;0;0
SAN LUIS POTOS;TRONCO COM＞ EN ARTES;43;9;34;43;4;15;19;7;23;30;0;0;0
SAN LUIS POTOS;TRONCO COM＞ EN INGENIER페;10;9;1;10;9;1;10;17;1;18;0;0;0
SAN LUIS POTOS;TRONCO COM＞ EN PSICOLOG페;70;11;28;39;7;26;33;14;53;67;0;0;0
SINALOA;TOTAL;40610;21495;23429;44924;15542;16457;31999;50087;52166;102253;5936;7462;13398
SINALOA;ARQUITECTO;950;524;408;932;344;256;600;1296;1020;2316;210;145;355
SINALOA;ARQUITECTURA;144;90;54;144;77;54;131;318;216;534;25;22;47
SINALOA;BI휿OGO ACUACULTOR;85;77;56;133;69;16;85;208;72;280;36;6;42
SINALOA;CIRUJANO DENTISTA;270;159;316;475;94;176;270;395;741;1136;49;134;183
SINALOA;CONTADOR P２LICO;134;55;79;134;37;73;110;69;121;190;0;0;0
SINALOA;CONTADOR P２LICO AUDITOR;0;7;8;15;1;3;4;7;17;24;2;0;2
SINALOA;CONTADUR페 P２LICA;0;0;0;0;0;0;0;0;0;0;0;0;0
SINALOA;CURSO NIVELATORIO DE ENFERMER페 A LICENCIATURA EN ENFERMER페;88;20;100;120;6;82;88;9;145;154;0;0;0
SINALOA;INGENIER페 AGRON흀ICA;300;290;50;340;252;18;270;884;58;942;115;3;118
SINALOA;INGENIER페 AGRON흀ICA CON ACENTUACI흁 EN FITOTECNIA Y PARASITOLOG페;31;31;0;31;31;0;31;50;0;50;0;0;0
SINALOA;INGENIER페 AMBIENTAL;77;60;17;77;53;15;68;117;49;166;0;0;0
SINALOA;INGENIER페 BIOQU펤ICA;150;90;80;170;76;72;148;328;448;776;43;55;98
SINALOA;INGENIER페 CIVIL;996;1154;149;1303;791;101;892;2726;379;3105;317;44;361
SINALOA;INGENIER페 DE SOFTWARE;315;149;23;172;112;13;125;304;75;379;24;12;36
SINALOA;INGENIER페 EL텎TRICA;80;84;2;86;77;3;80;328;8;336;37;0;37
SINALOA;INGENIER페 ELECTROMEC쳁ICA;0;0;0;0;0;0;0;297;4;301;11;0;11
SINALOA;INGENIER페 ELECTR흁ICA;80;65;1;66;74;3;77;513;21;534;89;3;92
SINALOA;INGENIER페 EN ADMINISTRACI흁 DE RECURSOS HIDR쳇LICOS;0;0;0;0;0;0;0;0;0;0;0;1;1
SINALOA;INGENIER페 EN AGRONEGOCIOS;98;7;1;8;3;0;3;3;0;3;0;0;0
SINALOA;INGENIER페 EN AGROTECNOLOG페;60;36;4;40;30;4;34;30;4;34;0;0;0
SINALOA;INGENIER페 EN BIOTECNOLOG페;120;69;103;172;55;73;128;153;195;348;17;17;34
SINALOA;INGENIER페 EN DESARROLLO DE SOFTWARE;7;5;2;7;5;2;7;24;6;30;1;0;1
SINALOA;INGENIER페 EN DESARROLLO SUSTENTABLE;25;17;12;29;4;6;10;13;20;33;0;0;0
SINALOA;INGENIER페 EN DISE헲 GR첹ICO DIGITAL;193;40;24;64;40;24;64;140;87;227;48;22;70
SINALOA;INGENIER페 EN ELECTROMEC쳁ICA;119;117;2;119;102;2;104;216;5;221;0;0;0
SINALOA;INGENIER페 EN ELECTR흁ICA;138;128;10;138;128;10;138;369;25;394;8;3;11
SINALOA;INGENIER페 EN ELECTR흁ICA Y SISTEMAS DIGITALES;58;33;1;34;33;1;34;86;3;89;12;1;13
SINALOA;INGENIER페 EN ENERG페;30;30;13;43;26;13;39;27;13;40;0;0;0
SINALOA;INGENIER페 EN GEODESIA;103;62;18;80;41;13;54;152;32;184;8;5;13
SINALOA;INGENIER페 EN GESTI흁 EMPRESARIAL;277;122;164;286;125;147;272;275;407;682;0;0;0
SINALOA;INGENIER페 EN INDUSTRIAL EN AUTOMATIZACI흁 Y COMUNICACIONES;0;0;0;0;0;0;0;0;0;0;0;0;0
SINALOA;INGENIER페 EN INDUSTRIAS ALIMENTARIAS;242;142;117;259;120;106;226;243;306;549;0;0;0
SINALOA;INGENIER페 EN INDUSTRIAS ALIMENTARIAS (2010 COMPETENCIAS PROFESIONALES);80;16;18;34;16;18;34;23;29;52;0;0;0
SINALOA;INGENIER페 EN INFORM쳆ICA;184;144;56;200;123;44;167;330;104;434;29;5;34
SINALOA;INGENIER페 EN MANTENIMIENTO INDUSTRIAL;0;0;0;0;0;0;0;19;0;19;19;0;19
SINALOA;INGENIER페 EN MECATR흁ICA;220;134;18;152;111;12;123;635;77;712;62;7;69
SINALOA;INGENIER페 EN NEGOCIOS Y TECNOLOG페S DE INFORMACI흁;0;8;2;10;8;2;10;17;5;22;0;0;0
SINALOA;INGENIER페 EN PESQUER페S;10;3;1;4;3;1;4;32;5;37;1;0;1
SINALOA;INGENIER페 EN PROCESOS INDUSTRIALES;87;102;24;126;64;23;87;168;57;225;0;0;0
SINALOA;INGENIER페 EN PRODUCCI흁 ANIMAL;1;0;1;1;0;1;1;6;3;9;1;0;1
SINALOA;INGENIER페 EN PRODUCCI흁 VEGETAL;1;3;1;4;3;1;4;8;2;10;0;1;1
SINALOA;INGENIER페 EN SISTEMAS COMPUTACIONALES;720;415;172;587;378;135;513;1318;416;1734;68;23;91
SINALOA;INGENIER페 EN SISTEMAS COMPUTACIONALES Y ADMINISTRACI흁 DE EMPRESAS;37;0;0;0;7;3;10;7;3;10;0;0;0
SINALOA;INGENIER페 EN SISTEMAS DE CALIDAD;120;96;52;148;73;35;108;195;126;321;12;11;23
SINALOA;INGENIER페 EN TECNOLOG페S COMPUTACIONALES;0;0;0;0;0;0;0;8;3;11;0;0;0
SINALOA;INGENIER페 EN TECNOLOG페S DE INFORMACI흁 Y COMUNICACIONES;80;41;11;52;42;15;57;86;31;117;3;2;5
SINALOA;INGENIER페 EN TECNOLOG페S ELECTR흁ICAS;0;0;0;0;0;0;0;1;0;1;0;0;0
SINALOA;INGENIER페 EN TELEINFORM쳆ICA;41;10;1;11;10;1;11;37;4;41;17;0;17
SINALOA;INGENIER페 FORESTAL;40;45;15;60;40;13;53;87;34;121;3;7;10
SINALOA;INGENIER페 FORESTAL COMUNITARIA;20;18;12;30;13;12;25;49;41;90;0;0;0
SINALOA;INGENIER페 GEOD텝ICA;80;66;25;91;45;17;62;126;45;171;11;2;13
SINALOA;INGENIER페 INDUSTRIAL;1181;804;306;1110;762;304;1066;2550;1159;3709;220;113;333
SINALOA;INGENIER페 INDUSTRIAL Y DE PROCESOS;26;19;7;26;14;5;19;60;18;78;8;6;14
SINALOA;INGENIER페 INDUSTRIAL Y DE SISTEMAS;150;146;54;200;121;43;164;475;152;627;98;45;143
SINALOA;INGENIER페 MEC쳁ICA;219;254;3;257;260;3;263;830;23;853;64;2;66
SINALOA;INGENIER페 MEC쳁ICO ADMINISTRADOR;0;0;0;0;0;0;0;1;0;1;0;0;0
SINALOA;INGENIER페 MEC쳁ICO ELECTRICISTA;0;1;0;1;1;0;1;1;0;1;0;0;0
SINALOA;INGENIER페 MECATR흁ICA;198;194;13;207;189;8;197;348;27;375;0;0;0
SINALOA;INGENIER페 NAVAL;50;50;1;51;50;1;51;118;10;128;0;0;0
SINALOA;INGENIER페 QU펤ICA;146;100;64;164;59;43;102;197;132;329;15;7;22
SINALOA;LICENCIATURA EN ADMINISTRACI흁;122;49;73;122;49;73;122;160;292;452;5;8;13
SINALOA;LICENCIATURA EN ADMINISTRACI흁 CONTABLE Y FINANCIERA;0;4;3;7;4;3;7;4;3;7;0;0;0
SINALOA;LICENCIATURA EN ADMINISTRACI흁 DE AGRONEGOCIOS;0;30;9;39;22;1;23;57;10;67;6;1;7
SINALOA;LICENCIATURA EN ADMINISTRACI흁 DE EMPRESAS;2475;1248;1387;2635;1040;1172;2212;3357;3767;7124;547;589;1136
SINALOA;LICENCIATURA EN ADMINISTRACI흁 DE EMPRESAS TUR펩TICAS;122;14;29;43;18;32;50;58;137;195;12;30;42
SINALOA;LICENCIATURA EN ADMINISTRACI흁 DE NEGOCIOS;0;13;12;25;12;12;24;64;37;101;28;15;43
SINALOA;LICENCIATURA EN ADMINISTRACI흁 DE RECURSOS HUMANOS;108;44;71;115;40;68;108;133;205;338;7;19;26
SINALOA;LICENCIATURA EN ADMINISTRACI흁 DEL FACTOR HUMANO;0;0;7;7;0;0;0;1;8;9;0;0;0
SINALOA;LICENCIATURA EN ADMINISTRACI흁 FINANCIERA;0;15;5;20;10;3;13;40;16;56;4;1;5
SINALOA;LICENCIATURA EN ADMINISTRACI흁 FISCAL FINANCIERA;0;0;0;0;0;0;0;0;0;0;0;0;0
SINALOA;LICENCIATURA EN ADMINISTRACI흁 HOTELERA;0;0;0;0;0;0;0;0;0;0;1;5;6
SINALOA;LICENCIATURA EN ADMINISTRACI흁 HOTELERA Y NEGOCIOS TUR펩TICOS;0;0;0;0;0;0;0;0;3;3;4;6;10
SINALOA;LICENCIATURA EN ADMINISTRACI흁 HOTELERA Y TUR펩TICA;30;3;7;10;3;7;10;12;44;56;2;28;30
SINALOA;LICENCIATURA EN ADMINISTRACI흁 INDUSTRIAL;0;8;5;13;3;0;3;13;0;13;3;1;4
SINALOA;LICENCIATURA EN ADMINISTRACI흁 TUR펩TICA;291;85;176;261;69;138;207;251;542;793;32;124;156
SINALOA;LICENCIATURA EN ADMINISTRACI흁 Y CALIDAD DEL SERVICIO;98;7;13;20;1;5;6;4;7;11;0;0;0
SINALOA;LICENCIATURA EN ADMINISTRACI흁 Y FINANZAS;161;31;30;61;30;23;53;92;86;178;10;4;14
SINALOA;LICENCIATURA EN ADMINISTRACI흁 Y GESTI흁 DE PYMES;60;24;33;57;24;27;51;24;27;51;0;0;0
SINALOA;LICENCIATURA EN ADMINISTRACI흁 Y MERCADOTECNIA;98;4;6;10;2;2;4;3;10;13;0;0;0
SINALOA;LICENCIATURA EN ADMINISTRACI흁 Y PLANEACI흁 FINANCIERA;30;3;1;4;3;1;4;7;8;15;2;1;3
SINALOA;LICENCIATURA EN AGRICULTURA PROTEGIDA Y BIONEGOCIOS;30;14;2;16;14;2;16;43;2;45;9;0;9
SINALOA;LICENCIATURA EN ANTROPOLOG페 SOCIAL;23;20;20;40;7;16;23;7;16;23;0;0;0
SINALOA;LICENCIATURA EN ARQUITECTURA;154;65;76;141;57;51;108;180;142;322;28;20;48
SINALOA;LICENCIATURA EN ARQUITECTURA EN DISE헲 DE INTERIORES;30;0;0;0;1;27;28;3;70;73;0;8;8
SINALOA;LICENCIATURA EN ARTES PL쳅TICAS;0;0;0;0;0;0;0;34;49;83;6;4;10
SINALOA;LICENCIATURA EN ART펩TICA CON ACENTUACI흁 EN DANZA;80;9;38;47;9;37;46;33;112;145;8;28;36
SINALOA;LICENCIATURA EN BIOLOG페;324;200;150;350;173;143;316;472;413;885;46;41;87
SINALOA;LICENCIATURA EN BIOLOG페 PESQUERA;80;57;30;87;43;11;54;138;66;204;15;12;27
SINALOA;LICENCIATURA EN CANTO;40;1;10;11;1;10;11;9;28;37;1;9;10
SINALOA;LICENCIATURA EN CIENCIAS COMPUTACIONALES;100;60;37;97;60;37;97;156;101;257;28;13;41
SINALOA;LICENCIATURA EN CIENCIAS DE LA COMUNICACI흁;813;263;426;689;221;355;576;658;1207;1865;92;187;279
SINALOA;LICENCIATURA EN CIENCIAS DE LA EDUCACI흁;280;76;309;385;47;205;252;83;421;504;0;0;0
SINALOA;LICENCIATURA EN CIENCIAS DE LA EDUCACI흁 CON ACENTUACI흁 EN ESPA헲L;36;10;57;67;5;31;36;55;196;251;0;0;0
SINALOA;LICENCIATURA EN CIENCIAS DE LA EDUCACI흁 CON ACENTUACI흁 EN MATEM쳆ICAS;35;3;14;17;3;8;11;36;74;110;0;0;0
SINALOA;LICENCIATURA EN CIENCIAS DE LA FAMILIA;20;20;20;40;4;8;12;4;8;12;0;0;0
SINALOA;LICENCIATURA EN CIENCIAS DEL DEPORTE;0;0;0;0;0;0;0;111;27;138;31;3;34
SINALOA;LICENCIATURA EN CIENCIAS POL펪ICAS Y ADMINISTRACI흁 P２LICA;100;57;47;104;52;37;89;118;87;205;5;1;6
SINALOA;LICENCIATURA EN CIENCIAS Y T텎NICAS DE LA COMUNICACI흁;59;8;30;38;5;24;29;25;70;95;12;21;33
SINALOA;LICENCIATURA EN CLARINETE;10;1;0;1;1;0;1;1;0;1;0;0;0
SINALOA;LICENCIATURA EN COMERCIALIZACI흁 AGROPECUARIA;36;36;20;56;23;13;36;93;42;135;8;5;13
SINALOA;LICENCIATURA EN COMERCIO EXTERIOR CON ASIA/PACIFICO;20;3;3;6;3;3;6;10;13;23;3;1;4
SINALOA;LICENCIATURA EN COMERCIO EXTERIOR Y ADUANAS;105;51;39;90;47;37;84;142;124;266;29;26;55
SINALOA;LICENCIATURA EN COMERCIO INTERNACIONAL;435;138;174;312;101;133;234;409;460;869;52;87;139
SINALOA;LICENCIATURA EN COMERCIO INTERNACIONAL Y ADUANAS;67;4;4;8;16;12;28;23;37;60;17;18;35
SINALOA;LICENCIATURA EN COMPOSICI흁;10;0;0;0;0;0;0;1;0;1;1;0;1
SINALOA;LICENCIATURA EN COMUNICACI흁;37;0;0;0;4;14;18;6;19;25;0;0;0
SINALOA;LICENCIATURA EN COMUNICACI흁 E IMAGEN P２LICA;50;0;0;0;0;0;0;7;10;17;0;0;0
SINALOA;LICENCIATURA EN COMUNICACI흁 GR첹ICA;25;0;0;0;0;0;0;2;10;12;4;3;7
SINALOA;LICENCIATURA EN CONTADOR P２LICO;0;2;1;3;0;0;0;7;13;20;3;4;7
SINALOA;LICENCIATURA EN CONTADUR페;160;66;92;158;44;67;111;202;388;590;11;22;33
SINALOA;LICENCIATURA EN CONTADUR페 P２LICA;1436;846;1001;1847;565;705;1270;2115;2774;4889;308;436;744
SINALOA;LICENCIATURA EN CONTADUR페 P２LICA FINANCIERA;0;0;0;0;0;0;0;0;0;0;0;0;0
SINALOA;LICENCIATURA EN CONTADUR페 P２LICA FISCAL;77;60;60;120;23;54;77;105;262;367;24;48;72
SINALOA;LICENCIATURA EN CONTADUR페 P２LICA Y FINANZAS;0;0;0;0;0;0;0;0;1;1;4;7;11
SINALOA;LICENCIATURA EN CONTADUR페 Y FINANZAS;159;66;93;159;51;66;117;172;217;389;35;58;93
SINALOA;LICENCIATURA EN CORNO;10;0;0;0;0;0;0;1;0;1;0;0;0
SINALOA;LICENCIATURA EN COSMEATR페 Y DISE헲 DE IMAGEN;200;0;27;27;0;27;27;0;65;65;0;0;0
SINALOA;LICENCIATURA EN COSMETOLOG페;12;0;12;12;0;12;12;0;45;45;0;8;8
SINALOA;LICENCIATURA EN CREACI흁 Y DESARROLLO DE EMPRESAS;0;10;6;16;7;5;12;42;28;70;0;0;0
SINALOA;LICENCIATURA EN CRIMINAL펩TICA;576;267;160;427;267;160;427;757;503;1260;137;102;239
SINALOA;LICENCIATURA EN CRIMINOLOG페;38;13;15;28;11;13;24;14;16;30;0;0;0
SINALOA;LICENCIATURA EN CULTURA F펩ICA;295;380;70;450;249;46;295;752;160;912;77;10;87
SINALOA;LICENCIATURA EN CULTURA F펩ICA Y DEPORTE;78;65;6;71;65;6;71;79;9;88;0;0;0
SINALOA;LICENCIATURA EN CULTURA, F펩ICA Y DEPORTE;30;26;4;30;25;4;29;55;6;61;9;3;12
SINALOA;LICENCIATURA EN DANZA CONTEMPOR쳁EA;28;29;48;77;19;19;38;33;67;100;7;3;10
SINALOA;LICENCIATURA EN DERECHO;2329;1801;1474;3275;1318;917;2235;4963;3589;8552;648;594;1242
SINALOA;LICENCIATURA EN DERECHO Y ASUNTOS INTERNACIONALES;0;0;0;0;0;0;0;16;13;29;20;12;32
SINALOA;LICENCIATURA EN DERECHO Y CIENCIAS SOCIALES;202;126;76;202;118;64;182;279;172;451;45;33;78
SINALOA;LICENCIATURA EN DESARROLLO EMPRESARIAL;55;6;12;18;5;5;10;13;20;33;0;0;0
SINALOA;LICENCIATURA EN DESARROLLO EMPRESARIAL Y DE NEGOCIOS;128;100;100;200;57;71;128;128;173;301;0;0;0
SINALOA;LICENCIATURA EN DESARROLLO HUMANO CON ACENTUACI흁 EN EDUCACI흁;0;0;0;0;0;0;0;0;0;0;2;7;9
SINALOA;LICENCIATURA EN DESARROLLO ORGANIZACIONAL;30;0;20;20;0;5;5;0;22;22;0;0;0
SINALOA;LICENCIATURA EN DIPLOMACIA Y NEGOCIOS INTERNACIONALES;25;2;2;4;0;0;0;3;3;6;0;0;0
SINALOA;LICENCIATURA EN DIRECCI흁 DE NEGOCIOS;20;12;8;20;9;7;16;35;22;57;8;13;21
SINALOA;LICENCIATURA EN DIRECCI흁 DE VENTAS Y MERCADOTECNIA;0;4;7;11;3;7;10;3;7;10;0;0;0
SINALOA;LICENCIATURA EN DISE헲 DE INTERIORES;79;7;66;73;2;53;55;3;132;135;0;15;15
SINALOA;LICENCIATURA EN DISE헲 DE LA COMUNICACI흁 GR첹ICA;61;20;31;51;17;24;41;73;124;197;18;27;45
SINALOA;LICENCIATURA EN DISE헲 DE MODAS;0;0;0;0;0;0;0;0;0;0;0;2;2
SINALOA;LICENCIATURA EN DISE헲 GR첹ICO;176;34;52;86;44;69;113;145;188;333;47;54;101
SINALOA;LICENCIATURA EN DISE헲 GR첹ICO DIGITAL;35;6;10;16;6;10;16;50;44;94;9;8;17
SINALOA;LICENCIATURA EN DISE헲 GR첹ICO EMPRESARIAL;118;70;70;140;59;59;118;171;134;305;0;0;0
SINALOA;LICENCIATURA EN DISE헲 GR첹ICO PUBLICITARIO;0;0;0;0;0;0;0;20;24;44;12;15;27
SINALOA;LICENCIATURA EN DISE헲 GR첹ICO Y ANIMACI흁;17;4;13;17;4;13;17;20;48;68;0;0;0
SINALOA;LICENCIATURA EN DISE헲 GR첹ICO Y MULTIMEDIA;80;43;20;63;39;20;59;73;56;129;0;0;0
SINALOA;LICENCIATURA EN DISE헲 GR첹ICO Y PUBLICITARIO;25;5;10;15;2;6;8;18;26;44;11;10;21
SINALOA;LICENCIATURA EN DISE헲 INDUSTRIAL;30;11;10;21;11;10;21;24;20;44;1;5;6
SINALOA;LICENCIATURA EN DISE헲 Y COMUNICACI흁 VISUAL;50;9;17;26;6;14;20;15;30;45;2;4;6
SINALOA;LICENCIATURA EN DISE헲 Y DECORACI흁 DE INTERIORES;0;0;0;0;0;0;0;8;1;9;0;0;0
